title,text,url,published_time
Priscilla Presley watched camel 'attack' her son just days before Lisa Marie’s death: ‘She was traumatized’,"Navarone Garcia, son of Priscilla Presley and half-brother to the late Lisa Marie Presley, almost died in front of his mother after being ""attacked"" by a camel at a California animal sanctuary mere days before his big sister's untimely death, according to the musician.

Garcia, 35, was feeding the camel and when he ran out of food, the animal, which had been previously abused in a circus, became agitated and ""pounced"" on him, all while Priscilla watched on in horror, he said.

In an interview with People magazine, he recalled the camel, who he estimated weighed around 2,000 pounds, ""bit me by the hand and lifted me up almost off my feet. It then dropped me on the ground and pounced. While it was pouncing on me, it literally got my whole head in its mouth and bit me.""

While the attack was happening, he stated that his mother was ""freaking out,"" and that ""she was traumatized.""

PRISCILLA PRESLEY SPEAKS OUT ON WHAT WOULD HAVE BEEN LISA MARIE'S 55TH BIRTHDAY

To make matters worse, due to the camel's weight, sanctuary workers were not able to free Garcia – in the end, it was a dog roaming nearby that saved the day.

As he explained it, ""The dog knew something was wrong and was freaking out and going at its face. That's what got the camel off.""

PRISCILLA PRESLEY THANKS FANS FOR SUPPORT AFTER DEATH OF DAUGHTER LISA MARIE: ‘A DARK, PAINSTAKING JOURNEY’

After the attack, Garcia elected to return home to Los Angeles to visit an emergency room there, where he received 34 staples in his head.

While that day very easily could have ended up much worse, tragedy did strike the family days later on Jan. 12 when Lisa Marie passed away at the age of 54.

PRISCILLA PRESLEY DISPUTES LISA MARIE PRESLEY'S TRUST

""I mean, I was happy I survived before,"" Garcia said, ""but now it's like, thank God I survived. My mom would've lost two kids in two weeks.""

In a statement to Fox News Digital earlier this week, Priscilla stressed how important it is to her now to ""keep our family together.""

""From the first moment I held Lisa in my arms, I’ve protected, loved and guided her, as I have my son,"" she stated. ""Our hearts are broken, and I am having to learn to live without my only daughter. We truly love all of you, and we feel your prayers. Thank you so much for caring so deeply for our family.""

CLICK HERE TO GET THE FOX NEWS APP

Despite some squabbles over the legitimacy of Lisa Marie's will, it appears that the family is putting on a united front.

CLICK HERE TO SIGN UP FOR THE ENTERTAINMENT NEWSLETTER

According to earlier statements from Garcia, Riley Keough, Lisa Marie's oldest daughter, ""has been so good with"" her younger siblings, 14-year-old twins Harper and Finley.

The whole family was also seen together mourning Lisa Marie at her public memorial service at Graceland, Elvis' famous estate, on Jan. 22.",https://www.foxnews.com/entertainment/priscilla-presley-watched-camel-attack-son-days-before-lisa-marie-death,N/A
"Dave Chappelle ‘fully cooperating’ with police in ‘unfortunate and unsettling’ incident, comedian’s rep says","Dave Chappelle refuses to let Tuesday night's physical attack ""overshadow the magic"" of his four performances, a representative for the comedian told Fox News Digital Wednesday.

""Dave Chappelle celebrated four nights of comedy and music, setting record-breaking sales for a comedian at the Hollywood Bowl,"" his representative said in a statement obtained by Fox News Digital. ""This run ties Chappelle with Monty Python for the most headlined shows by any comedian at the Hollywood Bowl, reaching 70k fans of diverse backgrounds during the first ‘Netflix Is A Joke: The Festival,’ and he refuses to allow last night’s incident to overshadow the magic of this historic moment.

""As unfortunate and unsettling as the incident was, Chappelle went on with the show. Jamie Foxx and Chris Rock helped calm the crowd with humor before Chappelle introduced the last and featured musical guests for the evening, hip-hop artists Yasiin Bey and Talib Kweli, a.k.a. ‘Black Star,’ who performed music from their new album – the first in nearly 24 years – which was released on Luminary. Other special comedic guests last night included Earthquake, Leslie Jones, Jeff Ross, Sebastian, Jon Stewart and Michelle Wolf.""

The rep confirmed that Chappelle is fully cooperating with police as the investigation continues.

The suspect in Chappelle's onstage attack was arrested Tuesday around 10:50 p.m. after he allegedly stormed the stage and tackled the comedian. He was subsequently charged with assault with a deadly weapon, the Los Angeles Police Department confirmed to Fox News Digital Wednesday.

Isaiah Lee, 23, was carrying a replica gun with a knife blade inside when he attacked Chappelle during the Hollywood Bowl show, police say. Authorities describe him as a Black male with black hair and brown eyes, who stands 5 feet, 11 inches tall and weighs about 140 pounds. The suspect, who lives in the Los Angeles area, is being held on $30,000 bail.

Chappelle was performing as part of his ""Netflix is a Joke"" tour when he was attacked.

Videos of the incident showed Lee jumping on stage and tackling Chappelle. The suspect was injured and taken from the venue in an ambulance.

COMEDIAN DAVE CHAPPELLE ATTACKED ON STAGE WHILE PERFORMING AT HOLLYWOOD BOWL IN LOS ANGELES

He was swiftly taken away by security and other individuals, who repeatedly hit the man just off stage, videos appear to show.

A spokesperson for Netflix told Fox News Digital: ""We care deeply about the safety of creators, and we strongly defend the right of stand-up comedians to perform on stage without fear of violence.""

Immediately following the attack, Chappelle remained on stage and thanked security, before joking about the incident and describing the person who attacked him as a ""trans man.""

CLICK HERE TO SIGN UP FOR THE ENTERTAINMENT NEWSLETTER

Chappelle makes several jokes about the trans community in his standup routine and even boasted during Tuesday night’s performance that he has been recently forced to increase his security amid new threats.

The attack took place toward the end of Chappelle's stand-up routine. The comedian thanked both Busta Rhymes and Jamie Foxx for helping out following the attack.

""Whenever you're in trouble, Jamie Foxx will show up in a sheriff's hat,"" he told the audience.

CLICK HERE TO GET THE FOX NEWS APP

Comedian Chris Rock, who was slapped in the face by Will Smith while onstage at the Oscars, also appeared on the stage. After Chappelle was attacked onstage, Rock joked, ""Was that Will Smith?""

Fox News' Lawrence Richard contributed to this report.",https://www.foxnews.com/entertainment/suspect-dave-chappelle-on-stage-attack-arrested-charged-assault-deadly-weapon-hollywood-bowl,N/A
Heart attack risk can be found through non-invasive calcium score screening scan,"A screen for heart disease is available that may determine your risk of heart disease even before you show signs or symptoms, health experts told Fox News. According to the American heart association, (AHA), this test, also known as a coronary artery calcium (CAC) test, takes CAT scan images of the blood vessels that support the heart muscle. The test looks for buildup of calcified plaque that can affect the flow of blood to the heart. The calcium is composed of cholesterol, fats, calcium and other substances in the blood and is different from the calcium in bones, according to the AHA.

The test involves a CT-scan of the chest that takes about ten minutes to perform and then a score representing the amount of plaque present is assigned to the patient. A higher CAC test score suggests you may be at a higher risk for future heart attack and have a higher chance of significant narrowing in the coronary arteries, according to health experts at the Cleveland Clinic. Depending on your score, your physician will determine the appropriate treatment for you that may include medication or a procedure.

DOES A DAILY ASPIRIN HELP OVER 60S AVOID HEART DISEASE AND STROKE? EXPERT RECOMMENDATIONS JUST CHANGED

Health experts said a CAC score of zero means you have no plaque in your arteries and are at low risk for a heart attack. A score from one to 100 is associated with a low to medium risk of a heart attack, and your doctor may recommend lifestyle changes and some other treatment. Scores ranging from 101 to 300 suggest that you may have plaque that is blocking an artery and your chance of having a heart attack is moderate to high, typically warranting further evaluation and treatment. Scores over 300 suggest a large amount of plaque and your chance of heart attack is high. Your healthcare practitioner will likely want immediate follow-up testing and to start treatment at that level, according to health experts.

""A high calcium score correlates quite well with coronary heart disease. It’s not invasive and is a good screening test and sensitive,"" Dr. Ismail El-Hamamsy, MD, PhD, a Randall B. Griepp Professor of cardiovascular surgery and system director of aortic surgery at Mount Sinai Hospital in New York City, told Fox News during an interview. The physician did caution that CAC testing may create anxiety with the potential for over diagnosis and added, ""There will be false positives but you push the investigation further to rule it out."" Dr. El-Hamamsy said tests like a stress test, angiogram, among others, are often used to rule out coronary artery disease following certain CAC scores that indicate a patient may be at risk for disease.

The cardiovascular surgeon also said individuals should be aware of symptoms of coronary artery disease. These include chest pain, pain that radiates to neck, jaw, and left arm as well as shortness of breath, palpitations and fatigue.

DIABETES DRUG LEAD TO SIGNIFICANT WEIGHT LOSS IN PEOPLE WITH OBESITY: STUDY

Mike Esse is 69 years old and told Fox News that discussions about available screening tests like CAC testing can save a life. He should know - one discussion he attributed to saving his own life.

Esse explained to Fox News that during a round of golf he told his golf friends that he was taking medication for heart disease and would eventually need one stent due to a ""clogged artery."" That was when Esse’s golf partner told him about how he just had a calcium score test performed and that the test picked up a blockage. ""That led to him getting a stent in his heart and he felt better in just a matter of days,"" Esse told Fox News.

Discussing the calcium test sparked Esse to re-evaluate his own treatment course. He decided to ask a physician about the test and it led to further evaluation, which ""turned the entire conversation around."" The tests revealed Esse needed not one stent, but a triple bypass surgery due to three blocked arteries. ""That conversation about that calcium score test saved my life,"" Esse told Fox News.

CLICK HERE TO GET THE FOX NEWS APP

According to the Cleveland clinic, your doctor may suggest a CAC test if you:

Have a family history of heart conditions

Have high cholesterol, high blood pressure, or diabetes

Are overweight and lead a sedentary lifestyle

Are middle-aged

History of smoking

Health experts told Fox News it is important to speak to your doctor to see if a CAC test is appropriate for you. Experts say you do not need to have symptoms to get this procedure.",https://www.foxnews.com/health/heart-attack-risk-calcium-score-screening-scan,N/A
Hunter in Georgia recovering after three dogs attacked him 'in a complete frenzy',"A man in Georgia is recovering after three dogs attacked him in January while he was attempting to take down his hunting equipment.

The man, a 61-year-old businessman from Atlanta who wished to be identified only as ""Scott B.,"" was moving his ladder stand when he noticed three dogs approaching him, he told Field & Stream magazine.

The attack took place north of Jefferson, Georgia, in the northeastern part of the state.

Scott B. said he'd been hunting at that location for seven years.

FACEBOOK COMMUNITY RUSHES TO AID GEORGIA BOY WHO WAS MAULED BY THREE PIT BULLS

""One of them came in and attacked me. When it did, the other two joined in,"" he said about the dogs.

Two of the dogs were pit bull mixes, while the other was a German shepherd mix, he told Field & Stream.

The dogs were attacking in ""kind of like a wolf mentality"" and ""were in a complete frenzy,"" he said.

""I was doing anything I could to fight them off,"" he told the publication.

The dogs attacked him for about 15 minutes, Scott B. said, before he was able to fight them off with a large stick.

Scott B. explained that he was unarmed and had left his cell phone on his all-terrain vehicle, which was 150 yards away from his ladder stand.

Doctors at the emergency room told Scott B. he had 298 puncture wounds and needed stitches in seven different places.

While fighting off the dogs, he was able to move toward another ladder stand — where he apparently then climbed to safety.

DOGS THAT FATALLY MAULED TENNESSEE TODDLERS, INJURED MOM WERE NEVER VIOLENT, FRIEND SAYS

""They were still biting me, but spinning with that stick kept them from teaming up and keeping me stuck in one place,"" he told Field & Stream.

""As I was going up the ladder stand, I told myself that I really needed to hold on tight to the rungs because the dogs are going to be jumping on my backside and trying to pull me down — and if they did, I’d probably never get away,"" he said.

Scott B. stayed in the ladder stand for about half an hour before attempting to leave.

The dogs, however, were still in the area, and they chased him back up the stand — where he stayed for another half hour.

Eventually, Scott B. was able to run safely to the highway and was able to get the attention of a passing car.

""I just yelled out, ‘I’ve been attacked by a pack of dogs, and I need medical help,'"" he told Field & Stream.

Doctors at the emergency room told Scott B. that he had 298 puncture wounds and needed stitches in seven different places. He also had a severed ligament in his hand.

After he released from the emergency room, Scott B. filed a report with the Jackson County Sheriff's Office.

The three dogs were identified and put into a 10-day rabies quarantine.

The three dogs were euthanized on Feb. 3, the Athens-Banner Herald reported.

Their owner was given citations for owning a dangerous animal, the same outlet reported.

While his physical wounds will heal, Scott B. said that he is hopeful he will once again be able to enjoy the sport he loved.

CLICK HERE TO SIGN UP FOR OUR LIFESTYLE NEWSLETTER

""I love being in the woods and this attack has certainly had an impact on me psychologically and mentally. I just hope I can go out in the woods again and enjoy myself,"" Scott B. told the Athens-Banner Herald.

CLICK HERE TO GET THE FOX NEWS APP

He also said that during any future hunting trips, he will make sure he's accompanied by other hunters — and will be carrying additional weapons to prevent any future animal attacks.

Fox News Digital has attempted to reach the victim of the attack for further details.",https://www.foxnews.com/lifestyle/hunter-georgia-recovering-three-dogs-attacked-him-complete-frenzy,N/A
Shark attack survivor is on a mission to protect these animals: 'Fear can be a powerful motivator',"Paul de Gelder of California lost two limbs in a sudden and awful shark attack in February 2009 while taking part in a routine underwater exercise as an elite Australian Navy clearance diver.

Others in such a position — after suffering this devastating loss — may have wanted little or nothing to do with sharks.

Yet de Gelder developed a completely different view. He wanted to get closer to the animal — and learn all he could about it.

CLOSE CALL! HAWAII DIVER NEARLY LANDS IN TIGER SHARK'S OPEN MOUTH IN THIS VIDEO

Today, he's passionately devoted to saving sharks all over the world partly because of ""the ripple effect"" their existence has on humans.

He is someone, he said, who ""had my life changed in a very violent, painful and dramatic way,"" he told Fox News Digital in a phone interview a few days ago from his home in California.

""And if I can come from a place where I knew nothing about sharks, I didn't care about them — I figured, if we wiped them all out, then we wouldn't have to worry about being eaten — to going through what I went through and then understanding how actually important they are to the oceans, to the ecosystems and to us as well — if I can work that out, then surely my passion about this subject will relay down onto other people so that they'll want to understand and learn more and protect these animals as well.""

""Fear can be a very powerful motivator … My fear was that I was going to lose my career.""

He added, ""As Steve Irwin said — and this is something that has always stuck with me — ‘If you can make someone fall in love with something, they’ll want to protect it.'""

SHARK CIRCLES NEAR UNSUSPECTING SWIMMERS

And so, ""really my goal here is just to show people the other side of sharks and my really amazing stories about them,"" he said, ""so that they'll potentially fall in love with them and want to protect them, just like I do and all of my friends do on ‘Shark Week.’""

He's doing so every day, through his motivational speaking, his new book, ""Shark: Why We Need to Save the World’s Most Misunderstood Predator"" (HarperCollins), his work for the Discovery Channel on ""Shark Week"" — and countless other endeavors in which he shares his passion for the animal.

Tried to fight back

While de Gelder was on a training exercise as a Navy diver in Sydney Harbor more than 10 years ago, a 9-foot bull shark grabbed him by his arm and leg.

He tried to fight back but was pulled underwater and violently shaken.

Then the shark ripped off most of de Gelder's right arm as well as his right leg.

He spent time during his long, hard recovery learning all about sharks.

""Fear can be a very powerful motivator sometimes,"" he said. ""And my fear was that I was going to lose my career.""

He added, ""I had fought so hard to drag myself up and out of a life where I felt I had no purpose or value, to joining the [Australian] Army and becoming a paratrooper, passing selection for the elite clearance divers and then having this amazing life and purpose — and then, in eight seconds, having all of that stolen away [during the shark attack].""

So it was fear, he said, ""of going back to that life of not having any purpose to training my absolute butt off to prove to the Navy that I could still do my job.""

He said, ""I pulled that off after six months, when a lot of people said it was impossible.""

He left full-time military service in 2012 and was a reserve Navy diver for a few years.

He said he'd have his best buddy taken him to the gym so he ""could work out and learn to use my body again.""

CALIFORNIA PHOTOGRAPHER SNAPS PIC OF SHARK JUMPING OUT OF WATER BEHIND SURFER

He also said, ""Technology is incredible these days. And the military gave me all the best prosthetics I needed to be able to walk and get exercise and all that. So I used all the tools at my disposal.""

He said he left full-time military service in 2012 and was a reserve Navy diver for a few years.

""Now I live in LA and travel around America speaking and working on ‘Shark Week'"" for the Discovery Channel.

He is also engaged to be married to ""an amazing American girl,"" he said.

How to help

In his view, what can the average person do in regard to sharks and conservation efforts?

""There's a bunch of things that people can do,"" he said.

""Down at the very basic level, for those who don't travel that much or may be landlocked but also love sharks — they can follow all the pages that support shark conservation. They can share the information that they provide and they can sign petitions.""

While ""this may seem small,"" he said, ""the way that things change is when a lot of people do small things consecutively.""

So ""signing these petitions actually really does make a difference in studies for when we want to get more sharks put under the protection act or when we want to change legislation to protect sharks.""

He added, ""The petitions were part of the reason, he said, that America has just come out and said there will be no exports or imports of shark fins, ever — and so, those things really do make a difference.""

""The way that things change is when a lot of people do small things consecutively.""

He also said, ""If you're a little more adventurous — you can go into the shark tourism industry. You can provide your time and have an amazing experience — and that supports them and their conservation efforts.""

He also said that ""moments"" spent near and around sharks — safely, of course — ""are priceless.""

As part of his travels as shark advocate and passionate environmentalist, he has given talks to the United Nations, the U.S. Navy and large corporations and charities.

Now, read these two exclusive excerpts from de Gelder's new book.

‘The perfect predator’ from ‘Sharks’

Paul de Gelder: As a kid I used to dream about a shark eating me alive. But when that nearly happened in 2009, as I encountered that bull shark in Sydney Harbor, it was not a fun experience whatsoever.

That day I found myself on a different tier in the food chain to the one which I’m accustomed to.

You see, we may have cars and phones and even space stations, but when it comes to being a lonely predator, we humans are pretty useless.

""Though some sharks have good eyesight, their sensory organs enable them to detect even the smallest movement or scent before they even see what caused it.""

We’re slow. We’re not as agile as our food.

We’re not even very strong. Our brain and our ability to work together have helped us survive and thrive as a species, but without tools we are a very lame predator.

TEXAS FAMILY'S RING DOORBELL CAMERA CAPTURES BOBCAT PERCHED ON THEIR BACKYARD FENCE: ‘I WAS TERRIFIED’

Not the shark. Millions of years of glorious evolution have crafted the shark into the perfect predator.

Their streamlined body allows them to cruise through the water like a torpedo when it’s time to strike their prey. Their rough skin is so incredibly adapted to swimming that human swimmers have been banned from using imitations of it in competitions.

Though some sharks have good eyesight, their sensory organs enable them to detect even the smallest movement or scent before they even see what caused it. Sharks’ sense of smell is so powerful that they can home in on mates and dinner from miles away.

CLICK HERE TO SIGN UP FOR OUR LIFESTYLE NEWSLETTER

Their teeth are like rows of the most expensive knives, perfectly adapted for killing their prey — bent back and needle-like for fish, thick and jagged for marine mammals — with powerful snapping jaws or wide gaping mouths depending on the diet of the particular species of shark.

‘Held them hostage' from ‘Sharks’

Paul de Gelder: Of all the creatures on our wonderful planet, I would argue that none has captured the human imagination quite like the shark.

In fact, sharks have kidnapped our imaginations, held them hostage and led to more nightmares than probably any other animal that’s ever existed (a close second would probably be spiders).

Why are we so terrified about being in the water with them?

""What’s out there? Is it hungry? Will it get me? A new environment can always be a little scary.""

You are thousands and thousands of times more likely to die from falling down the stairs than being eaten by a shark, but do you break into a cold sweat every time you go upstairs? When you’re on the stairs, are you in a constant state of fear, worrying what could happen at any second?

For almost all of us the answer is no, but I’m sure most of us have felt that feeling of fear and dread as we step into the ocean. What’s out there? Is it hungry? Will it get me?

A new environment can always be a little scary, and so you can understand why someone who grew up in a landlocked city would be wary of the ocean, but I grew up in and around the sea, and I was bloody terrified of sharks.

CLICK HERE TO GET THE FOX NEWS APP

Why?

Humans have a very powerful imagination.

First published by HarperCollins UK Publishers, 2022. Excerpted from ""Sharks"" by Paul de Gelder with permission of the publisher.

Former elite soldier and shark attack survivor Paul de Gelder is a host for the Discovery Channel’s ""Shark Week."" He was also a key personality in Netflix’s ""Seaspiracy,"" and hosts the podcast ""The Dirt Down Under.""",https://www.foxnews.com/lifestyle/shark-attack-survivor-mission-protect-animals-fear-motivator,N/A
