title,text,url,published_time
Russian arms dealer swapped for Brittney Griner praises Ukraine invasion and wants to join the fighting,"Viktor Bout, the arms dealer who was returned to Russia in a prisoner swap for U.S. citizen Brittney Griner, praised his country’s invasion of Ukraine and said it should have happened earlier, according to state television.

During an interview on Russian propaganda outlet Russia Today (RT), Bout said, ""any Russian person"" should approve of Russia’s ""special military operation"" and that he would have joined the fighting if he was able.

""To be honest, I couldn’t even understand why we did not do it earlier,"" he said Saturday on RT. ""Why in 2014, you know, there were demonstrations in Kharkiv, people were carrying enormous tricolors and shouting, ‘Russia, Russia, Russia,’ in Donbas and Odesa, as well, you know!""

He added: ""Yes, clearly the conditions were not right and we were not ready, but I would have supported it wholeheartedly.""

BRITTNEY GRINER LANDS BACK IN US AFTER BIDEN ADMIN'S CONTROVERSIAL PRISONER SWAP

Bout later told host Maria Butina that if he ""had the opportunity and necessary skills"" he ""would have gone"" joined the fighting as a volunteer. According to the Ukraine government, approximately 94,000 Russian troops have been killed in the fighting, as of Dec. 11.

The Russian losses include nearly 6,000 armored personnel vehicles, nearly 3,000 tanks, and nearly 2,000 artillery systems.

WHO IS VIKTOR BOUT, RUSSIA'S 'MERCHANT OF DEATH' FREED IN PRISONER SWAP FOR BRITTNEY GRINER?

During the same interview, Bout said Western countries, including the U.S., were seeking to ""destroy"" and ""divide"" Russia.

""The West believes that they did not finish us off in 1990, when the Soviet Union began to disintegrate... They think that they can just destroy us again and divide Russia,"" he said, according to the Moscow Times.

As for Griner, Bout said he ""wished her luck"" following their prisoner swap in Abu Dhabi on Thursday, Dec. 9. Both were returned to their respective countries within 24 hours.

""Again, it's our tradition. You should wish everyone good fortune and happiness,"" he added, per Reuters.

RUSSIAN STATE TELEVISION MOCKS U.S. FOR BRITTNEY GRINER PRISONER EXCHANGE

CLICK HERE TO GET THE FOX NEWS APP

The Russian, who is dubbed the ""Merchant of Death,"" was previously convicted of arms trafficking, conspiring to kill Americans, and money laundering.

Griner was convicted by a Russian court of carrying vape cartridges containing cannabis oil in Russia, where cannabis is banned.

",https://www.foxnews.com/world/russian-arms-dealer-swapped-brittney-griner-praises-ukraine-invasion,N/A
Russia invades Ukraine in largest European attack since WWII,"Russian forces invaded Ukraine on Thursday by land, air and sea in the largest military attack of one state against another on the European continent since the Second World War.

Russia’s all-out attack on Ukraine has killed at least 57 people and wounded 169 during the first day of President Vladimir Putin's full-scale invasion, Ukraine’s Health Minister Oleh Lyashko said Thursday.

President Biden said Thursday afternoon that he’s reached a full agreement with G7 leaders to limit Russia’s ability to be part of the global economy, stunt their ability to finance and grow Russia’s military and impair their ability to compete in a high-tech, 21st century economy.

RUSSIA INVADES UKRAINE: LIVE UPDATES

In a public address from the White House, Biden said Putin has much larger ambitions than Ukraine and wants to ""reestablish the Soviet Union.""

Secretary of Defense Gen. Lloyd Austin ordered the deployment of approximately 7,000 additional U.S. troops to Germany in a move aimed at bolstering NATO defense and deterring Russian aggression.

The wide-ranging attack on Ukraine hit cities and bases with airstrikes or shelling, as civilians piled into trains and cars to flee the country. Ukraine's government said Russian tanks and troops rolled across the border in a ""full-scale war"" that could rewrite the geopolitical order.

After several hours of fierce battle, Russian forces seized control of the Chernobyl nuclear power plant, and Ukrainian President Volodymyr Zelenskyy earlier Thursday raised concerns of repeated of the 1986 disaster.

A senior U.S. Defense Department official told reporters earlier Thursday that Putin’s goal appears to be seizing the capital of Kyiv, ""decapitating the government"" and ""installing his own method of governance.""

He claimed Putin indicated this himself during his overnight speech.

RUSSIA INVADES UKRAINE: LIVE UPDATES

According to the U.S. Embassy Riga, U.S. troops from the Army’s 173rd Airborne Brigade arrived in Latvia Thursday morning. They were the first U.S. forces being repositioned to the Baltics to demonstrate the U.S. commitment to Allies and bolster NATO’s eastern flank.

next Image 1 of 3

prev next Image 2 of 3

prev Image 3 of 3

However, the defense official emphasized that, ""U.S. troops are not going to be fighting the war in Ukraine."" The U.S. military has no aircraft in Ukrainian airspace as of Wednesday morning, he said.

Russia has launched more than 100 ballistic missiles into Ukraine since its initial onslaught overnight. Starting around 9:30 p.m. EST Wednesday, Russian forces began launching missiles from land and sea-based platforms from the Black Sea toward key cities in central and eastern Ukraine, the official said.

The official said Russian forces were fighting all three major axes ""designed to take key population centers."" The heaviest fighting has been occurring near an axis from northeast of Ukraine to the south, starting from Belarus to an advance on the Ukrainian city of Kharkiv.

next Image 1 of 4

prev next Image 2 of 4

prev next Image 3 of 4

prev Image 4 of 4

A second axis extends from north central Ukraine to the south from Belarus toward Kyiv. A third axis in the south is spreading from Crimea, which Russia annexed in 2014, to the Ukrainian city of Kherson.

Ukrainian Ambassador to the U.S., Oksana Markarova, called for Russia to be removed from SWIFT, or the Society for Worldwide Interbank Financial Telecommunication, and for allies to support them through devastating financial sanctions against Russia, through defensive anti-air supplies, and by cutting all diplomatic ties with Russia.

Recognizing Ukraine is not a member of NATO, Markarova said she did not expect U.S. troops to defend Ukraine but expected other support give their ""strategic friendship.""

RUSSIA CRACKS DOWN ON ANTI-WAR PROTESTS, MORE THAN 1,700 DEMONSTRATORS ARRESTED

British Prime Minister Boris Johnson condemned Russia's attack on Ukraine before the House of Commons Thursday and moved to freeze assets of Russian banks. He announced the ""largest ever"" set of sanctions against Russia and vowed to eliminate Europe's reliance on Russian oil and gas.

Anti-Russian demonstrations have popped up across Europe and in the U.S. in cities including New York, London, Dublin, Edinburgh, Paris and Berlin. Meanwhile, Russian authorities began cracking down on anti-war protests across the country, reportedly arresting more than a thousand demonstrators in several cities.

Ukraine Foreign Minister Dmytro Kuleba said the country severed diplomatic relations with Russia and called ""on all our partners to do the same. By this concrete step you will demonstrate that you stand by Ukraine and categorically reject the most blatant act of aggression in Europe since WWII.""

While the attack on Ukraine was largely condemned by the West, it’s unclear whether forces will intervene, something Russian President Vladimir Putin warned would show grave consequences. NATO is sending additional forces to bolster defenses in eastern Europe.

Oleksiy Arestovich, an adviser to Zelenskyy, said Thursday about 40 people have been killed so far in the Russian attack on the country, The Associated Press reported. Several dozen people have been wounded. He didn’t specify whether casualties included civilians.

Zelenskyy said he would be providing weapons to citizens who want to help defend the country, instructing them on Twitter to ""be ready to support Ukraine in the squares of our cities.""

RUSSIA INVADES UKRAINE IN LARGEST EUROPEAN ATTACK SINCE WWII

""The future of the Ukrainian people depends on every Ukrainian,"" he said Thursday, urging all those who can defend the country to come to the Interior Ministry’s assembly facilities.

Russia ""has embarked on a path of evil,"" the president said, but Ukraine ""is defending itself & won't give up its freedom no matter what Moscow thinks."" Zelenskyy said sanctions would be lifted ""on all citizens of Ukraine who are ready to defend our country as part of territorial defense with weapons in hands.""

""Russia treacherously attacked our state in the morning, as Nazi Germany did in #2WW years,"" Zelenskyy tweeted. ""As of today, our countries are on different sides of world history.""

The attacks came first from the air. Later, Ukrainian authorities described ground invasions in multiple regions, and border guards released security camera footage Thursday showing a line of Russian military vehicles crossing into Ukraine’s government-held territory from Russian-annexed Crimea in the south.

In the north, video showed tanks rolling over the border from the Russian ally of Belarus through Senkivka. Russian forces also landed in the port cities of Odessa and Mariupol.

The Russian military claimed to have wiped out Ukraine’s entire air defenses in a matter of hours, and European authorities declared the country's airspace an active conflict zone.

Russia's claims could not immediately be verified, nor could Ukrainian ones that it had shot down several Russian aircraft, according to The Associated Press. The Ukrainian air defense system and air force date back to the Soviet era and are dwarfed by Russia’s massive air power and precision weapons.

Western counties were anticipating hundreds of thousands of people to flee from the attack on Ukraine, Reuters reported. Highways outside of Kyiv swelled with traffic Thursday leading to Poland, and lines of people waited for gasoline, to withdraw money or to purchase other supplies, such as food and water.

Kyiv Mayor Vitaly Klitschko advised residents to stay home unless they are involved in critical work and urged them to prepare go-bags with necessities and documents if they need to evacuate.

next Image 1 of 3

prev next Image 2 of 3

prev Image 3 of 3

Ukraine said columns of Russian troops were passing over the border into the Ukrainian regions of Chernihiv, Kharkiv and Luhansk, Reuters reported. Russian missiles also targeted several Ukrainian cities, and explosions could be heard before dawn in the capital of Kyiv, home to 3 million people.

After weeks of denying plans to invade, Putin justified his actions in an overnight televised address, asserting that the attack was needed to protect civilians in eastern Ukraine — a false claim the U.S. had predicted he would make as a pretext for an invasion. He accused the U.S. and its allies of ignoring Russia’s demands to prevent Ukraine from joining NATO and for security guarantees.

In a reminder of Russia’s nuclear power, Putin said ""no one should have any doubts that a direct attack on our country will lead to the destruction and horrible consequences for any potential aggressor.""

Among Putin’s pledges was to ""denazify"" Ukraine. World War II looms large in Russia, after the Soviet Union suffered more deaths than any country while fighting Adolf Hitler’s forces. Kremlin propaganda sometimes paints Ukrainian nationalists as neo-Nazis seeking revenge — a charge historians call disinformation. Ukraine is now led by a Jewish president who lost relatives in the Holocaust.

CLICK HERE TO GET THE FOX NEWS APP

The head of the National Police of Ukraine on Thursday raised all units to combat alarm and warned civilians not to go outside in uniform or tactile clothing and to report all suspicious objects or people, especially those with red items on their clothing, to a special police line.

Zelenskyy has declared martial law in the country.

""Regarding the aggression of the Russian Federation in Ukraine, police have intensified measures to ensure law and order on the streets,"" Ukrainian national police said in a statement. ""The Head of the National Police of Ukraine also ordered the issuance of weapons to the veterans of Internal Affairs who have expressed willing to protect Ukraine from the Russian Federation's armed aggression.""

The Associated Press contributed to this report.",https://www.foxnews.com/world/russian-invades-ukraine-largest-europe-attack-wwii,N/A
Russian invasion: What is NATO's Article 5?,"President Biden on Wednesday met with leaders of NATO nations dubbed the Bucharest 9 (B9) – which flank the eastern front and stand as the first line of defense against Russia – to reaffirm the alliance's commitment to Article 5 and the protections it grants all member nations.

Article 5 of NATO’s Washington Treaty, known as ""the principle of collective defense,"" obliges all member countries to come to the aid of another member whose sovereignty or territorial integrity is under threat.

NATO defines this core principle as ""very heart of NATO’s founding treaty.""

""Collective defense means that an attack against one Ally is considered as an attack against all Allies,"" the NATO charter outlines. ""It remains a unique and enduring principle that binds its members together.""

WHAT VICTORY FOR UKRAINE LOOKS LIKE BEYOND BORDER SECURITY: CHIEF DEFENSE ADVISER

The war in Ukraine has dragged on for nearly a year, far outstripping what Russian President Vladimir Putin thought of Ukraine's defenses or NATO's ability to remain a united front.

However, it has also increased concerns regarding what the threat of a prolonged war means for European security and whether the conflict could spill over into NATO territory.

""As NATO's eastern flank, you're on the front lines of our collective defense,"" Biden said to B9 leaders. ""And you know better than anyone what's at stake in this conflict, not just for Ukraine, but for the freedom of democracies throughout Europe and around the world.

""I've said it to you many times, I'll say it again [so its] absolutely clear. Article 5 is a sacred commitment the United States has made. We will defend literally every inch of NATO. Every inch,"" he added.

However, Ukraine is not a NATO member country.

While Ukraine has contributed to NATO operations and missions in Bosnia-Herzegovina, Kosovo, Iraq, Afghanistan and elsewhere, this is not enough to warrant the full protection of all NATO nations.

While NATO has pledged to back Ukraine with defensive aid to win the war against Russia, it has stopped short of sending in boots on the ground – a stipulation only afforded to the 30-member nations.

Ukrainian President Volodmyr Zelenskyy said Kyiv had applied to become a member of NATO in September, which would serve as a deterrent against future Russian aggression.

Though the NATO charter stipulates that no nation can be fully considered or accepted as a member while it is engaged in conflict.

Putin has claimed that he was prompted to launch his ""special military operation"" into Ukraine over the threat that Kyiv and NATO posed in expanding the alliance – an excuse Western officials have flatly rejected.

RUSSIA DECRIES UKRAINE'S CALLS FOR NATO-LIKE SECURITY COALITION AS 'PROLOGUE' TO WWIII

NATO chief Jens Stoltenberg has said it is Ukraine's right to seek membership and has refused Russian attempts to blackball Kyiv from being able to join the alliance.

Biden on Wednesday was not alone is his steadfast commitment not only to NATO, but to Ukraine during the Wednesday meeting.

Romania President Klaus Iohannis, who helped establish the B9 in 2015 in wake of Russia's aggression in Eastern Europe following the 2014 invasion of Ukraine and subsequent illegal annexation of Crimea, echoed Biden's commitments.

""We…the leaders of the eastern flank have the duty to stand firm in defense of our peace. We must continue to stand firm in delivering on our commitments to support Ukraine for as long as it needs to win this war,"" he said. ""This is what Romania will continue to do.

""We are not alone in this endeavor,"" he added.

The meeting of the NATO leaders came not only as the war nears the one-year anniversary of Russia's invasion of Ukraine, but followed the pronouncement by Secretary of State Antony Blinken at the Munich Security Conference over the weekend, when he said the U.S. is concerned that Moscow is now turning to China for lethal aid.

Security officials are greatly concerned by the threat China's participation in the war would bring as it would not only change the dynamic on the battlefield in Ukraine but would force European nations to cut economic ties and further strain relations between China and the West.

This geopolitical divide between democracies and autocracies would create its own challenges, particularly as it relates to security concerns over Taiwan.

China has denied it is considering aiding Russia in its war effort, though Moscow received Beijing's top diplomat Tuesday for discussions on the war.

CLICK HERE TO GET THE FOX NEWS APP

""We must break the cycle of Russian aggression,"" Stoltenberg warned. ""We don't know when the war will end, but when it does, we need to ensure that history does not repeat itself.

""We have seen the Russian pattern of aggression over many years: Georgia in 2008, Crimea and Donbas in 2014, and then the full-fledged invasion of Ukraine last year,"" he added. ""We cannot allow Russia to continue to chip away at European security.",https://www.foxnews.com/world/russian-invasion-what-nato-article-5-treaty,N/A
Russian oil executive who criticized Ukraine invasion dead after reportedly falling out of hospital window,"The chairman of Russian oil giant Lukoil, who along with his company had criticized the Ukraine invasion, reportedly died Thursday after falling from the sixth-floor window of a hospital in Moscow.

Ravil Maganov died in what sources are calling a possible suicide after his body was found on the ground of Moscow's elite Central Clinical Hospital, according to Russian news reports.

A statement from Lukoil said Maganov ""passed away after a severe illness,"" but did not give any further information.

Citing an unnamed law enforcement source, state news agency Tass reported that Maganov committed suicide after having been admitted to the hospital following a heart attack. News outlet RBK also reported that police were investigating the chairman's death as a possible suicide.

When Russia invaded Ukraine, the board of Lukoil was one of few companies that urged for a swift end to the armed conflict, calling it a ""tragedy"" and expressing sympathy for its victims.

PUTIN CRITIC LIVING IN EXILE FOUND DEAD OUTSIDE UPSCALE DC APARTMENT AFTER POLICE RESPONSE TO ‘JUMPER’ CALL

Former Defense Intelligence Agency officer Rebekah Koffler, author of the book ""Putin's Playbook,"" told Fox News Digital that ""we will never know exactly what happened to Maganov,"" but noted that death by defenestration is ""standard Russian intelligence playbook"" regarding the doctrine of ""wet affairs,"" the translation of a Russian term referring to operations that spill blood.

""The ‘wet affairs’ are targeted assassinations,"" Koffler said. ""Russia and previously the former Soviet Union are known for orchestrating mysterious deaths of the Kremlin’s opponents. It’s done in various ways — shots in the back of the head, poisonings, forced suicides and other intricate forms of violent death. I have a whole section in my book describing this doctrine and with examples of high-profile cases.""

PUTIN FURIOUS OVER US 'HEGEMONY,' SAYS END OF 'UNIPOLAR WORLD ORDER' IS ON THE HORIZON

Explaining that the Russian news agencies are mostly controlled or at least influenced by the Russian government, Koffler noted that Russian media ""couldn’t keep its story straight today on what happened to Maganov.""

""Interfax said he died, having fallen out of a window and Tass wrote that it was suicide. Yet another paper speculated that he was trying to go out of a balcony to get a smoke. The truth is these tactics are designed deliberately to be stealthy, so no investigator could identify foul play. They are usually deemed ‘tragic accidents.’ Also part of the doctrine,"" she said.

Maganov's death follows a similar mysterious death in August, when Soviet-born businessman and Putin critic Dan Rapoport reportedly jumped to his death from his upscale Washington, D.C., apartment. Like Maganov, Rapoport had publicly criticized the Russian invasion of Ukraine. A former top manager of Lukoil was found dead in the basement of a residence in a Moscow suburb in May.

The Associated Press contributed to this report.",https://www.foxnews.com/world/russian-oil-executive-criticized-ukraine-invasion-dead-reportedly-falling-hospital-window,N/A
Russian pilot killed on eve of Ukraine invasion anniversary after supposed ‘malfunction’ strikes jet,"A Russian pilot was killed on the eve of Russia's Ukraine invasion anniversary on Wednesday when his plane suffered a ""mechanical malfunction,"" a commonly-used Russian explanation for being downed.

The Russian SU-25 aircraft crashed roughly 10 miles past the Ukrainian border in Russia's Belgorod region while on its way back from a combat mission, regional governor Vyacheslav Gladkov said. The pilot ejected from the plane before it crashed, but officials say he suffered injuries and died, according to Russian media.

""A plane of the Ministry of Defense crashed in the Valuysky urban district. Now an investigation team and officials of the Ministry of Emergency Situations are working on the spot,"" Gladkov said in a statement.

""After completing a combat mission, a SU-25 aircraft of the Russian Aerospace Forces crashed while returning to its base airfield in the Belgorod Region. The pilot died,"" Russia's Defense Ministry wrote in a statement, according to Russian media.

BIDEN VOWS TO ‘DEFEND LITERALLY EVERY INCH OF NATO’ TERRITORY: ‘ARTICLE 5 IS A SACRED COMMITMENT’

RUSSIAN UNION SUSPENDED FROM INTERNATIONAL FEDERATION OF JOURNALISTS FOR ACTIONS FOLLOWING UKRAINE INVASION

The incident came on the eve of the one-year anniversary of Russia's invasion of Ukraine, which lands on Thursday. Ukrainian officials have warned for months that Russian forces plan to renew their offensive sometime around the anniversary.

Ukrainian defense officials also warned of a potential massive missile attack that could land on the anniversary or in the days following.

""Yes, it will be tough, and we have to be ready for it. We must maintain maximum calm,"" Oleksiy Danilov, the head of Ukraine’s National Security and Defense Council, told Ukrainian TV last week, according to The Wall Street Journal.

U.S. defense officials have agreed with Ukrainian President Volodymyr Zelenskyy's warnings, saying it is likely Putin will try an offensive in an effort to turn the tables after months of Ukraine regaining territory.

""The situation on the front line is complicated,"" Zelenskyy said in a sit-down interview with Fox News’ Trey Yingst earlier in February. ""Russia is preparing for the rematch. We can feel this. I believe that it has already started or not fully. We will see that in the nearest weeks.""

CLICK HERE TO GET THE FOX NEWS APP",https://www.foxnews.com/world/russian-pilot-killed-eve-ukraine-invasion-anniversary-supposed-malfunction-strikes-jet,N/A
