title,text,url,published_time
"Ukraine invasion: Russian troops stalled north of Kyiv, running out of gas and food: US official","Russian forces' movement towards the Ukrainian capital city of Kyiv is currently ""stalled,"" a senior U.S. defense official said Tuesday morning, citing a variety of factors, including a lack of food for Russian troops.

With Russia having committed now more than 80% of their assembled combat power, they have made little substantial movement toward Kyiv in the past 24 hours, the official said.

KEVIN MCCARTHY RIPS BIDEN ADMIN FOR LACK OF ACTION IN UKRAINE: ‘WE COULD HAVE DETERRED THIS'

""It doesn’t appear to be making a lot of progress,"" the official said, discussing the movement on the capital.

The official said in explaining the Russian's lack of progress, while ""some of it has to do with their own sustainment and logistics,"" some of it is also due to the Ukrainian resistance.

The official said that the U.S. has observed that there are ""some morale problems"" in some parts of the Russian military, as they face not just fuel and food problems, but greater resistance than anticipated.

INFLUENCER IN RUSSIA GOES VIRAL DEMONSTRATING HOW TO DRIVE AN ABANDONED ARMORED VEHICLE

A significant number of Russian troops in Ukraine are conscripts, typically young men without much training or knowledge when it comes to combat operations. The official could not confirm reports that any Russian troops have defected, or that any have intentionally run out of gas.

The official noted that Russia's current lack of progress may not be only due to problems arising from resistance or their own logistics, and they are ""possibly regrouping, rethinking, reevaluating"" before carrying on again.

CLICK HERE TO GET THE FOX NEWS APP

Discussing weapons capabilities, the official could not confirm reports that Russia was utilizing cluster munitions, although the U.S. had seen video footage meant to support such a claim. What the official did say was that Russia has ""launcher systems that could be used for a thermobaric weapon,"" although they could not confirm the use or presence of such a weapon.

More than 80% of the pre-staged Russian combat power is now inside Ukraine, up from less than 75% on Monday, the official said. Russia has made gains in the southern part of Ukraine and is currently occupying the cities of Malitopol and Berdyansk, according to the official.",https://www.foxnews.com/politics/ukraine-invasion-russian-troops-stalled-north-of-kyiv-running-out-of-gas-food,N/A
White House declares Russian invasion in Ukraine,"The White House is now calling Russian action in Ukraine an ""invasion,"" saying the ""swift and severe"" sanctions promised by the U.S. are on the way, Fox News has learned.

Russian troops arrived in eastern Ukraine hours after Russian President Vladimir Putin announced that he would recognize the independence of two separatist regions, officials said.

RUSSIA-UKRAINE: WHITE HOUSE DECLARES RUSSIAN 'INVASION', SAYS SANCTIONS COMING: LIVE UPDATES

Russian troops entered in Donbas, the name for the area where the two separatist regions, that have long fought Russia-backed rebels, Donetsk and Luhansk, are located, officials said, noting that they ""consider Donbas part of Ukraine.""

The Kremlin then raised the stakes further Tuesday, by saying that recognition extends even to parts held by Ukrainian forces.

A White House official told Fox News that administration officials are calling it an invasion.

""The invasion has begun,"" the official said. ""So our sanctions response has begun.""

RUSSIAN TROOPS MOVED INTO EASTERN UKRAINE'S BREAKAWAY REGIONS, EUROPEAN OFFICIALS SAY

Deputy National Security Adviser Jon Finer, during an interview on CNN Tuesday morning, was pressed on whether Russia’s latest activities would be considered an invasion.

""We think this is, yes, the beginning of an invasion, Russia’s latest invasion into Ukraine, and you're already seeing the beginning of our response that we have said will be swift and severe,"" Finer said.

When pressed again, Finer said: ""I hear an invasion as an invasion and that is what is underway.""

But Finer noted that Russia has been ""invading Ukraine since 2014"" and have been occupying a ""large piece"" of Ukraine since then as well.

""Although they have denied it, Russian troop presence in exactly the two—what they call republics, but they’re really provinces of a sovereign Ukraine—that they recognized yesterday,"" Finer said, referring to Putin’s recognition of the independence of Donetsk and Luhansk.

""So, Russia is essentially making overt what it has denied for some time, which is Russian troop presence in these places, and we’re taking steps in response to that,"" Finer said.

Pressed further, Finer again called the activities an invasion.

RUSSIA-UKRAINE: GERMANY STOPPING NORD STREAM 2 PIPELINE APPROVAL

""I mean, again, I guess for the third or fourth time, I am calling it an invasion,"" he said. ""We are taking a severe response, including sanctions on Russia that will be rolling out in a matter of hours.""

As for sanctions, Finer told CNN that the public is ""already seeing the beginning of our response that we have said will be swift and severe.""

Finer pointed to President Biden’s executive order on Monday, which he said effectively blocked ""all economic activity"" in Donetsk and Luhansk.

Finer said administration officials later Tuesday would announce ""additional sanction steps"" that they plan to take ""that go directly at Russia"" in response to ""the egregious step that they took yesterday away from diplomacy and down the further path toward war.""

White House press secretary Jen Psaki on Tuesday morning said President Biden has ""made clear that if Russia invaded Ukraine, we would act with Germany to ensure Nord Stream 2 does not move forward.""

Germany overnight said it is taking steps to halt the process of certifying the Nord Stream 2 gas pipeline from Russia over Moscow’s latest actions in eastern Ukraine.

""We have been in close consultations with Germany overnight and welcome their announcement,"" Psaki added. ""We will be following up with our own measures today.""

The 764-mile pipeline that would carry natural gas from Russia to Germany has not begun operating. Nord Stream 2 is owned and operated by a wholly owned subsidiary of Russia state company Gazprom.

Earlier this month, Biden promised to ""bring an end"" to Nord Stream 2 if Russia invaded Ukraine. German Chancellor Olaf Scholz, appearing with Biden on his first official visit to Washington, was far less explicit about stopping Nord Stream 2, but said that the U.S. and Germany would have the same approach on punishing Russia financially.

The Nord Stream 2 has seen a faster development and deployment despite sanctions placed on it by the Trump administration. With those sanctions removed, Germany remains keen to see the pipeline activated sooner rather than later.

Scholz had insisted that the pipeline is a ""business project,"" according to German outlet DW.

Biden last year removed sanctions on the Nord Stream 2 pipeline, allowing construction and activation to proceed.

The plan to allow Russia to develop the pipeline to create leverage in times of political crisis may have backfired, as Germany has also rapidly grown dependent on the completion and activation of the pipeline.

CLICK HERE TO GET THE FOX NEWS APP

Meanwhile, senior administration officials told reporters on Monday evening that they will ""continue to pursue diplomacy until the tanks roll.""

""We're under no illusions about what is likely to come next,"" one official said. ""And we are prepared to respond decisively when it does.""

Fox News' Mark Meredith, Greg Norman, Paul Conner and The Associated Press contributed to this report.",https://www.foxnews.com/politics/white-house-russian-invasion-ukraine,N/A
Russia-Ukraine war: Alex Ovechkin finds sympathy from Capitals GM amid invasion,"Washington Capitals general manager Brian MacLellan defended star forward Alex Ovechkin Wednesday amid pressure Russian players throughout the NHL are facing following Russia’s attacks on Ukraine, saying he’s a ""good person"" who's been put in a ""hard situation.""

Ovechkin, a known supporter of Russian President Vladimir Putin, was instantly placed in the spotlight last week after news of Russia’s invasion into Ukraine broke early Thursday morning. Since then, Ovechkin has had multiple sponsors distance themselves from him, including hockey equipment giant CCM and MassMutual, which said this week they will no longer feature him in marketing initiatives.

HALL OF FAMER DOMINIK HASEK CALLS ON NHL TO ‘SUSPEND’ RUSSIAN PLAYERS, SLAMS ALLEX OVECHKIN AS ‘A CHICKEN S---‘

But MacLellan expressed sympathy for Ovechkin and other Russian players.

""It's difficult for all the Russian players in the league,"" MacLellan said via NBC Sports Washington ""There's a lot of pressure put on them to have a political opinion either way, and they're trying to balance out how they live their lives and what their political opinions are and the repercussions that could happen back home.""

CLICK HERE FOR MORE SPORTS COVERAGE ON FOXNEWS.COM

""[Ovechkin's] a good person, he's an emotional person, and he takes things personally,"" MacLellan added. ""I think he's been put under an incredible amount of pressure. You know, for us, it's about how do we support him.

""He's been the face of our franchise and the face of hockey in this area, his family has grown up here, his kids are from here, and because of his status, he's put in a hard situation to probably handle — a situation that I'm not sure that he's fully thought out or that anybody has, really. It's hard for him.""

Ovechkin, who was previously made unavailable for reporters ahead of last week’s game against the New York Rangers , spoke to reporters after Friday’s team practice, saying he hopes the conflict in Ukraine will ""end soon"" but seemingly avoided distancing himself from Putin.

CLICK HERE TO GET THE FOX NEWS APP

""Well, he is my president. But how I said, I am not in politics. I am an athlete, and you know, how I said, I hope everything is going to be done soon,"" Ovechkin said. ""It's (a) hard situation right now for both sides and everything. Everything I hope is going to end. I'm not in control of this situation.""

For now, MacLellan says all he can do is offer his support.

""We talk to him,"" MacLellan said. ""He gets pressure from all sides — from North America, from Russia, from family, from a lot of different people — and he tries to sort it out. So, we try to support him. We talk to him, we have people talking to him all the time. What can we do to help? Help him through what he needs to get through.""",https://www.foxnews.com/sports/capitals-alex-ovechkin-russian-invasion,N/A
Russian soccer player Artem Dzyuba speaks out on Ukraine invasion in response to criticism,"Artem Dzyuba, the captain of Russia’s national soccer team, broke his silence on Russia’s invasion of Ukraine Wednesday, calling the war ""terrifying"" but taking aim at other players who he says have ""shocked"" him with their ""aggression and hate.""

Dzyuba, who plays for Zenit Saint Petersburg, issued a lengthy statement on Instagram saying he never intended to speak on the Russian-led attacks on Ukraine because he is ""not an expert in politics"" but was forced to address the situation after being ""pushed to this topic from many sides.""

He seemed to be referring to Everton’s Vitaliy Mykolenko, who called Dzyuba out on social media this week for remaining silent.

RUSSIA-UKRAINE WAR: UKRAINIAN ATHLETES DIE DURING INVASION

""I didn't want to comment about the events in Ukraine until the very last moment,"" a translation of Dzyuba’s post via SkySports said. ""I didn't want to, not because I am afraid, but because I am not an expert in politics. I was never involved in it, and I was never going to be (contrary to many political scientists and virologists that have recently appeared on the Internet). But as any other person I have my own opinion. And I will voice it because I've been pushed to this topic from many sides.""

""War is terrifying. I am shocked by human aggression and hate, which is moving to a larger scale every day,"" he continued. ""I am against discrimination based on your nationality. I am not ashamed to be Russian. I am proud to be Russian. I don't understand why athletes have to suffer now.

""I am against double standards. Why are some allowed everything, but we are blamed for everything? Why does everyone always say that sport is apolitical, but with the first opportunity, when it concerns Russia, this principle is absolutely forgotten?""

CLICK HERE FOR MORE SPORTS COVERAGE ON FOXNEWS.COM

Dzyuba took special aim at players who have seemingly called him out for his silence – most notably Mykolenko.

""P.S. To some of my colleagues, who sit on their a---s in their mansions in England and say nasty things: that cannot offend us, we understand it all! Peace and kindness to everyone!""

Mykolenko, a Ukrainian soccer player who previously played for Dynamo Kyiv, called out Dzyuba directly in a social media post on Tuesday.

CLICK HERE TO GET THE FOX NEWS APP

""Whilst you remain silent b---- along with your s---head football team-mates, peaceful civilians are being killed in Ukraine,"" he wrote, via Yahoo Sports . ""You will be locked in your dungeon for the rest of your life and most importantly the lives of your kids. And I'm glad.""

Russia and Belarus have been isolated by the international sports community over the last week with players and teams refusing to play against both nations, prompting sports federations to ban those teams or players from competitions.

Both FIFA and UEFA announced that Russia would be banned from all international competitions until further notice, including World Cup qualifier matches later this month.",https://www.foxnews.com/sports/russian-soccer-artem-dzyuba-ukraine-invasion-criticism,N/A
Ukraine war: Putin loses World Taekwondo black belt over invasion,"Russian President Vladimir Putin was stripped of his World Taekwondo black belt following his invasion of Ukraine.

World Taekwondo announced Monday that Putin’s attacks on the eastern European nation go against the organization’s motto – ""Peace is More Precious than Triumph.""

CLICK HERE FOR MORE SPORTS COVERAGE ON FOXNEWS.COM

""World Taekwondo strongly condemns the brutal attacks on innocent lives in Ukraine, which go against the World Taekwondo vision of ‘Peace is More Precious than Triumph’ and the World Taekwondo values of respect and tolerance,"" the sport’s governing body said in a statement.

""In this regard, World Taekwondo has decided to withdraw the honorary 9th dan black belt conferred to Mr. Vladimir Putin in November 2013.""

World Taekwondo said Russian or Belarusian flags or national anthems would not be displayed at future events.

""In solidarity with the International Olympic Committee, no Russian or Belarusian national flags or anthems will be displayed or played at World Taekwondo events. World Taekwondo and the European Taekwondo Union will not organize or recognize Taekwondo events in Russia and Belarus.""

RUSSIA FACING SPORTS ISOLATION OVER INVASION OF UKRAINE

""World Taekwondo’s thoughts are with the people of Ukraine and we hope for a peaceful and immediate end to this war.""

Putin’s status as honorary president and ambassador for the International Judo Federation was also suspended on Sunday.

""In light of the ongoing war conflict in Ukraine, the International Judo Federation announces the suspension of Mr. Vladimir Putin’s status as Honorary President and Ambassador of the International Judo Federation,"" the organization said in a statement.

Putin had used the sport to project an image of strength.

CLICK HERE TO GET THE FOX NEWS APP

On Tuesday, Russia had moved into Kharkiv, Ukraine, with military strikes. The advancement on Ukraine’s second-largest city had left multiple people dead.

The Associated Press contributed to this report.",https://www.foxnews.com/sports/ukraine-war-putin-black-belt-invasion,N/A
"Armed North Carolina man attempts home invasion, gets shot in neck by homeowner: police","A North Carolina man is in critical condition after being shot by a property owner during an attempted home invasion, police say.

The Mount Airy Police Department said Joshua Murphy, 41, was at home Tuesday afternoon when Daniel Brown entered through his front door armed with a handgun, the Mount Airy News reported.

""Once Brown came through the front door, he was confronted by Joshua Murphy, who fired one shot, striking Brown in the neck,"" police said in a statement obtained by the newspaper.

LOUISIANA WOMAN SHOOTS AND KILLS HOME INVASION SUSPECT TO PROTECT HER CHILDREN, POLICE SAY

""Officers responded to the residence and located the homeowner, Joshua Wade Murphy…standing in the front yard of his residence armed with a shotgun,"" the statement added. ""There was a white male lying in the front yard who had sustained a single gunshot wound to the neck.""

NORTH CAROLINA FAMILY OUTSMARTS THIEVES WITH APPLE AIRTAG: ‘THEY PICKED THE WRONG CAR’

First responders took Brown to a local hospital, where he was last reported to be in critical condition.

CLICK HERE TO GET THE FOX NEWS APP

As of Friday, no charges have been filed yet in the case.

The Mount Airy Police Department did not immediately respond to a request for comment from Fox News Digital.",https://www.foxnews.com/us/armed-north-carolina-man-attempts-home-invasion-shot-neck-homeowner-police,N/A
"Florida mom, bikini model defends family in gunfight during armed home invasion","A Florida bikini model grabbed a pistol and got into a shootout with armed home invasion suspects who broke in while her husband, 7-year-old son and their friends were watching the NBA Finals, according to local reports.

Ansley Pacheco, 26, was in the bathroom when two men broke in, and forced her family and friends to the floor at gunpoint, according to Miami's WPLG-TV.

Home surveillance video shows the suspects surprising a friend of Pacheco’s in the driveway before pushing him inside, where a group was watching the game.

The suspects made everyone in the living room get on the floor.

But another camera shows Pacheco in a bedroom. She grabs an object from a nightstand and can be heard yelling at the suspects.

“I just knew that I had to do something, and my first instinct was to grab the gun and defend my husband and my son,” she told WPLG.

In the video, she shouts, “Don’t shoot me, my son is in here,” then gunshots ring out.

Pacheco told Miami FOX affiliate WSVN-TV that the suspects opened fire.

After an exchange, the suspects reportedly fled, and Pacheco’s husband, identified by WSVN as Daniel Pacheco, took the gun from her.

An exterior camera captured him chasing the suspects down the driveway before they sped off as more shots were fired. They reportedly stole watches and jewelry.

Miami-Dade police confirmed they responded to an armed home invasion robbery the night of Oct. 4 on 86th Avenue.

Pacheco told local outlets that she did not know the suspects, and they remain at large. Miami-Dade Crime Stoppers is offering a potential $1,000 reward in the case.

No one was injured – but the homeowner said that’s not the point.

CLICK HERE FOR THE FOX NEWS APP

“They could’ve killed me,” Pacheco told WSVN. “They could’ve killed my son. They were shooting right over his head. They didn’t care.”

Pacheco models on various social media platforms and websites, including OnlyFans and Instagram. Two photographers with whom she has worked did not immediately respond to Fox News requests for comment.",https://www.foxnews.com/us/florida-mom-bikini-model-defends-family-gunfight,N/A
Gen. Milley says Kyiv could fall within 72 hours if Russia decides to invade Ukraine: sources,"Chairman of the Joint Chiefs of Staff Gen. Mark Milley told lawmakers that Kyiv could fall within 72 hours if a full-scale Russian invasion of Ukraine takes place, multiple congressional sources tell Fox News.

Milley told lawmakers during closed-door briefings on Feb. 2 and 3 that a full-scale Russian invasion of Ukraine could result in the fall of Kyiv within 72-hours, and could come at a cost of 15,000 Ukrainian troop deaths and 4,000 Russian troop deaths.

Several lawmakers expressed concern that the Biden administration did not respond quickly to provide Ukraine with significant military aid, such as anti-aircraft and rocket launcher systems that would defend against an invasion from Russia.

US COMBAT SOLDIERS LAND IN POLAND AMID RUSSIA-UKRAINE TENSIONS

Biden administration officials at the meetings responded to these concerns by saying that a significant supply of military aid to Ukraine could be used as a reason to invade Ukraine.

While Ukraine is receiving security assistance from the United States through a $200 million allocation made in December, it is also receiving $600 million in assistance from the United Kingdom and Baltic states, which the country is depending heavily upon and includes anti-tank Javelin missiles and older-version Stinger portable anti-aircraft missiles.

BIDEN OFFICIALS SAY THOSE QUESTIONING US APPROACH TO UKRAINE ARE SPOUTING RUSSIAN DISINFORMATION

Several Biden administration officials were present at the briefings, including Secretary of State Anthony Blinken, Secretary of Defense Lloyd Austin, Director of National Intelligence Avril Haines, Chairman of the Joint Chiefs of Staff Gen. Mark Milley, Homeland Security Secretary Alejandro Mayorkas, Deputy Treasury Secretary Wally Adeyemo, Deputy Commerce Secretary Don Graves, and USAID Deputy Administrator Ambassador Isobel Coleman.

CLICK HERE TO GET THE FOX NEWS APP

The United States is also working to make preparations for a significant refugee and migrant crisis, one person familiar with the planning said. European allies are also leading discussions on housing and migrant flows under the assumption that Ukrainian nationals would flee to other portions of Europe.",https://www.foxnews.com/us/gen-milley-says-kyiv-could-fall-within-72-hours-if-russia-decides-to-invade-ukraine-sources,N/A
George W. Bush makes unfortunate Iraq gaffe when condemning Putin's Ukraine invasion,"Former President George W. Bush made an eye-catching gaffe regarding Iraq while condemning Russian President Vladimir Putin's invasion of Ukraine.

Bush delivered remarks regarding the importance of democracy and threats to democracy in the U.S. and abroad.

""In contrast, Russian elections are rigged,"" he said. ""Political opponents are imprisoned or otherwise eliminated from participating in the electoral process. The result is an absence of checks and balances in Russia and the decision of one man to launch a wholly unjustified and brutal invassion of Iraq. I mean of Ukraine.""

Bush shrugged and said, under his breath, ""Iraq, too."" Russia has not invaded Iraq, and the Kremlin reportedly gave Saddam Hussein's government intelligence to combat the U.S. invasion early on.

BUSH CALLS ZELENSKYY ‘THE CHURCHILL OF OUR TIME’

""Anyway, 75,"" Bush added, referring to his age.

Bush presided over most of the war in Iraq, authorized by a bipartisan vote in both the U.S. House of Representatives and the U.S. Senate in Oct. 2002. The war, which lasted until 2011, claimed the lives of more than 4,000 U.S. troops, along with those of tens of thousands of Iraqi civilians. Critics have long faulted Bush for the war, claiming that Iraq did not possess the weapons of mass destruction Bush feared.

The 2002 authorization cited many reasons to invade Iraq, however, including Iraq's alleged noncompliance with the 1991 ceasefire agreement' the country's ""brutal repression of its civilian population;"" the country's harboring of members of al-Qaeda in the aftermath of the Sept. 11, 2001, attacks; Iraq's payment of bounties to the families of suicide bombers; and the governments of Turkey, Kuwait, and Saudi Arabia fearing Saddam Hussein and wanting him removed.

Bush's gaffe clearly did not represent an attempt by the former president to acknowledge claims that the U.S. invasion of Iraq was ""brutal"" and ""wholly unjustified.""

Even so, many on Twitter poked fun at the former president.

""Oof. If you were George W. Bush, you think you’d just steer clear of giving any speech about one man launching a wholly unjustified and brutal invasion,"" former Rep. Justin Amash tweeted.

""George W. Bush is a war criminal,"" Nina Turner, a former Ohio state senator, tweeted.

""This is the most amazing Freudian slip of all time,"" Townhall writer Scott Morefield tweeted.

""George W. Bush didn't do a Freudian slip. He did a Freudian Confession,"" John Fuelsgang, a comedian and broadcaster, wrote on Twitter.

Bush's flub came as he praised Ukraine President Volodymyr Zelenskyy, the Dallas Morning News reported.

""The way countries conduct elections is indicative of how their leaders treat their own people, and how nations behave toward other nations,"" Bush said. ""And nowhere is this on display more clearly than Ukraine.""

CLICK HERE TO GET THE FOX NEWS APP

Bush noted that Zelenskyy, whom he described as a ""cool little guy,"" and ""the Churchill of the 21st century"" was empowered by electoral legitimacy before leading the defense of his country against the Russian invasion.",https://www.foxnews.com/us/george-w-bush-eye-catching-iraq-gaffe-ukraine,N/A
