title,text,url,published_time
NYC subway attack: Gang of women in neon-green bodysuits attack and rob 2 women,"A gang of six women wearing neon-green bodysuits beat and robbed two 19-year-old women on a New York City subway early Sunday in a bizarre caught-on-video attack.

The incident happened around 2 a.m. on a Times Square subway train, police said.

Video posted online shows the six women aboard the train fighting with some passengers. At least one woman can be seen repeatedly punching a victim in the face while another appears to wrap her leg around a second victim and drag her to the floor.

The mother of one victim told the New York Post that what happened on the train was ""absolutely disgusting"" and that the gang in green needs to be held accountable.

NYC SUBWAY ATTACK VICTIM SLAMS CITY OFFICIALS OVER ‘DANGEROUS’ TRANSIT SYSTEM: ‘THERE’S NO HELP THERE'

""Animals belong behind bars,"" said the mother, who wished to remain anonymous. ""Make an example of them. What happened to the New York City we all loved? Start fixing it now.""

The victims told police they had a verbal dispute with the suspects before it turned physical, WPIX-TV reported.

The suspects stole a cellphone, credit cards, a wallet and other personal items from the victims, according to local news outlets.

CLICK HERE TO GET THE FOX NEWS APP

No arrests were made as of Tuesday morning.",https://www.foxnews.com/us/nyc-subway-attack-gang-women-neon-green-bodysuits-attack-rob-women,N/A
NYC subway attack: Woman in critical condition after face is burned by 'unknown chemical substance',"A 21-year-old New York City woman is in critical condition after being hit in the face with an ""unknown chemical substance"" on a subway platform in Brooklyn, police say.

The incident happened around 1 a.m. Friday at the Winthrop Street station ""when an unidentified female individual began a verbal dispute with the victim,"" according to the NYPD.

""The female individual began following the victim up the stairs and then splashed an unknown chemical substance on the victim's face,"" police said. ""The female individual then fled on foot topside to parts unknown.""

NEW YORK CITY HIRING 'RAT CZAR' TO HELP WITH LONG-RUNNING BATTLE AGAINST RODENTS

The victim — identified by Fox5 NY as a hospital worker who was on her way to her shift — was taken to a local hospital in ""critical but stable condition with burns to the left side of the face,"" the NYPD says.

NYC MOTHER, 10-YEAR-OLD DAUGHTER PUNCHED ON SUBWAY IN UNPROVOKED ATTACK: ‘CRAZY’

Investigators described the suspect as a female with a dark complexion, medium build and black hair, around 20 to 30 years old.

CLICK HERE TO GET THE FOX NEWS APP

She was last seen wearing ""a black jacket with a brown fur on the hood, black pants with white drawings on the legs and black boots,"" the NYPD said.

The suspect is wanted for assault.",https://www.foxnews.com/us/nyc-subway-attack-woman-critical-condition-face-burned-unknown-chemical-substance,N/A
"Owner arrested, 3 dogs to be euthanized following dog attack that left 1 dead, 3 injured in San Antonio","Two dogs involved in a deadly attack on an elderly couple in a West San Antonio, Texas, residential neighborhood Friday afternoon and a third from the same property will be euthanized by Animal Care Services, officials said.

San Antonio Police Department said the incident left an 81-year-old man dead and three others injured, including a woman in critical condition at University Hospital. The owner of the dogs has also been arrested, San Antonio police said.

A press release from the San Antonio Animal Care Services and the police department said: ""Animal Care Services has identified three owned dogs either directly involved in the attack or who were off property at the time. All three dogs are in SAACS custody and will be euthanized tonight.""

The dogs were identified as American Staffordshire Terriers, according to Animal Care Services Director Shannon Sims.

HUNTER IN GEORGIA RECOVERING AFTER THREE DOGS ATTACKED HIM ‘IN A COMPLETE FRENZY’

""Witnesses indicate the dogs had broken through the front gate of their nearby home just before the incident,"" the press release read.

San Antonio Fire Captain Charles Hood said in a press conference Friday the couple was walking on a sidewalk around 2 p.m. in the 2800 block of Depla Street, on their way to visit a relative's home when they were attacked ""as they stepped out of their vehicle.""

DOGS THAT FATALLY MAULED TENNESSEE TODDLERS, INJURED MOM WERE NEVER VIOLENT, FRIEND SAYS

Firefighters had to ""fight off"" at least two Staffordshire Terriers with pickaxes and pipe poles to get to the victims in what he called a ""horrific scene.""

Firefighters saw a ""gentleman being dragged by a dog. They could see him completely bloodied before they got off of the truck,"" Hood said.

He said one firefighter was bitten on his leg but is expected to be OK. Another person reported being bitten on the hand.

""Nobody expects to go out and fight dogs in a situation like they did today,"" Hood added.

FACEBOOK COMMUNITY RUSHES TO AID GEORGIA BOY WHO WAS MAULED BY THREE PIT BULLS

Earlier Friday afternoon, Sims said the dogs had been impounded two years ago for a ""mild bite,"" and neighbors have repeatedly complained about neglect on the owners’ part.

""Those bites were mild. So those animals finished their state-required quarantine, and the owner played paid reclaim fees, and by state law, we were required to return those animals,"" Sims said, SBG San Antonio reported.

Local councilwoman Teri Castillo expressed her condolences to the victim's family and thanked emergency responders for their bravery.

""With a heavy heart, I would like to express my deepest condolences to the family of the individual who tragically lost their life today. I wish the individual who is currently being treated at University Hospital and the firefighter who sustained an injury a speedy recovery,"" Castillo said, per SBG San Antonio. ""And, to those who are now grieving over this tragic event, we are sending strength to the neighbors who may need emotional support after witnessing this horrific event.""

She added: ""I would like to thank the emergency responders who arrived at the scene as soon as they could.""

CLICK HERE TO GET THE FOX NEWS APP

Fox News Digital has reached out to the San Antonio fire and police departments.

Fox News' Brie Stimson contributed to this report.",https://www.foxnews.com/us/owner-arrested-dogs-euthanized-dog-attack-1-dead-3-injured-san-antonio,N/A
"Paul Pelosi attack bodycam, 911 call remain undisclosed as suspect David DePape due back in court","David DePape, the 42-year-old Canadian accused of breaking into House Speaker Nancy Pelosi’s house last week and attacking her husband with a hammer, was not present for a brief hearing Friday as authorities remain tight-lipped about additional evidence against him.

At a Friday proceeding DePape was not present for, the court scheduled a discovery hearing for Nov. 28 and set a Dec. 14 preliminary hearing where witnesses could testify.

At a news briefing Thursday, San Francisco District Attorney Brooke Jenkins said she is confident investigators already have the evidence to prove their case but declined to release details beyond what is already in court filings.

""Mr. Pelosi opened the door, they were both holding a hammer and the police observed Mr. DePape pull that hammer away and then strike Mr. Pelosi,"" she told reporters after the hearing. ""That is the most that we’re going to say at this point. Our job is not to try this case in the public or in the press. It’s to try it in a courtroom.""

PAUL PELOSI RETURNS HOME FROM HOSPITAL DAYS AFTER HAMMER ATTACK

WATCH DA BROOKE JENKINS' REMARKS:

DePape faces a slew of state charges as well as federal charges of assault on the immediate family member of a federal official and attempted kidnapping of a federal official. They carry sentences of up to 30 and 20 years in prison with a conviction. DePape could face up to life in prison on the state charges, which he already pleaded not guilty to, and federal immigration officials have requested a detainer and could deport him if he is ever released from custody.

The judge was expected to rule on prosecutors' motion to hold him without bail as he awaits trial.

The House speaker's 82-year-old husband spent six days in the hospital following the attack, where he underwent emergency surgery on a skull fracture and treatments for injuries to his arms and hands.

San Francisco investigators have declined to release bodycam footage, the 911 call and other evidence in the case, including images from numerous surveillance cameras around the Pelosi home.

They have also withheld details about DePape's criminal history, although court filings indicate he does have one.

Jenkins' office wrote that he was ""convicted of other crimes for which consecutive sentences could have been imposed but for which concurrent sentences are being imposed.""

PAUL PELOSI INVESTIGATION: WHAT TO KNOW ABOUT DAVID DEPAPE IN ATTACK ON NANCY PELOSI'S HUSBAND

That could indicate he previously took a plea deal, according to experts.

Details could come out at trial if prosecutors want to use his criminal history as an aggravating factor in seeking a harsher sentence, according to Neama Rahmani, a Los Angeles-based attorney and former federal prosecutor.

""That aggravating factor generally must be proven to a jury beyond a reasonable doubt under the United States Supreme Court’s Blakey decision,"" he told Fox News Digital.

""DePape may wave this Blakey factor so jurors do not hear about his criminal history, but if he does not, the prosecution will present evidence of DePape’s prior convictions and sentences at trial, specifically whether DePape previously received concurrent sentences when he could have received consecutive ones.""

Jenkins said earlier this week that 911 audio and bodycam footage might be revealed in court as she doubled down on not releasing it to the media despite concerns over murky details about the incident.

In court documents, prosecutors allege DePape broke into the Pelosi home around 2 a.m. Oct. 28. Inside, he awoke a sleeping Paul Pelosi in his bedroom and allegedly asked for his wife, whom police say he wanted to ""kneecap."" Speaker Pelosi, the highest-ranking official in Congress, was in Washington, D.C., at the time.

77-YEAR-OLD MAN BRUTALLY BEATEN TO DEATH OUTSIDE SAN FRANCISCO 7-ELEVEN, POLICE SAY: 'SENSELESS VIOLENCE'

DePape noticed ""Ring security cameras everywhere,"" according to Jenkins’ office, and ""was surprised when he found Mr. Pelosi still asleep after making … so much noise to gain entry.""

""Where’s Nancy? Where’s Nancy?"" DePape allegedly asked the ""groggy"" Pelosi around 2:30 a.m.

""She’s not here,"" he replied, according to the San Francisco district attorney’s motion to detain DePape without bail. ""She’s in Washington. She’s not going to be back for a couple of days.""

""OK, well, I’m going to tie you up,"" the intruder stated, according to the filing.

PAUL PELOSI ATTACK: 'MENTALLY ILL' SUSPECT PREVIOUSLY LIVED WITH JAILED 'NUDIST' LOVER, 'CONSTANTLY PARANOID'

Pelosi asked to use the bathroom and made a 911 call on speakerphone around 2:23 a.m., according to court documents. After Pelosi gave his name and address, DePape allegedly spoke to the dispatcher over the open line.

""My name is David,"" he said, according to court documents. Although Pelosi said he didn’t know the intruder, DePape allegedly said, ""I’m a friend of theirs.""

San Francisco police arrived a few minutes later and rang the doorbell.

""Defendant directed Mr. Pelosi not to open the door. But Mr. Pelosi opened the door with his left hand,"" according to a motion to detain DePape without bail. ""As the door opened, the two men stood in the dimly lit foyer facing the officers. Mr. Pelosi nervously but calmly greeted them.

""When the officer asked what was going on, Defendant smiled and said, 'everything's good' and pulled his hands toward his body. When an officer turned on his flashlight, Defendant could be seen holding the bottom handle of the hammer with one hand and Mr. Pelosi's right arm with the other. Mr. Pelosi had his hand on the top of the handle near the hammer itself. One officer ordered, ‘Drop the hammer!’ At the same time, Defendant raised the hammer and said, 'um, nope.'""

CA MOTHER ATTACKED IN PARKING LOT WITH 1-YEAR-OLD IN HER ARMS, CHARGE AGAINST SUSPECT DISMISSED: REPORT

CLICK HERE TO GET THE FOX NEWS APP

DePape allegedly broke free from Pelosi's grip and cracked him in the head. Responding officers tackled him immediately.

The congresswoman issued a statement Thursday afternoon thanking members of the public for their well wishes and San Francisco first responders.

""The Pelosi family is thankful for the beautiful outpouring of love, support and prayers from around the world,"" she said. ""Paul is grateful to the 911 operator, emergency responders, trauma care team, ICU staff and the entire [Zuckerberg San Francisco General Hospital] medical staff for their excellent and compassionate life-saving treatment he received after the violent assault in our home.""

Her husband remains under a doctor's care as his recovery continues, she said.",https://www.foxnews.com/us/paul-pelosi-attack-bodycam-911-call-remain-undisclosed-suspect-david-depape-due-back-court,N/A
Paul Pelosi attack: Capitol Police begin 'internal security review' after officers missed break-in,"The U.S. Capitol Police have begun an ""internal security review"" after officers in its Command Center missed live video surveillance outside the Pelosi's San Francisco residence when David DePape allegedly broke into the house and attacked Paul Pelosi.

Sources told Fox News that the officers were watching a live-feed of many cameras which include surveillance of the Capitol complex, as well as several points away from the Capitol such as the Pelosi's San Francisco residence.

An officer was watching the feeds when police lights illuminated a dark street outside the Pelosi's residence. When rewinding the surveillance cameras outside the Pelosi's residence, the officer saw the alleged break-in on Oct. 28 just after 2 a.m., sources said.

Police say that David DePape violently attacked Paul Pelosi with a hammer, leaving him unconscious for three minutes. Paul Pelosi was taken to a local hospital where he had to undergo surgery repair a skull fracture in addition to other injuries.

DAVID DEPAPE ALLEGEDLY SAID IT WAS THE 'END OF THE ROAD' FOR PAUL PELOSI: 'TAKE THEM ALL OUT'

The security detail traveling with Nancy Pelosi wasn't at the San Francisco residence when the incident happened, as the House Speaker was away.

Sources tell Fox News that Capitol Police pay less attention to security cameras when one of its protectees is away, and the House Speaker wasn't with her husband in San Francisco .

If the officers were watching the feed monitoring in real-time, the break-in would have been seen.

The U.S. Capitol Police released a statement on Wednesday, announcing that it has begun an ""internal security review"" following the incident.

US CAPITOL POLICE OFFICERS WEREN'T WATCHING LIVE HOME SECURITY CAMERAS WHEN PAUL PELOSI WAS ATTACKED

""The Department has begun an internal security review and will be gathering input and questions from our Congressional stakeholders. We have been immensely grateful for the critical support the Congress already provided to secure the U.S. Capitol Complex after January 6, 2021,"" the statement reads. ""The funding was vital for us to implement dozens of immediate improvements. Now we will fast-track the work we have already been doing to enhance the protection of Members outside of Washington, D.C., while also providing new protective options that will address concerns following Friday’s targeted attack.""

According to the statement, the U.S. Capitol Police command center has access to ""roughly 1,800 cameras,"" which include several at the Pelosi's residence.

""While the Speaker was with her security detail in Washington, D.C., the San Francisco cameras were not actively monitored as they are when the Speaker is at the residence. The Command Center personnel noticed the police activity on the screen and used the feeds to monitor the response and assist investigators,"" the statement reads.

DePape faces several state and federal-level charges, including attempted murder, residential burglary, assault with a deadly weapon and elder abuse, among others. DePape plead not guilty to the state-level charges during an arraignment on Monday.

PAUL PELOSI ATTACK: DAVID DEPAPE WAS ON 'SUICIDE MISSION' DURING ALLEGED ATTACK, TARGETED OTHER POLITICIANS

During the break-in, DePape allegedly demanded to talk to ""Nancy,"" referring to the House Speaker, according to an affidavit.

DePape allegedly told Paul Pelosi that it was the ""end of the road"" for him, according to court documents.

PAUL PELOSI ATTACK: 'MENTALLY ILL' SUSPECT PREVIOUSLY LIVED WITH JAILED 'NUDIST' LOVER, 'CONSTANTLY PARANOID'

Both men were seen by police officers struggling over the hammer when they arrived. When one officer gave a command for the men to drop the hammer, DePape smiled, and said ""um, nope,"" and then proceeded with the alleged attack of Paul Pelosi, according to court documents.

DePape allegedly hit Paul Pelosi's ""head at full force with the hammer,"" according to the court document.

Police then took DePape into custody, and he told officers that he was on a ""suicide mission.""

CLICK HERE TO GET THE FOX NEWS APP

""I didn't really want to hurt him, but you know this was a suicide mission. I'm not going to stand here and do nothing even if it cost me my life,"" DePape allegedly told police. ""Hurting him was not my goal. I told him before I attacked him that he's escalating things, and I will go through him if I have to.""

Fox News' Michael Ruiz contributed to this report.",https://www.foxnews.com/us/paul-pelosi-attack-capitol-police-begin-internal-security-review-after-officers-missed-break-in,N/A
"Paul Pelosi attack: David DePape was on 'suicide mission' during alleged attack, targeted other politicians","David DePape, the suspect accused of violently attacking Paul Pelosi, the husband of House Speaker Nancy Pelosi, was on a ""suicide mission"" when he allegedly carried out the attack, according to court documents.

Court documents filed on Tuesday state that DePape, 42, plotted to target other federal and California elected officials.

DePape faces multiple felony charges after he allegedly broke into the Pelosi residence in San Francisco on Oct. 28 and beat Paul Pelosi with a hammer, resulting in injuries that forced the House speaker's husband to undergo surgery to repair a skull fracture in addition to other injuries.

In the court filing, San Francisco District Attorney Brooke Jenkins wrote that DePape's intent with the attack ""could not have been clearer.""

PAUL PELOSI ATTACK: 'MENTALLY ILL' SUSPECT PREVIOUSLY LIVED WITH JAILED 'NUDIST' LOVER, 'CONSTANTLY PARANOID'

""He forced his way into the Pelosi home intending to take the person third in line to the presidency of the United States hostage and to seriously harm her. Thwarted by Speaker Pelosi’s absence, Defendant continued on his quest and would not be stopped, culminating on the near fatal attack on Mr. Pelosi,"" Jenkins wrote in the filing.

DePape, according to the filing, told police officers that he was sick of the ""lies coming out of Washington D.C.""

""I didn’t really want to hurt him, but you know this was a suicide mission. I’m not going to stand here and do nothing even if it cost me my life,"" the filing said.

Jenkins wrote in the filing that ""This case demands detention"" and ""nothing less.""

NANCY PELOSI HUSBAND ATTACK SUSPECT DAVID DEPAPE ARRAIGNED IN SAN FRANCISCO COURT

A criminal complaint filed by the San Francisco District Attorney's Office states that DePape has been ""convicted of other crimes.""

According to a federal affidavit filed on Monday, DePape told police that he intended to hold Speaker Pelosi hostage and interrogate her.

""If Nancy were to tell DePape the ‘truth,’ he would let her go, and if she ‘lied,’ he was going to break ‘her kneecaps,’"" the affidavit states.

""DePape also later explained that by breaking Nancy’s kneecaps, she would then have to be wheeled into Congress, which would show other members of Congress that there were consequences to actions,"" according to the court document.

DePape pleaded not guilty to state-level charges, which include attempted murder, residential burglary, assault with a deadly weapon and elder abuse, among others.

He is accused of breaking into the Pelosi's residence through the rear of the house and entered the bedroom where Paul Pelosi was sleeping, according to Jenkins.

Paul Pelosi attempted to dial 911 in the residence's in-home elevator, but was blocked from doing so by DePape, according to Jenkins, adding that Paul Pelosi was able to escape to a bathroom within the house and dial 911.

When police officers arrived at the residence, they saw both Paul Pelosi and DePape struggling over a hammer, San Francisco Police Chief William Scott said. When given an order to drop the hammer, DePape began attacking Paul Pelosi, Scott said.

The suspect allegedly demanded to talk to ""Nancy"" during the attack, referring to the House Speaker, according to an affidavit.

NANCY PELOSI HUSBAND ATTACK: SAN FRANCISCO DA ANNOUNCES CHARGES AGAINST SUSPECT DAVID DEPAPE

Judge Diane Northway said in a Tuesday court hearing that a police report filed in relation to the incident states that ""The assault occurred in the presence of two uniformed police officers.""

Adam Lipson, the San Francisco Deputy Public Defender representing DePape said in a statement that ""Mr. DePape is entitled to a vigorous legal defense, and we intend to give him one.""

An Immigrations and Customers Enforcement source told Fox News that DePape has been in the U.S. illegally after overstaying his visa by a ""long time.""

In the area of DePape's former residence, which was inside a Richmond, California, garage, neighbors described the suspect as being quiet and isolated. One neighbor said that he wasn't surprised about DePape's alleged actions.

""I also was, a little bit, saying, ‘Oh no’ to myself, because I more or less knew this would happen,"" Jin Molnar said. ""He didn't do anything violent or reckless, but that would be the perfect cover for buying his time until he had the chance to do something.""

""He was an odd guy,"" Molnar said, adding that DePape was ""gravitating towards the new right talking points.""

PAUL PELOSI ATTACKER TOLD INVESTIGATORS HE PLANNED TO BREAK HOUSE SPEAKER'S ‘KNEECAPS’: AFFIDAVIT

A court document states that officers found ""two hammers, a sword, and a pair of rubber and cloth gloves"" when executing a search warrant on DePape's garage residence.

DePape previously lived with his former partner, nudist activist Gypsy Taub, who he raised two sons and daughter with in a Berkeley home, according to ABC7.

Taub told ABC7 in a phone interview that she is DePape's ""ex-life partner,"" and described him as ""mentally ill.""

""He is mentally ill. He has been mentally ill for a long time,"" Taub said, stating that she met DePape around 20 years ago.

Taub is currently in prison after being found guilty in the abduction of a 14-year-old boy which took place around a Berkeley high school.

Taub said that DePape once left home for a year only to return ""in very bad shape.""

""He came back in very bad shape. He thought he was Jesus. He was constantly paranoid, thinking people were after him,"" Taub said. ""And it took a good year or two to get back to, you know, being halfway normal.""

She said that DePape had very similar politics to her, which are ""very progressive.""

CLICK HERE TO GET THE FOX NEWS APP

""Well when I met him, he was only 20 years old, and he didn't have any experience in politics, and he was very much in alignment with my views, and I've always been very progressive. I absolutely admire Nancy Pelosi,"" Taub said.

FBI agents went to the Berkeley home on Friday, and a young man said that DePape hasn't been at the residence in years.

The Associated Press contributed to this report. This is a developing story.",https://www.foxnews.com/us/paul-pelosi-attack-david-depape-was-suicide-mission-during-alleged-attack-targeted-other-politicians,N/A
