title,text,url,published_time
Jobs Panel Member Whose Solar Firm Won Loan Guarantees Raises 'Conflict of Interest' Concerns,"A clean-energy firm led by a member of President Obama's jobs council has a stake in projects that have reaped nearly $2 billion in loan guarantees from Washington, a case that has raised conflict-of-interest concerns as the same jobs council pushes for more ""government-backed"" investment in renewable energy.

The company, NextEra Energy, secured a loan guarantee in August for a solar project in California. An affiliate has taken over another California project that won a separate guarantee in September. The firm is no lightweight -- NextEra Energy Resources, the subsidiary working on both solar projects, is the biggest producer of wind and solar energy on the continent.

But the company also enjoys a connection to the Obama administration -- company Chairman and CEO Lewis Hay sits on the president's Council on Jobs and Competitiveness, which last month issued a report calling, among other things, for a new federal financing program to attract private investment for clean energy projects via loan guarantees and other tools.

To the backdrop of the uproar in Washington over the $535 million loan guarantee to now-bankrupt solar firm Solyndra and a $43 million guarantee to another firm called Beacon Power Corporation also filing for bankruptcy, some are raising concerns about the role of members like Hay on the jobs council.

Unlike Solyndra, NextEra is turning a profit. Its second-quarter report showed net earnings of $580 million, better than in the second quarter of 2010. Third-quarter earnings for the company, which is listed on the New York Stock Exchange, will be announced Friday. The concern with NextEra centers more on Hay's work on the jobs council than the loan itself.

""A person who receives a loan of over $2 billion for his private company certainly would not be an independent voice in whether or not energy loans are wise investments for the taxpayer,"" Sen. Jeff Sessions, R-Ala., ranking Republican on the Senate Budget Committee, told FoxNews.com. ""He is in a position that he couldn't possibly be objective.""

The conservative National Center for Public Policy Research described the jobs council's recommendations as a case of ""self-dealing."" Tom Borelli, director of the group's Free Enterprise Project, said Hay and other members with a stake in the industry should recuse themselves from drafting guidelines that would benefit that sector -- a point Sessions echoed.

""It's crony capitalism,"" Borelli said. ""In a jobs panel, it's a clear conflict of interest.""

He said members of the jobs council whose companies bet big on green energy are now feeding the president recommendations to support those bets. He also raised questions about council Chairman Jeffrey Immelt's involvement, considering his company GE has heavily invested in the clean energy sector -- it also shares a stake in one project with NextEra.

Borelli's group receives some funding from the Exxon Mobil Corporation -- though so do an array of prominent think tanks, ranging from the Brookings Institution to the Council on Foreign Relations. The group is a persistent critic of President Obama's environmental policies.

Asked about NextEra, the Energy Department noted that the White House jobs council ""has no role in evaluating any loan applicants."" That job falls to career officials at the Department of Energy's Loan Programs Office.

Without discussing the recommendations made by the jobs council itself, the department defended the loan guarantees awarded to NextEra.

""Decisions are made on the merits of the project after extensive due diligence by the career officials in the DOE loan office. These projects were carefully reviewed and analyzed by officials in the loan program and were approved because they will create jobs while helping America win the clean energy race. Together these two projects are expected to support more than 1,400 jobs. Since utilities have already agreed to buy clean electricity from these new power plants for many years to come, there is a revenue stream in place to repay the loan,"" the department said in a statement.

Requests for comment from NextEra were not returned. Hay earns nearly $10 million in total compensation from NextEra, according to Forbes estimates.

Though the National Center for Public Policy Research accused the jobs council of crony capitalism, in the case of Hay it's unclear where the quid pro quo would lie.

Hay, appointed to the jobs council in February 2011, is a prolific contributor to mostly Republican candidates. Recipients of his largesse include Republican Sens. Charles Grassley of Iowa and Marco Rubio of Florida and the political action committee run by House Republican Leader Eric Cantor. He contributed to Sen. John McCain's campaign in 2008, not Obama's.

Still, Borelli claimed the jobs council is skewed to favor clean-energy investment recommendations.

In the jobs council's latest October report, the group called for more federal involvement to help renewable energy firms compete with their counterparts in places like China and the United Kingdom.

""Without bold action, the United States risks falling behind its international competitors in the clean energy industry,"" the report reads. Noting credit is tight, the group said ""federal financing incentives"" can help attract private investment and called for a new institution to do just that.

The council estimated that a new program leveraging federal resources to attract private investment for clean energy could spur the creation of more than 100,000 jobs.

Dan Mitchell, a senior fellow with the Cato Institute, said Hay's involvement on the jobs council represents an ""obvious conflict of interest.""

Mitchell said any top-level jobs council would be expected to draw its membership from a variety of different sectors with a variety of different interests. But he said any representative who stands to gain from certain recommendations to the president should recuse himself.

""It definitely doesn't pass the smell test,"" Mitchell said.

Many sectors are represented on the council, and Hay is not the only one whose company could be affected by government action on the economy -- making potential conflicts in some cases difficult to avoid, considering the council's broad mandate to help spur job creation. The council includes Southwest Airlines CEO Gary Kelly, whose sector is facing proposed increases in passenger security fees as part of Obama's deficit-reduction plan, and Jim McNerney, CEO of The Boeing Company, which does extensive business with the federal government. The company is also locked in a union dispute before the National Labor Relations Board over a proposed plant in South Carolina.

Asked for comment, the Republican lawmaker leading the congressional probe into the Solyndra deal would not address the case of NextEra specifically, saying only that his investigation would cover all companies under the loan program.

""Until the start of this year, no oversight had ever been conducted on the DOE loan guarantee program and this investigation is looking into all of the companies that received these guarantees,"" Rep. Cliff Stearns, R-Fla., chairman of the House Energy and Commerce oversight subcommittee, said in a written statement.

Sessions said he's concerned the administration is losing sight of its responsibility to manage the taxpayers' money carefully.

The specific NextEra projects that received partial guarantees were the Genesis Solar and Desert Sunlight solar plants in Riverside County, Calif.

The first received a partial guarantee of $852 million, with the government's share about $682 million. The project is projected to create 800 construction jobs and 47 permanent jobs, while producing enough electricity for more than 48,000 homes, according to the Department of Energy. It is sponsored by NextEra Energy Resources.

The Desert Sunlight project received a $1.46 billion partial guarantee, with the government's share about $1.17 billion. The project is backed in part by the government, though the loans themselves are coming from private investors.

That operation is tied to the projected creation of 550 construction jobs and 15 permanent jobs. According to the Department of Energy, it will be one of the biggest solar photovoltaic plants in the world, and will help power more than 110,000 homes. The loan guarantee for Desert Sunlight was finalized one day before solar company First Solar announced the sale of the project to affiliates of NextEra Energy Resources and GE Energy Financial Services. A NextEra affiliate will manage the project.

NextEra Energy Resources is a major subsidiary of NextEra Energy, Inc. Hay is chairman of both.",https://www.foxnews.com/politics/jobs-panel-member-whose-solar-firm-won-loan-guarantees-raises-conflict-of-interest-concerns,N/A
"Moscow looks to sever Minsk agreements as Russia, Ukraine conflict persists","The State Department on Wednesday warned against any move by the Kremlin to sever its commitment to the Minsk agreements as it looks to recognize two Russian-backed breakaway regions in eastern Ukraine as ""independent.""

The Russian State Duma – the lower chamber in the Russian parliament – voted Tuesday to send President Vladimir Putin an appeal to recognize the self-declared Donetsk and Luhansk People's Republics.

NATO CHIEF CONTRADICTS RUSSIA WITHDRAWAL CLAIMS, SAYS NO PROOF OF PULLING BACK

Located in the Donbas region, in Ukraine’s most eastern front, the breakaway republics have been engaged in armed conflict with the Ukrainian army since 2014.

Russian-backed separatists and Ukraine signed a ceasefire agreement in 2014.

An additional agreement signed in 2015 in Minsk by Russia, Ukraine, leaders from the separatist groups and the Organization for Security and Cooperation in Europe (OSCE) reinforced the ceasefire and called for a series of steps to end the conflict.

Ukraine has long argued that Russia has not upheld its end of the bargain by withdrawing all its troops from the region – though Moscow denies there are any forces to withdraw, according to reporting by Reuters.

The State Department has maintained that Russia invaded Ukraine in 2014 and continues to control armed forces in Donbas.

""To be clear: Kremlin approval of this appeal would amount to the Russian government’s wholesale rejection of its commitments under the Minsk agreements,"" the State Department said Wednesday. ""Enactment of this resolution would further undermine Ukraine’s sovereignty and territorial integrity, constitute a gross violation of international law, call into further question Russia’s stated commitment to continue to engage in diplomacy to achieve a peaceful resolution of this crisis.""

The move by the Russian government comes as tensions in Eastern Europe remain heightened after months of military movement and the buildup of roughly 150,000 Russian troops near Ukraine’s border.

Russia has additionally deployed 30,000 troops to its allied neighbor Belarus.

RUSSIA-UKRAINE: NATO LEADER SAYS 'WE HAVE NOT SEEN ANY WITHDRAWAL OF RUSSIAN FORCES': LIVE UPDATES

Despite its aggressive military buildup, the Kremlin has maintained it has no intention of invading Ukraine and on Tuesday it claimed it will be partially drawing down its military forces.

NATO and U.S. officials said they were cautiously optimistic at the news but NATO Secretary-General Jens Stoltenberg said Wednesday that the alliance had seen no evidence Russia has taken steps to withdraw troops.

Ukrainian officials last week launched the risk reduction mechanism under the Vienna Document and called on Putin to provide detailed information regarding its military activities along Ukraine’s borders.

Russia has yet to respond to the demands from Ukraine, nor has it returned NATO’s written responses issued in answer to Russia’s expressed security concerns.

""We keep demanding transparency from Russia which refused to attend yesterday’s meeting under the Vienna Document,"" Minister of Foreign Affairs for Ukraine, Dmytro Kuleba, said Wednesday.

CLICK HERE TO GET THE FOX NEWS APP

""We once again call on Russia to address legitimate concerns of participating states and use OSCE tools to defuse tensions caused by its military activities near Ukraine’s border. Statements on withdrawal aren’t sufficient.""

NATO forces have been deployed to nations surrounding Ukraine including Romania and Poland. Officials have repeatedly said troops will not be deployed to Ukraine as it is not a NATO member.",https://www.foxnews.com/politics/moscow-minsk-agreements-russia-ukraine-conflict,N/A
"Pentagon: Russia buildup on Ukraine border is largest since Cold War, conflict would be 'horrific'","Top Pentagon officials on Friday said the build-up of Russian troops along Ukraine's border is the largest since the Cold War, warning that conflict in Eastern Europe would be ""horrific,"" but stressed that it is ""not inevitable,"" maintaining that there is ""still time and space for diplomacy,"" as the Kremlin continues to threaten further incursion in Ukraine.

During a briefing Friday, Defense Secretary Lloyd Austin explained that Russia has been deploying forces to Crimea and along Ukraine’s border for months, and has ""progressed at a consistent and steady pace"" involving tens of thousands of Russian troops.

US HANDS RUSSIA WRITTEN RESPONSE TO DEMANDS, SAYS UP TO KREMLIN HOW TO PROCEED

Austin, though, said the United States does not believe Russian President Vladimir Putin has ""made a final decision to use these forces against Ukraine.""

""He clearly now has that capability and there are multiple options available to him, including the seizure of cities and significant territories, but also coercive acts of provocative political acts like the recognition of breakaway territories,"" Austin explained, acknowledging that the United States is focused on Russian disinformation, including the ""potential creation of pretext for further invasion or strikes on Donbas.""

""Any Russian attack or further incursion into Ukraine would not only ignite conflict, it would also violate the bedrock principles of national sovereignty, territorial integrity and self-determination,"" he said, noting that the United States is taking this ""very seriously, both as a strong partner of Ukraine and as one of 30 members of NATO who are unified in opposition to Russia’s attempts to undermine those core values and threaten peace and security in Europe.""

AUSTIN: ‘STILL TIME AND SPACE FOR DIPLOMACY': LIVE UPDATES

Austin said, at this point, ""conflict is not inevitable.""

""There is still time and space for diplomacy,"" he said. ""The United States, in lockstep with our allies and partners, has offered Russia a path away from crisis and toward greater security.""

Austin said the Department of Defense will ""continue to support"" diplomatic efforts, and maintained that the U.S. ""remains committed to helping Ukraine defend itself through security assistance material.""

Austin said that since 2014, the United States has committed more than $2.7 billion in security assistance to Ukraine, noting that President Biden, in December authorized an additional $200 million in assistance, which included javelins and other weapons and equipment.

""The United States will stand should to shoulder with our NATO allies and that includes reinforcing security on NATO’s eastern flank,"" Austin said.

Earlier this week, Austin placed 8,500 U.S. troops on heightened preparedness for deployment to the region.

""We placed thousands of U.S. troops on prepare to deploy orders earlier this week, and if NATO activated its response forces, these troops will be ready to go,"" Austin said Friday.

PUTIN'S UKRAINE AGGRESSION IS A ‘RED MEAT’ DISTRACTION FOR THE RUSSIAN PEOPLE, CONGRESSMAN SAYS

Austin acknowledged that the situation on Ukraine’s borders is ""changing rapidly,"" but said Biden administration officials will continue to present the president with options to ""defend our national security interest in response to Russian actions.""

""An attack against one NATO member is an attack against us all,"" Austin said. ""And as President Biden has said, the United States holds this as a acred obligation and we will do right by that commitment.""

Austin added that Putin ""can do the right thing as well.""

RUSSIA-UKRAINE CRISIS: MOSCOW'S TOP DIPLOMAT SAYS 'WE DON'T WANT WARS': LIVE UPDATES

""There is no reason that this situation has to evolve into conflict. He can choose to deescalate. He can order his troops away. He can choose dialogue and diplomacy,"" Austin said. ""Whatever he decides, the United States will stand with our allies and partners.""

Meanwhile, Chairman of the Joint Chiefs of Staff Gen. Mark Milley addressed the situation should Russia choose to invade Ukraine, explaining that ""it will not be cost free in terms of casualties or other significant effects.""

""There is a small contingent of U.S. and NATO advisors and trainers currently in Ukraine,"" Milley explained, adding that the U.S. ""has zero offensive combat weapon systems nor any permanent forces or bases in Ukraine.""

""Our role is limited and that we help train, advise and assist with tactics, techniques and procedures,"" Milley said. ""We participate in institutional development of the Ukrainian ministry of defense.""

""The president and the secretary of Defense have authorized the United States military to increase our readiness in the event we have to reinforce or assist our NATO allies,"" Milley continued.

He added: ""War is not inevitable, as the secretary said, the right answer here is a diplomatic solution.""

But Milley did set the scene, telling reporters Friday that ""given the type of forces that are arrayed, the ground maneuver forces, the artillery, the ballistic missiles, the air forces, all of it packaged together, if that was unleashed on Ukraine, it would be significant. Very significant.""

""And it would result in a significant amount of casualties,"" he stressed. ""And you can imagine what that might look like in dense urban areas, along roads and so on. And so it would be horrific. It would be terrible and it's not necessary.""

Milley did warn, though, that there is ""a potential"" that Russia ""could launch on very, very little warning.""

""That's possible, and there's a wide scale of options that are available to Russian leadership, and the best option they should pick, in my view, is a diplomatic solution to resolve whatever differences they have,"" Milley said.

But Russian Foreign Minister Sergey. Lavrov told Russia radio stations Friday that ""we don’t want wars,"" despite amassing more than 125,000 troops along Ukraine’s border.

""If it depends on Russia , then there will be no war. We don't want wars. But we also won't allow our interests to be rudely trampled, to be ignored,"" Lavrov said, according to Reuters.

SIX US FIGHTER JETS ARRIVE IN ESTONIA AMID UKRAINE-RUSSIA TENSIONS

Lavrov reportedly added that he expects to meet with U.S. Secretary of State Antony Blinken in the coming weeks, one day after saying that the U.S. and NATO’s responses to its security demands in relation to Ukraine offer ""little ground for optimism.""

Meanwhile, the State Department on Thursday unequivocally warned that if Russia invades Ukraine the Nord Stream 2 pipeline will sit unused at the bottom of the ocean. The controversial pipeline has become the U.S. and NATO’s biggest bargaining chip in its attempts to preserve Kyiv’s sovereignty.

And earlier this week, Biden administration officials told Fox News that they are also preparing ""severe"" sanctions against Russia should it invade Ukraine, which would have an ""immediate and visible effect on the day they are implemented.""

""That means the gradualism of the past is out, and this time, we will start at the top of the escalation ladder and stay there,"" a senior administration official said. ""We've made efforts to signal this intention very clearly, and I would say, a deepening selloff in Russian markets, its borrowing costs, the value of its currency market, imply default risk, reflect the severity of the economy consequences we can and will impose on the Russian economy in the event of a further invasion.""

CLICK HERE TO GET THE FOX NEWS APP

Ukraine's territory has long been in Putin's crosshairs, especially amid recent NATO considerations of potentially allowing Ukraine to join the alliance. It is one of several post-Soviet republics in the region that shifted toward an alliance with the West after the collapse of the Soviet Union.

Putin was in the Soviet KGB for many years before beginning his political career and has said the collapse of the Soviet Union was the ""greatest geopolitical catastrophe"" of the 20th century.

Putin also stresses Russian ethnic and cultural influences in Ukraine as reasons why it should be part of Russia. That was a significant part of the justification Russia used when it illegally annexed the Crimea region of Ukraine in 2014.",https://www.foxnews.com/politics/pentagon-russia-buildup-ukraine-border-largest-since-cold-war,N/A
Republicans demand probe of potential White House staff conflicts related to student loan debt plan,"EXCLUSIVE: Top House Republicans are demanding an ethics investigation into the White House's proposed student loan forgiveness plan, which they say is an illegal ""unjust wealth transfer"" from hardworking Americans and also a conflict of interest for Biden administration political appointees working on the policy.

The White House's most recent proposal would forgive $10,000 in student loan debt for borrowers with a household yearly income below $300,000.

In a letter to the director of the U.S. Office of Government Ethics Emory Rounds Wednesday, House Oversight Committee Ranking Member Rep. James Comer, R-Ky., and House Committee on Education and Labor Republican Leader Rep. Virginia Foxx, R-N.C., take issue with the policy.

""This policy is an unjust wealth transfer from hardworking Americans to highly educated upper-middle-class graduates who borrowed from taxpayers to earn their degree, and, in some cases, multiple degrees,"" the lawmakers write.

""In addition to the substantial and negative ramifications of this illegal action, we are especially concerned that this policy may have been promulgated by White House staffers who stand to financially benefit from the decision, especially considering recent reports that White House political appointees owe millions in student loan debt. Public officials should never use their office to unjustly enrich themselves, and such behavior would directly violate the Ethics Pledge that President Biden implemented for all political appointees,"" they continue.

STUDENT LOAN REFINANCE RATES FREEFALL FOR 5-YEAR VARIABLE-RATE LOANS

Comer and Foxx ask Rounds for assistance in determining whether White House staffers have a conflict of interest or if their families could benefit from Biden's policy that they are currently working to enact.

""Presumably, political appointees with outstanding student loans are included in the reported student loan forgiveness scheme the Biden administration is planning to undertake, thereby raising concerns of whether appointees with conflicts of interest pushed student loan forgiveness to receive a financial windfall,"" they write.

The Republicans cite a recent report that found that one in five White House staffers who filled out a financial disclosure form have student loans that are still being paid off. The total for the group amounts to nearly $4.7 million in unpaid loans. That number is likely to be higher since junior staff or appointees below a certain pay level are not required to disclose their financials, the lawmakers point out.

""Public officials should not be responsible for crafting policies from which they stand to financially benefit,"" the letter states.

BIDEN'S STUDENT LOAN FORGIVENESS PLAN: EVERYTHING WE KNOW SO FAR

Foxx and Comer state that this ""gross abuse of power"" by employees would also ""explicitly violate President Biden's Ethics Pledge.""

They ask the director of government ethics to provide to them a list of all Biden administration employees who have worked on the student loan forgiveness policy and all documents and communications that would reveal whether those staffers have worked on pushing the policy.

In addition, they demand signed copies of all ethics pledges from those individuals and any ethics waivers that may have been given to the staff working on the policy.

The Department of Education recently announced it would cancel $5.8 billion in full loan discharges for 560,000 borrowers who attended a campus owned or operated by Corinthian Colleges, amounting to the ""largest single loan discharge"" in department history.

CLICK HERE TO GET THE FOX NEWS APP

That number adds to an already robust $25 billion in student loan relief under Biden. About 43 million federal borrowers still owe a total of $1.6 trillion in college debt, according to the Education Data Initiative.

The U.S. Office of Government Ethics declined to comment on the letter.",https://www.foxnews.com/politics/republicans-decry-white-house-student-loan-debt-forgiveness-plan-seek-ethics-probe-unjust-wealth-transfer,N/A
