title,text,url,published_time
"Illegal migrants wave Venezuelan flag after crossing US southern border, attack Border Patrol agents","A massive group of illegal migrants Monday crossed into the U.S. waving a large Venezuelan flag and, according to Customs and Border Protection (CBP), attacked Border Patrol agents before being pushed back into the river as agents used crowd-control measures.

The incident, partially caught on video, saw a group of Venezuelan migrants crossing illegally into El Paso, Texas, as they waved the enormous flag. Agents can be seen pushing migrants back into the river while firing pepper balls near them to control the crowd.

In a statement, CBP said a group of Venezuelans had attempted to illegally enter the U.S. while protesting along the Rio Grande’s international boundary.

The agency said one of the protesters assaulted an agent with a flagpole while another threw a rock at agents, injuring one in the process. That in turn led Border Patrol to initiate crowd-control measures.

ICE LAUNCHES ‘TAKEDOWN’ OPERATION IN GUATEMALA TO NAB HUMAN SMUGGLERS AND CORRUPT COPS, RESCUE MIGRANTS

""These measures included the use of the authorized less-lethal force pepperball launching system,"" the statement said. ""The crowd then dispersed and returned to Mexico.""

The agency said that its Office of Professional Responsibility (OPR) will review the incident.

The chaotic incident comes as the migrant crisis, which has roiled the southern border since early 2021, continues to see streams of large groups of migrants cross into the U.S. illegally. On Tuesday morning, a group of 300 mostly single adults crossed illegally into Normandy, Texas.

In just the Del Rio Sector alone, Border Patrol reports more than 50 large groups of more than 100 migrants since the beginning of October.

Republicans have laid the blame for the crisis at the feet of the Biden administration, saying that its policies of rolling back Trump-era border security and enforcement have only served to draw more migrants to the southern border – with many of them being released into the U.S.

HOUSE HOMELAND REPUBLICANS DEMAND ANSWERS FROM CBP, ICE ON ALLEGED MIGRANT PROCESSING FAILURES

Republican governors have caused outrage from Democratic states by bussing and even flying them to liberal ""sanctuary"" jurisdictions like New York City, Washington, D.C., Chicago, and Martha’s Vineyard in Massachusetts. The governors say it has been done to relieve overwhelmed border communities and to bring the crisis home to those areas that describe themselves as welcoming to illegal immigrants.

The Biden administration has taken an approach that has sought to target ""root causes"" of the crisis, like poverty and violence in Central America. It has also emphasized the importance of cooperation with Western Hemisphere countries and recently announced a new cooperative operation with Mexico that sees more resources and checkpoints set up.

TENS OF THOUSANDS OF MIGRANTS HAVE CASES THROWN OUT OF IMMIGRATION COURT AS DOCS NOT FILED

Controversially, it has also expanded Title 42 expulsions to include Venezuelan nationals, who were previously predominantly being released into the U.S. Now, they are being sent back to Mexico, which is bussing them deeper into the Mexican interior and giving migrants 15 days to get a visa or leave the country.

There were more than 227,000 migrant encounters in September, taking the total number for fiscal year 2022 to more than 2.3 million – a new record high. The administration says it has seen a decrease in the number of Venezuelan crossings in the immediate weeks after the new enforcement operation was put into place.

Meanwhile, Texas authorities have been involved in a number of car chases involving smugglers and illegal immigrants. In Kinney County, the local sheriff’s department pulled over a speeding vehicle with paper plates, finding eight illegal migrants being smuggled inside.

CLICK HERE TO GET THE FOX NEWS APP

Video obtained by Fox from Kennedy County showed troopers from Texas’ Department of Public Service chasing a group of migrants after they bailed out of a vehicle following a human smuggling pursuit.",https://www.foxnews.com/politics/illegal-migrants-wave-venezuelan-flag-crossing-us-southern-border-attack-border-patrol-agents,N/A
Jan. 6 Committee holds first public hearing investigating attack on the US Capitol,"Lawmakers on the Jan. 6 committee, during their Thursday night primetime hearing, said former President Trump ""spurred a mob of domestic enemies"" to attack the Capitol in an effort to ""subvert American democracy"" and overturn the 2020 presidential election.

Committee Chairman Bennie Thompson, D-Miss., in his opening statement, said Trump ""was at the center of this conspiracy.""

""Ultimately, Donald Trump, the President of the United States, spurred a mob of domestic enemies..to march down the Capitol and subvert American democracy,"" Thompson said.

Committee Vice Chair Liz Cheney, R-Wyo., during her opening statement, said Americans Thursday evening would see ""never-before-seen footage of the brutal attack on our Capitol.""

""An attack that unfolded while a few blocks away, President Trump sat watching television in the dining room next to the Oval Office,"" Cheney said. ""You will hear audio from the brave police officers battling for their lives and fighting to defend our democracy against a violent mob Donald Trump refused to call off.""

""There is no room for debate. Those who invaded our capital and battled law enforcement for hours were motivated by what President Trump had told them--that the election was stolen and that he was the rightful president,"" Cheney said.

JAN. 6 COMMITTEE AIMS TO SHOW 'TRUMP WAS AT THE CENTER' OF PLOT TO OVERTURN ELECTION WITH PRIMETIME HEARING

Cheney added: ""President Trump summoned the mob, assembled the mob and lit the flame of this attack.""

The Select Committee is played a never-before-seen video of graphic events that transpired during the Jan. 6, 2021 attack on the Capitol. Thompson, before playing the tape, warned that it ""is hard to watch.""

Lawmakers on the Jan. 6 committee also presented videos of interviews and depositions with former top Trump officials before the select committee.

During his opening statement, Thompson referred to former Attorney General Bill Barr's deposition before the committee.

Barr said he had three discussions with Trump between Election Day 2020 and his early resignation from the Trump administration in December 2020.

""I made it clear I did not agree with the idea that the election was stolen, which, I told the president, was bulls--t,"" Barr said during his deposition. ""And you know, I didn't want to be a part of it, and that's one of the reasons that went into me deciding to leave when I did.""

Barr added that: ""You can't live in a world where the incumbent administration stays in power based on its view, unsupported by specific evidence, that the election--that there was fraud in the election.""

Cheney, one of only two Republican members on the committee, also played a clip from Barr's deposition during her opening statement, again undercutting Trump's claims that the 2020 presidential election had been stolen.

""I repeatedly told the president, in no uncertain terms, that I did not see evidence of fraud and that would have affected the outcome of the election,"" Barr said. ""And frankly, a year and a half later, I haven't seen anything to change my mind on that.""

Cheney presented video testimony from Ivanka Trump on Barr's statement that the Justice Department found ""no fraud sufficient to overturn the election.""

During the video, Ivanka Trump was asked how Barr's statement affected her perspective of the election.

""It affected my perspective,"" she testified. ""I respect Attorney General Barr, so, I accepted what he was saying.""

The committee also played video of the testimony of Ivanka Trump's husband, Jared Kushner. Both were members of the Trump administration.

Meanwhile, Cheney said that there is ""no doubt that President Trump was well aware of the violence as it developed.""

""White House staff urged President Trump to intervene and call off the mob,"" Cheney said, presenting a document written by a member of the White House staff ""advising what the president needed to say"" while the attack was underway at the Capitol.

""Anyone who entered the Capitol without proper authority should leave immediately,"" the note Cheney presented read. ""This is exactly what his supporters on Capitol Hill and nationwide were urging the president to do. He would not.""

Cheney also pointed to congressional leaders who ""begged"" Trump for help, including Republican Leader Kevin McCarthy, who was ""'scared' and called multiple members of President Trump's family after he could not persuade the president himself.""

""Not only did President Trump refuse to tell the mob to leave the Capitol, he placed no call to any element of the United States government to instruct that the Capitol be defended,"" Cheney said. ""Trump did not call his Secretary of Defense on January 6th. He did not talk to his attorney general. He did not talk to the Department of Homeland Security.""

""President Trump gave no order to deploy the National Guard that day, and he made no effort to work with the Department of Justice to coordinate and display and deploy law enforcement assets,"" Cheney said.

Cheney, though, said then-Vice President Mike Pence did contact the Pentagon for assets to protect the Capitol.

Cheney played audio of testimony from Chairman of the Joint Chiefs of Staff Mark Milley, who said Pence ""was very animated and he issued very explicit, very direct, unambiguous orders--there was no question about that.""

Milley said Pence urged then-Defense Secretary Christopher Miller to ""get military down here, get the guard down here, put down this situation.""

In contrast, Milley shared details of his conversation with then-White House chief of staff Mark Meadows.

""He said, we have, we have to kill the narrative that the vice president is making all the decisions,"" Milley testified Meadows said. ""We need to establish the narrative that, you know, that the president is still in charge and that things are steady or stable.""

Milley added: ""That's something-- I immediately interpret that as politics, politics, politics. Red flag for me personally.""

The hearing will also feature testimony from two live witnesses — Capitol Police Officer Caroline Edwards and filmmaker Nick Quested.

But a select committee aide said Wednesday the hearing in general will emphasize ""ongoing threats to our democracy"" related to Trump and Jan. 6.

""The vast majority of the material you will see … is previously unseen,"" a select committee aide said Wednesday. ""Whether it is recording video or audio of witnesses we've interviewed, whether it is records that we've obtained over the course of our investigation.

REP. BANKS SAYS JAN. 6 COMMITTEE IGNORING PHYSICAL SECURITY OF CAPITOL, PLANS REPORT FOCUSING ON THAT ISSUE

""We will be revealing new details showing that the mob on Jan. 6 was the result of a coordinated, multistep effort to overturn the results of the 2020 election and stop the transfer of power from Donald Trump to Joe Biden. Trump was at the center of that effort.""

Republicans are largely not involved in the committee hearings, as just two sit on the panel: Cheney and Rep. Adam Kinzinger.

Republicans have argued that the committee is not legitimate because House Speaker Nancy Pelosi, D-Calif., did not seat Minority Leader Kevin McCarthy's chosen Republicans on the committee.

Republicans have also argued that the committee is ignoring the physical security of the Capitol to focus on the Trump-related storyline.

""We should study the events that led up to it. Why the Capitol was left unsecured on Jan. 6 when there was intelligence dating back before Jan. 6 something was going to happen,"" GOP Rep. Jim Banks said in an interview with Fox News Digital.

WHAT'S AT STAKE FOR DEMOCRATS IN PRIMETIME CAPITOL RIOT COMMITTEE HEARING

But those supportive of the committee say it is taking Capitol security into account. It has a separate investigative team dedicated to security failures. Republicans are just using that point to deflect from Trump's false claims the election was stolen and alleged culpability in the attack, committee supporters say.

""The Capitol did not attack itself,"" a spokesman for Jan. 6 Committee Ranking Member Liz Cheney, R-Wyo., told Fox News Digital.

Thursday's hearing is expected to be just one of several televised hearings from the Jan. 6 committee, with the next already announced for Monday and Wednesday next week.

JAN 6 SUBPOENAS: PETER NAVARRO CALLS POTENTIAL GAG ORDER AGAINST HIM DOJ HYPOCRISY

The committee is expected to use their series of hearings to attempt to capture Americans’ attention before the November midterm elections—as they compete with inflation, rising gas prices, shortages in baby formula and more for political attention.

A select committee aide said the Thursday event will serve as an ""opening statement"" to grab Americans' attention and to preview subsequent hearings.

Thursday’s hearing comes after months of interviews, depositions and the committee subpoenaing more than 1,000 people and gathering more than 140,000 documents.

CLICK HERE TO GET THE FOX NEWS APP

Former President Trump on Thursday, hours before the hearing, posted on his own TRUTH Social, slamming the ""corrupt politicians"" on the panel, and blasting them as ""political thugs.""

Fox News’ Tyler Olson contributed to this report.",https://www.foxnews.com/politics/jan-6-committee-primetime-hearing-attack-capitol,N/A
Lee Zeldin attack suspect arrested on federal assault charge,"The suspect in the attack of Rep. Lee Zeldin, R-N.Y., was arrested Saturday afternoon on a federal assault charge, the U.S. Attorney's Office in the Western District of New York announced.

David Jakubonis is scheduled to make his first court appearance before U.S. Magistrate Judge Marion W. Payson Saturday. Zeldin is running for New York governor as a Republican.

Jakubonis, 43 of Fairport, New York, has been charged with attempted assault in the second degree on the state level. He was arraigned in Perinton Town Court and released on his own recognizance after the Thursday attack.

NY CANDIDATE LEE ZELDIN PLEDGES TO FIRE DAS WHO REFUSE TO ENFORCE THE LAW AFTER ATTACKER RELEASED WITHOUT BAIL

Before Jakubonis' release, Zeldin predicted that the suspect would be released. Zeldin has promised to fire district attorneys that do not enforce the law.

CLICK HERE TO GET THE FOX NEWS APP

Zeldin was giving a speech Thursday about bail reform at a Veterans of Foreign Wars post when the alleged assault happened.

WITNESS RECOUNTS ATTACK ON LEE ZELDIN AT CAMPAIGN EVENT IN NEW YORK: ‘KINDA CRAZY’

Jakubonis was holding a black hardened plastic keychain with two sharp points designed for self-defense, police said.

Fox News' Brie Stimson contributed to this report.",https://www.foxnews.com/politics/lee-zeldin-attack-suspect-hit-federal-assault-charge,N/A
Nancy Pelosi breaks silence on husband Paul's attack: 'Heartbroken and traumatized',"House Speaker Nancy Pelosi said in a letter to all members of Congress that her family is ""heartbroken"" after a ""violent man"" attacked her husband, Paul Pelosi, on early Friday morning in the couple's San Francisco residence.

""Yesterday morning, a violent man broke into our family home, demanded to confront me and brutally attacked my husband Paul. Our children, our grandchildren and I are heartbroken and traumatized by the life-threatening attack on our Pop. We are grateful for the quick response of law enforcement and emergency services, and for the life-saving medical care he is receiving,"" Nancy Pelosi said in the ""Dear Colleague"" letter to all members of Congress on Saturday.

Nancy Pelosi said that her family has received an ""outpouring"" of support from other members of Congress, and wrote that Paul Pelosi's ""condition continues to improve.""

""Please know that the outpouring of prayers and warm wishes from so many in the Congress is a comfort to our family and is helping Paul make progress with his recovery. His condition continues to improve,"" Pelosi wrote. ""We are also comforted by the words of the Book of Isaiah: ‘Do not fear, for I am with you. Do not be dismayed, for I am your God. I will strengthen you and help you. I will uphold you with my righteous right hand.'""

PAUL PELOSI JR. UPDATES ON FATHER'S CONDITION OUTSIDE SAN FRANCISCO HOSPITAL AFTER HAMMER ATTACK

""We thank you and pray for the continued safety and well-being of your family,"" Nancy Pelosi wrote.

San Francisco Police Chief William Scott said that David DePape, 42, now faces charges of attempted homicide, assault with a deadly weapon, elder abuse, burglary and other felonies in relation to the attack, which happened after 2 a.m. on Friday.

When police officers arrived at the Pelosi's residence, Scott said that Paul Pelosi and DePape were struggling over a hammer. Officers gave an order for the men to drop the hammer, and, according to Scott, DePape began attacking Paul Pelosi.

DePape was then tackled by police officers and taken into custody. Officials are investigating a possible motive.

PELOSI ATTACK: WOMAN CLAIMING TO BE SUSPECT DAVID DEPAPE'S STEPDAUGHTER SAYS HE WAS ABUSIVE

Scott said that Paul Pelosi was hit at least once with the hammer.

Paul Pelosi was sent to a local hospital, where he went through surgery to repair a skull fracture in addition to other injuries, according to a spokesperson for Nancy Pelosi, who said he's expected to make a full recovery.

According to officials and sources, the suspect yelled ""Where is Nancy?"" when he allegedly broke into the house.

CLICK HERE TO GET THE FOX NEWS APP

The son of Nancy Pelosi and Paul Pelosi spoke out on Saturday and said his dad is doing well.

""So far so good, so far so good,"" Paul Pelosi Jr. told Fox News Digital while outside Zuckerberg San Francisco General Hospital.

Fox News' Greg Norman and Andrew Mark Miller contributed to this report.",https://www.foxnews.com/politics/nancy-pelosi-breaks-silence-husband-pauls-attack-heartbroken-traumatized,N/A
"Nancy Pelosi called priests to perform 'exorcism' after husband's hammer attack, daughter says","Former House Speaker Nancy Pelosi had priests come to her San Francisco home to perform an ""exorcism"" after her husband was severely attacked in November, according to her daughter.

Alexandra Pelosi, the daughter of Nancy Pelosi, told the New York Times that her mother called priests to perform an exorcism of the house over Thanksgiving, just weeks after David DePape allegedly attacked Paul Pelosi with a hammer.

Nancy Pelosi, her daughter said, felt ""guilty"" that her husband was injured by a man who was looking for her.

""I think that weighed really heavy on her soul. I think she felt really guilty. I think that really broke her. Over Thanksgiving, she had priests coming, trying to have an exorcism of the house and having prayer services,"" Alexandra Pelosi told the New York Times.

""He’s a strong person, athletic. This has been tough. It’s going to be about three or four more months before he’s really back to normal,"" she added.

PAUL PELOSI ATTACK: NEIGHBORS DESCRIBE SUSPECT AS 'ODD,' SAY HIS 'INTENTION' WAS TO 'TRAUMATIZE NANCY PELOSI'

San Francisco District Attorney Brooke Jenkins said that DePape entered the Pelosi's San Francisco house during the early morning hours of Oct. 28 through a rear glass door and went into a bedroom where Paul Pelosi was sleeping. Paul Pelosi attempted to use a phone in the in-home elevator, but Jenkins said that DePape blocked him from doing so.

Paul Pelosi eventually escaped to a bathroom and dialed 911, Jenkins said.

NANCY PELOSI BREAKS SILENCE ON HUSBAND PAUL'S ATTACK: 'HEARTBROKEN AND TRAUMATIZED'

Once police arrived at the residence, officers observed Paul Pelosi and DePape struggling over a hammer. When officers told the men to drop the hammer, DePape began attacking Paul Pelosi, according to San Francisco police.

DePape is being charged with attempted murder, residential burglary, assault with a deadly weapon and elder abuse, among others. He has pleaded not guilty. He's also facing several federal charges, which combined with the state-level charges, could land him in jail for decades if found guilty.

CLICK HERE TO GET THE FOX NEWS APP

According to a federal affidavit, DePape told police he initially intended to hold former Speaker Pelosi hostage and interrogate her.

""If Nancy were to tell DePape the ‘truth,’ he would let her go, and if she ‘lied,’ he was going to break ‘her kneecaps,’"" the affidavit stated.",https://www.foxnews.com/politics/nancy-pelosi-called-priests-perform-exorcism-husbands-hammer-attack-daughter-says,N/A
