title,text,url,published_time
"Des Moines, IA, schools closed following apparent cyber attack","Iowa's largest school district cancelled classes for Tuesday after determining there was a cyber attack on its technology network.

Des Moines Public Schools announced Monday that classes would be cancelled for its 33,000 students after being ""alerted to a cyber security incident on its technology network.""

LOS ANGELES UNIFIED SCHOOL DISTRICT TARGETED BY 'RANSOMWARE ATTACK'

The district said in a news release that it took its internet and network services offline while it assessed the situation. It didn't describe the nature of the attack or say whether sensitive information might have been stolen, and it didn't immediately respond to a request for further information.

""Because many technology tools that support both classroom learning as well as the management and operation of the school district are not available at this time, the prudent decision is to close the district for the day,"" the district said.

FLOOD AT DETROIT HIGH SCHOOL CAUSED BY BROKEN PIPES, STUDENTS DISPLACED

The district will decide Tuesday afternoon whether to hold classes Wednesday, spokesman Phil Roeder said.

CLICK HERE TO GET THE FOX NEWS APP

Sports and other activities were cancelled at Des Moines schools Tuesday, but teams will be allowed to compete at schools outside the district, Roeder said.",https://www.foxnews.com/us/des-moines-ia-schools-closed-following-apparent-cyber-attack,N/A
"Dogs that fatally mauled Tennessee toddlers, injured mom were never violent, friend says","FIRST ON FOX: The family dogs who mauled two Tennessee toddlers to death Wednesday and left their mother with severe injuries had never been aggressive, a friend told Fox News Digital.

Kirstie Jane Bennard, 30, was seriously wounded when she tried to pull the family's two pit bulls off 5-month-old Hollace Dean and 2-year-old Lilly Jane at their home in rural Shelby County outside Memphis.

""That attack lasted longer than any one of us could have ever imagined,"" the devastated mom's best friend, Kelsey Canfield, told Fox News Digital

""I can promise you those children were her world, and if there was any inkling of danger, she would have never had those dogs near her kids,"" the shattered mom's best friend, Kelsey Canfield, told Fox News Digital. ""Those children were everything to them, and they just have a really long journey ahead.""

The family had the pets, Cheech and Mia, for more than eight years without a violent incident, Canfield said.

TENNESSEE TODDLER, INFANT KILLED BY FAMILY DOGS, MOTHER IN CRITICAL CONDITION: SHERIFF

""That attack lasted longer than any one of us could have ever imagined,"" she added.

PHILADELPHIA MAN IN CRITICAL CONDITION AFTER BEING ATTACKED BY HIS OWN DOG

Canfield was with Kirstie Jane Bennard's sister Friday, and they were headed to Regional One Health in Memphis to visit her. Her condition was upgraded from critical to stable.

""She was initially confused. She's awake now, and she's aware [of what happened],"" Canfield said.

The children's father, Colby Bennard, who works as a parts manager at Bumpus Harley-Davidson, wasn't home at the time of the attack.

The father had shared photos of Cheech and Mia on Facebook, calling them ""house lions.""

Colby Bennard's uncle, Jeff Gibson, wrote on Facebook that Kirstie Jane Bennard has an ""uncountable amount of stitches and bite marks over her entire body including her face.""

Her legs and arms are completely wrapped in bandages, but she likely won't have permanent damage ""other than a heart that will never heal,"" the post says.

""[Kirstie] is a f---ing hero! This attack lasted over 10 minutes, and she never gave up trying to save these babies,"" Gibson wrote.

DALLAS 4-YEAR-OLD GIRL REPORTEDLY DIES FROM A MULTIPLE-DOG ATTACK

Authorities did not say why the family pets viciously turned on the couple's only children.

The Shelby County Sheriff's Office, which is investigating the tragic killings, said the pit bulls were euthanized on Thursday.

Police and the fire department responded Wednesday at 3:30 p.m. to the two-story home near Shelby Forrest State Park, and the children were pronounced dead at the scene.

""They were perfect, they were beautiful,"" Canfield said of the infant and toddler, adding that they ""worshiped each other.""

Kirstie Jane Bennard's sister, who did not provide her name, asked for privacy while the family grieves. ""It was not just a loss to my sister but to me as well,"" she said, weeping. ""That was my niece and nephew.""

The community is reeling from the horrific attack.

""To say that I am at a loss for words and my heart is and has been breaking since I found out is an understatement,"" wrote friend Stephanie Chipman on Facebook above a series of photos of Kirstie Jane Bennard and her family.

""Just in absolute shock. Praying so so so hard for the good Lord to hold you and your family tight and help you make your way through this. Here for you always and love you so much!"" the post continued.

The children's autopsies are still pending.

CLICK HERE TO GET THE FOX NEWS APP

At least 33 people in the U.S. were mauled to death in 2020 by pit bulls — more than any other dog breed, according to non-profit dogsbite.org.",https://www.foxnews.com/us/dogs-fatally-mauled-tennessee-toddlers-injured-mom-never-violent-friend-says,N/A
Dramatic new video shows moments before NYC truck attack driver Sayfullo Saipov is shot by police,"Federal prosecutors have released dramatic new footage showing the moments before New York City truck attack driver Sayfullo Saipov was shot by responding officers after allegedly killing eight people along a bike path in 2017.

The release comes as a federal trial is underway for Saipov, an Uzbekistan native who prosecutors say was inspired by the Islamic State terrorist group.

Saipov, who was 29 at the time of the attack, has pleaded not guilty to multiple charges of murder, but he could face the death penalty if convicted.

In one of the new video clips, Saipov is seen holding what appeared to be two pistols before multiple shots rang out and he tumbled to the ground.

TRIAL BEGINS FOR ACCUSED NYC TRUCK ATTACK DRIVER SAYFULLO SAIPOV

In another, police officers are seen standing over his body after he was struck.

Saipov's attack is being treated as an act of terrorism, and prosecutors say they found multiple notes, written in Arabic, in and near the Home Depot rental vehicle used in the attack, indicating that Saipov had pledged his loyalty to ISIS. Saipov is the first person to face federal charges that could result in the death penalty under President Biden's administration.

WHO IS SAYFULLO SAIPOV?

Eight people were left dead and 12 others injured following the 2017 attack, which took place near the World Trade Center in Lower Manhattan. Of the eight killed, six were tourists from foreign countries, including five from Argentina and one from Belgium.

The Justice Department said that year that a grand jury indictment charged Saipov with ""eight counts of murder in aid of racketeering, twelve counts of attempted murder in aid of racketeering, one count of providing and attempting to provide material support to the Islamic State of Iraq and al-Sham and one count of violence and destruction of a motor vehicle resulting in death.""

CLICK HERE TO GET THE FOX NEWS APP

Assistant U.S. Attorney Alexander Li said in his opening statement last week at Saipov’s trial that Saipov ""brought two fake firearms, which looked real"" to the scene of the attack, according to the New York Post.

""He grabbed them, and he burst out of the truck screaming ‘Allahu Akbar,’ a celebratory phrase that other ISIS members have also used when conducting terrorist attacks,"" Li reportedly said. ""A responding NYPD officer ran towards the defendant. The defendant aimed his apparent guns at the officer. The officer fired, hitting the defendant, who went down to the ground.""

Fox News’ Anders Hagstrom contributed to this report.",https://www.foxnews.com/us/dramatic-new-video-shows-moments-before-nyc-truck-attack-driver-sayfullo-saipov-shot-police,N/A
"FBI arrests man, woman with 'extremist' views in alleged power grid attack plot targeting 5 substations","The FBI and U.S. Attorney's Office officials in Baltimore announced they had arrested two individuals, a man and a woman, with extremist views who were allegedly attempting to attack the power grid in Maryland.

FBI officials told reporters they believe this was a ""real threat"" that had been thwarted.

Sarah Beth Clendaniel, 34, of Catonsville, Maryland, and Brandon Clint Russell, 27, of Orlando, Florida, are charged through a federal criminal complaint with conspiracy to destroy an energy facility, Erek L. Barron, U.S. Attorney for the District of Maryland, and Special Agent in Charge Thomas J. Sobocinski, of the FBI Baltimore Field Office, announced Monday.

NC SUBSTATION SABOTAGE: FBI INVESTIGATING WHETHER RANDOLPH, MOORE COUNTY POWER GRID ATTACKS ARE RELATED

Clendaniel spoke to an FBI informant about her plan just last week, according to authorities. Russell is an alleged neo-Nazi figure who authorities say posted locations of substations.

Clendaniel allegedly told an FBI confidential source that she planned to target five substations including in Norrisville, Reisterstown and Perry Hall, according to an affidavit by Special Agent Patrick W. Straub, of the Joint Terrorism Task Force (""JTTF"") in the FBI Baltimore Division.

If they hit a number of them all in the same day, they ""would completely destroy this whole city,"" and that a ""good four or five shots through the center of them … should make that happen,"" Clendaniel allegedly said. She further added, ""[i]t would probably permanently completely lay this city to waste if we could do that successfully.""

The affidavit reveals the two defendants were in separate prisons for past crimes and communicated online. In messages, Clendaniel allegedly referenced Unabomber Ted Kaczynski and Hitler. She was in a Maryland prison for robbing convenience stores with a machete. Russell was in prison for holding bomb making materials.

""This planned attack threatened lives and would have left thousands of Marylanders in the cold and dark,"" Barron said in a statement. ""We are united and committed to using every legal means necessary to disrupt violence, including hate-fueled attacks.""

""The threat posed by domestic violent extremists is evolving and persistent,"" Sobocinski said. ""The FBI will continue to work closely with our law enforcement and private sector partners to identify and disrupt any potential threat to the safety of our citizens.""

""The accused were not just talking but taking steps to fulfill their threats and further their extremist goals. Russell provided instructions and location information,"" Sobocinski added at a press briefing on Monday. ""He described attacking the power transformers as the greatest thing somebody can do.""

This plot is not related to but comes on the heels of several power grid attacks in North Carolina, Washington, and Oregon late last year.

As alleged in the affidavit, Russell conspired to carry out attacks against critical infrastructure, specifically electrical substations, in furtherance of Russell’s ""racially or ethnically motivated violent extremist beliefs"" from at least June 2022 to the present.

Russell allegedly posted links to open-source maps of infrastructure, which included the locations of electrical substations, and he described how a small number of attacks on substations could cause a ""cascading failure,"" according to court documents. Russell also allegedly discussed maximizing the impact of the planned attack by hitting multiple substations at one time.

Clendaniel, in collaborating on a plan to carry out the attacks, conspired to secure a weapon and identified five substations she planned to target, according to court documents.

If convicted, Russell and Clendaniel each face a maximum sentence of 20 years in federal prison for conspiracy to damage an energy facility, prosecutors said.

Clendaniel is scheduled to make an initial court appearance at 2:00 p.m. ET Monday in the U.S. District Court in Baltimore before U.S. Magistrate Judge Brendan Hurson. Russell will have his initial appearance at 1:30 p.m. ET in U.S. District Court in Orlando, Florida.

Exelon released a statement and announced power grid was not disrupted.

""We are thankful for their vigilance and the precautions taken to protect the electric grid for our customers and employees,"" Exelon said in a statement. ""Law enforcement acted before the perpetrators were able to carry out their plan, and there was no damage to any of the substations, nor was any service disrupted.""

CLICK TO GET THE FOX NEWS APP

""The utility sector has a real problem on its hands. Power stations are an attractive target and domestic terror groups know that destroying this infrastructure can have a crippling effect on industry, citizens, and local governments,"" former Department of Homeland Security Assistant Secretary Brian Harrell, who was appointed in 2018 by former President Donald Trump, told Fox News Digital Monday. ""Attacker(s) undoubtedly understand what to shoot at and what assets are the most critical in a substation. It's difficult to protect all energy assets. This would have an enormous price tag that utility customers would have to pay.""

This is a developing story. Please check back for updates.",https://www.foxnews.com/us/fbi-arrests-man-woman-extremist-views-alleged-power-grid-attack-plot-targeting-5-substations,N/A
"Florida alligator responsible for killing elderly woman attempted to attack dog, then her foot","An alligator in Florida that's responsible for killing an elderly woman first attempted to attack her dog, according to a state agency.

According to a Florida Fish and Wildlife Conservation Commission accident report, Gloria Serge, 85, was outside walking her dog in Fort Pierce, Florida, on Monday by a retention pond behind her house when the 10-foot-long alligator crawled up from the water and first tried to attack her dog, according to FOX 35.

The elderly woman was taken to the ground with the alligator then biting her feet, and them she was dragged into the water.

While the woman's body was recovered from the retention pond, the dog survived.

FLORIDA WOMAN KILLED BY 10-FOOT ALLIGATOR WHILE WALKING HER DOG: REPORTS

""Our thoughts and deepest sympathies are with the family and friends of the victim,"" the Florida Fish and Wildlife Conservation Commission said in a statement. ""Serious injuries caused by alligators are rare in Florida.""

CLICK HERE TO GET THE FOX NEWS APP

The alligator was trapped and killed by a nuisance gator trapper.

Fox News' Louis Casiano contributed to this report.",https://www.foxnews.com/us/florida-alligator-responsible-killing-elderly-woman-attempted-attack-dog-foot,N/A
Armed bystander in Florida stops attack on pregnant woman,"An armed bystander intervened to stop a brutal attack on a pregnant woman at a Publix parking lot in Florida.

The Pinellas County Sheriff’s Office said 27-year-old Cole Joseph Danisment became angry with the mother of his unborn child and began brutally beating her in a Publix parking lot Saturday, punching her in the face several times during the attack, according to a report from WFLA.

Danisment continued his attack after the victim, who was 14 weeks pregnant with his child at the time, even after she fell to the ground, stomping on her head and upper body.

PENNSYLVANIA MALL SHOOTING THWARTED BY LEGALLY ARMED BYSTANDER: 'HE IS A HERO'

Police say at the point a witness near the attack believed it was ""so brutal in nature"" that he feared for the woman's life, spurring him to intervene by pulling out his firearm on Danisment and causing him to stop the attack.

Officers responding at the scene say the attack left the woman ""covered in large amounts of blood,"" and may have resulted in a broken nose.

The victim and Danismen were dating for about a year leading up to the incident and had lived together for about a month, but the was put under a no-contact order after being arrested on a domestic battery against the victim in October and showing a pattern of violence toward her.

CLICK HERE TO GET THE FOX NEWS APP

Police say Danisment did not deny the attack, instead claiming that he ""saw red"" and blacked out.

The Pinellas County Sheriff’s Office did not immediately respond to a Fox News request for comment.",https://www.foxnews.com/us/florida-armed-bystander-stops-attack-pregnant-woman,N/A
Florida student arrested for allegedly attacking school employee who took Nintendo Switch: police,"A teenager at a Florida high school was arrested on Tuesday after allegedly attacking a staff member who took his Nintendo Switch away from him during class.

The Flagler County Sheriff's Office said that the incident happened at Matanzas High School in Palm Coast, Florida, and identified a 17-year-old who was taken into custody and charged with felony aggravated assault with bodily harm.

Deputies say that a female paraprofessional took the Nintendo Switch away from him during class, which made him upset.

Surveillance video from the school shows the 17-year-old, who is 6’6"" and 270 pounds, walking ""fast"" in the paraprofessional's direction and pushing her, which forced her on the ground where she became unconscious, officials said.

FLORIDA JUDGE ON ‘KILLER CLOWN’ CASE MULLS USE OF ALLEGED COSTUME, KEY EVIDENCE AS TRIAL LOOMS

The student kicked and punched the paraprofessional ""several times"" after she was unconscious, deputies said, adding that other students rushed to help her.

TWO FLORIDA CORRECTIONS OFFICERS ARRESTED, ACCUSED OF THROWING HOT WATER ON INMATES

The female victim was taken to a local hospital for treatment.

At one point, the suspect can be heard saying ""f--k you"" to one of the deputies.

""I don't want to go to jail,"" the suspect said.

Flagler County Sheriff Rick Staly said that the student's actions were uncalled for.

CLICK HERE TO GET THE FOX NEWS APP

""The actions of this student are absolutely horrendous and completely uncalled for,"" Staley said. ""We hope the victim will be able to recover, both mentally and physically, from this incident. Thankfully, students and staff members came to the victim’s aid before the SRDs could arrive. Our schools should be a safe place – for both employees and students.""",https://www.foxnews.com/us/florida-student-arrested-allegedly-attacking-school-employee-took-nintendo-switch-police,N/A
Florida teacher's aide violently attacked after taking student's Nintendo Switch,"Deputies in Florida released surveillance video of a student attacking a high school teacher's aide after she took away his Nintendo Switch during class.

The Flagler County Sheriff's Office said that the physical incident happened at Matanzas High School in Palm Coast, Florida, on Tuesday, and said that a 17-year-old was taken into custody and charged with felony aggravated assault with bodily harm.

Deputies say that a female teacher's aide took the Nintendo Switch away from him during class, which made him upset. According to WESH-TV, the teenager is considered a special needs student.

Surveillance video released by the school shows the 6’6"" and 270 pound student running up to the teacher's aide, pushing her to the ground, then continuing to punch and kick her.

FLORIDA STUDENT ARRESTED FOR ALLEGEDLY ATTACKING SCHOOL EMPLOYEE WHO TOOK NINTENDO SWITCH: POLICE

The student is seen on video continuing to punch the employee for several seconds until a group of people are seen forcibly removing him.

Video shows that the teacher's aide laying on the floor for several minutes before getting up.

Sheriff Rick Staly said that the teacher could have been killed, according to WESH.

""This could have been a homicide,"" Staly said. ""When you push people down like that, they hit their head, you never know the outcome.""

Body camera video shows the student saying ""f--k you"" to one of the deputies before he was arrested.

""I don't want to go to jail,"" the suspect said.

FLORIDA JUDGE ON ‘KILLER CLOWN’ CASE MULLS USE OF ALLEGED COSTUME, KEY EVIDENCE AS TRIAL LOOMS

An arrest report states that the student was upset that the paraprofessional took the game away, stating that he ""will beat her up every time she takes away his game,"" according to FOX 35.

The teacher's aide was taken to a local hospital and was released. She's believed to have broken ribs and significant bruising, but the sheriff's office doesn't know the full extent of her injuries.

""I believe she will be out of work for at least several weeks, if she even plans on returning,"" the sheriff's office wrote.

CLICK HERE TO GET THE FOX NEWS APP

""The actions of this student are absolutely horrendous and completely uncalled for,"" Staly said. ""We hope the victim will be able to recover, both mentally and physically, from this incident. Thankfully, students and staff members came to the victim’s aid before the SRDs could arrive. Our schools should be a safe place – for both employees and students.""

Fox News Digital reached out to Matanzas High School for comment.",https://www.foxnews.com/us/florida-teachers-aide-violently-attacked-taking-students-nintendo-switch,N/A
Georgia high school teacher hospitalized after brutal attack by student: 'We need zero tolerance',"Authorities in Rockdale County, Georgia, are reviewing a now-viral video after a student's attack on a teacher left the longtime educator hospitalized.

The video shows an altercation between a student and a teacher, who was identified as English Language Arts teacher Tiwana Turner in a GoFundMe, inside a classroom at Heritage High School on Jan. 26. An argument escalated into a physical attack when the student slammed the classroom door on Turner and then started punching her.

The attack continued into the hallway, where the teacher of 27 years was pulled to the ground and punched repeatedly, resulting in her being hospitalized. The GoFundMe account said she is unable to walk after suffering knee and leg injuries including a broken leg.

Turner's recovery will include ""extensive rehabilitation and therapy,"" and she will not be able to work ""any time soon,"" the account stated.

CALIFORNIA HIGH SCHOOL FOOTBALL COACH SHOT AFTER BREAKING UP FIGHT: POLICE

According to the GoFundMe, Turner was covering another class for a co-worker who was absent that day. When she attempted to ""redirect the off-task behavior"" of a student, she was physically assaulted by the student.

The student is a ninth grader and has been charged with aggravated battery, the Atlanta Journal-Constitution reported.

Verdaillia Turner, president of the Georgia Federation of Teachers, told Fox 5 Atlanta she was angered by the video and that incidents like that directly contribute to the nationwide teaching shortage.

""Students are out of control…there is no excuse for the violence…there is no excuse for children who are coming into our school daily and wreaking havoc so other students cannot learn,"" she told the outlet.

She added that the environment is the number one problem in the struggle to attract and retain teachers – discipline problems within the classroom.

""When we search the web and just Google ‘student assaults on teachers,’ we’ll see numerous assaults across the country and this is driving teachers out of the classroom,"" Verdaillia said.

FLORIDA HIGH SCHOOL STUDENT BODY-SLAMS POLICE OFFICER DURING FIGHT: 'DESPICABLE'

While talking with Fox 5, Verdaillia said she thinks the student and the parents should be held accountable, describing what teachers have to deal with daily as a ""state of emergency.""

""Right now, we need zero tolerance,"" she added.

In a statement to Fox 5, Rockdale County Public Schools said:

""RCPS does not tolerate student violence towards any staff members. Students who harm other students or staff will be disciplined according to our Student Discipline Code of Conduct and will be appropriately charged by law enforcement.""

CLICK HERE TO GET THE FOX NEWS APP

It's unclear what disciplinary action(s) the student is facing from the school or school system.

Fox News Digital has reached out to Rockdale County Public Schools for more information.",https://www.foxnews.com/us/georgia-high-school-teacher-hospitalized-brutal-attack-student-need-zero-tolerance,N/A
