title,text,url,published_time
"Biden announces Russia sanctions, troop movements in response to Ukraine invasion","President Biden on Tuesday announced new sanctions against Russia, calling Kremlin-led activities in recent hours ""the beginning of a Russian invasion of Ukraine,"" and the authorization of additional U.S. forces to the region, but maintained that the United States has ""no intention"" of fighting Russia.

The president, from the White House on Tuesday, said Russian President Vladimir Putin is ""setting up a rationale"" to take Ukrainian territory ""by force,"" after authorizing Russian forces to deploy into the country.

""I know he’s setting up a rationale to go much further,"" Biden said. ""This is the beginning of a Russian invasion of Ukraine.""

BIDEN SAYS RUSSIA IS BEGINNING AN INVASION, ANNOUNCES SANCTIONS: LIVE UPDATES

The president said he will impose further sanctions on Russia, which go ""far beyond"" the steps taken by the United States and allies and partners in 2014.

""And if Russia goes further with this invasion, we stand prepared to go further as with sanctions,"" he said.

""Who in the Lord’s name does Putin think gives him the right to declare new so-called countries on territory that belongs to his neighbors?"" Biden said. ""This is a flagrant violation of international law and demands a firm response from the international community.""

Biden maintained that the United States is working with NATO allies and partners to implement sanctions, saying they have been ""closely coordinated,"" and will ""continue to escalate"" if Russia ""escalates.""

WHITE HOUSE DECLARES RUSSIAN INVASION IN UKRAINE

Biden said the United States is implementing sanctions that block two large Russian financial institutions – VEB and its military bank – and implementing comprehensive sanctions on Russian sovereign debt.

""That means we’ve cut off Russia’s government from Western financing. It can no longer raise money from the West and cannot trade in its new debt on our markets or European markets either,"" Biden explained.

The Biden administration is also set to impose sanctions on Russia’s ""elites and their family members,"" which the White House teased earlier this month. Biden said they ""share in the corrupt gains of the Kremlin policy and should share the pain as well.""

Biden went on to say that the U.S. will work with Germany to ""ensure Nord Stream 2 will not, as I promised, will not move forward.""

Germany overnight said it is taking steps to halt the process of certifying the Nord Stream 2 gas pipeline from Russia over Moscow’s latest actions in eastern Ukraine.

The 764-mile pipeline that would carry natural gas from Russia to Germany has not begun operating. Nord Stream 2 is owned and operated by a wholly owned subsidiary of Russia state company Gazprom.

The Nord Stream 2 has seen a faster development and deployment despite sanctions placed on it by the Trump administration. With those sanctions removed, Germany remains keen to see the pipeline activated sooner rather than later.

Biden last year removed sanctions on the Nord Stream 2 pipeline, allowing construction and activation to proceed.

But Biden said that as Russia ""contemplates its next move,"" the United States has its next move prepared as well, saying that the United States ""will continue to provide defensive assistance to Ukraine,"" and will continue to ""reinforce and reassure our NATO allies.""

""In response to Russia’s admission that it will not withdraw its forces from Belarus, I have authorized additional movements of U.S. forces and equipment already stationed in Europe to strengthen our Baltic allies Estonia, Latvia and Lithuania,"" Biden announced.

""Let me be clear: these are totally defensive moves on our part,"" he continued. ""We have no intention of fighting Russia.""

Biden said, however, that the U.S. wants to ""send an unmistakable message"" that the United States and allies ""will defend every inch of NATO territory and abide by the commitments we made to NATO.""

""We still believe that Russia is poised to go much further in launching a massive military attack against Ukraine—I hope I’m wrong about that. I hope we’re wrong about that,"" Biden said, noting that there are still well over 150,000 Russian troops surrounding Ukraine.

""Russian forces remain positioned in Belarus to attack Ukraine from the north, including warplanes and offensive missile systems,"" Biden said, noting that Russia is moving supplies of ""blood and medical equipment into position at the border.""

""You don’t need blood unless you plan on starting a war,"" Biden said.

The president said that Russian activities in the last several days mirror what Secretary of State Antony Blinken previewed last week at the United Nations Security Council— detailing false flag events that have been ""dramatically"" staged.

""President Putin has sought authorization from the Russian parliament to use military force outside of Russian territory, and this set the stage for further pretext of further provocations by Russia to try to justify further military action,"" Biden said. ""None of us, none of us, should be fooled. None of us will be fooled. There is no justification.""

He added: ""Further Russian assault of Ukraine remains a severe threat in the days ahead.""

Biden, shifting to how the situation abroad will affect those in the homeland, said that his administration will use ""every tool at our disposal to protect American businesses and consumers from rising prices at the pump.""

""Defending freedom will have cost for us as well, and here at home, we need to be honest about that,"" the president said. ""But, as we do this, I’m going to take robust action to make sure the pain of our sanctions is targeted to the Russian economy—not ours.""

Biden said his administration is ""closely monitoring"" energy supplies to prevent disruption, and is executing a plan and coordination with major oil producing consumers.

""This will blunt gas prices,"" Biden said. ""I want to limit the pain that the American people are feeling at the gas pump—this is critical to me.""

Meanwhile, Biden, delivering a direct message to Putin, said the U.S. and allies are ""united in our support of Ukraine"" and in ""our opposition to Russian aggression"" and in ""resolve to defend our NATO alliance.""

""And we’re united in our understanding of the urgency and seriousness of the threat Russia is making to global peace and stability,"" Biden said, slamming Putin for ""directly"" attacking ""Ukraine’s right to exist.""

""He explicitly threatened war unless his extreme demands were met, and there is no question that Russia is the aggressor,"" Biden said. ""So, we’re clear-eyed about the challenges we’re facing.""

But Biden said that there is ""still time to avert the worst case scenario,"" and left the door open for diplomacy ""if it is serious.""

""When all is said and done, we’re going to judge Russia by its actions, not its words,"" Biden said. ""And whatever Russia does next, we're ready to respond with unity, clarity and conviction.""

He added: ""I’m hoping diplomacy is still available.""

The president’s comments came after Putin, on Tuesday during a press conference, called on Ukraine to demilitarize.

Putin’s demands came after Russian troops arrived in eastern Ukraine—just hours after he announced that he would recognize the independence of two separatist regions, officials said.

Russian troops entered in Donbas, the name for the area where the two separatist regions, that have long fought Russia-backed rebels, Donetsk and Luhansk, are located, officials said, noting that they ""consider Donbas part of Ukraine.""

The Kremlin then raised the stakes further Tuesday, by saying that recognition extends even to parts held by Ukrainian forces.

A White House official told Fox News that administration officials are calling it an invasion.

RUSSIA-UKRAINE: WHITE HOUSE DECLARES RUSSIAN 'INVASION', SAYS SANCTIONS COMING: LIVE UPDATES

""The invasion has begun,"" the official said. ""So our sanctions response has begun.""

The president, on Monday, signed an executive order effectively blocking ""all economic activity"" in Donetsk and Luhansk.

RUSSIAN TROOPS MOVED INTO EASTERN UKRAINE'S BREAKAWAY REGIONS, EUROPEAN OFFICIALS SAY

Deputy National Security Adviser Jon Finer during an interview on CNN Tuesday, promised ""additional sanction steps"" that the administration plans to take ""that go directly at Russia"" in response to the ""egregious step that they took yesterday away from diplomacy and down the further path toward war.""

Meanwhile, senior administration officials told reporters on Monday evening that they will ""continue to pursue diplomacy until the tanks roll.""

RUSSIA-UKRAINE: GERMANY STOPPING NORD STREAM 2 PIPELINE APPROVAL

""We're under no illusions about what is likely to come next,"" one official said. ""And we are prepared to respond decisively when it does.""

Fox News' Greg Norman, Mark Meredith, Paul Conner and The Associated Press contributed to this report.",https://www.foxnews.com/politics/biden-russia-sanctions-troop-movements-ukraine-invasion,N/A
China could invade Taiwan before the 2024 US presidential election: sources,"EXCLUSIVE: China could invade Taiwan within the next 18 months, current and former officials familiar with U.S. and allied intelligence told Fox News, suggesting a particularly ""dangerous"" window between the meeting of the National Congress of the Chinese Communist Party this November and the next U.S. presidential election in 2024.

Two former senior officials told Fox News that the intelligence suggests China sees the potential opportunity for an amphibious assault and military invasion of Taiwan in that time frame.

""We have always had and always been aware that China has an ever-present, ever-evolving plan for an amphibious assault and military invasion of Taiwan. If they are not successful in reunifying politically, then they will do so with force,"" one former senior intelligence official familiar with U.S. intelligence, and who has discussed intelligence belonging to a U.S. ally in the Indo-Pacific, told Fox News.

""What is different now is, we have intelligence that this has gone from an indefinite, nebulous scenario, to a belief that there is a window of opportunity in the next 18 months,"" the official continued. ""I don’t think that’s a coincidence that window of opportunity is within a Biden administration.""

WHITE HOUSE: US 'DOES NOT WANT A CRISIS' BUT WILL 'MANAGE WHAT BEIJING CHOOSES TO DO' AMID PELOSI TAIWAN VISIT

A former senior Trump administration official told Fox News House Speaker Pelosi’s visit to Taiwan is being used as a ""pretext"" for increased Chinese aggression around Taiwan, but said it is ""not the real cause of it,"" and warned that the ""Davidson Window"" is ""closing.""

Former commander of American forces in the Indo-Pacific Adm. Philip Davison testified last year that China could invade Taiwan within the next six years—by 2027.

""The window is now between the Party Congress and the next U.S. presidential election,"" the official said noting that window could close by January 2025—at the end of the presidential transition period. ""I think we are in a very dangerous two-year window right now.""

The 20th National Congress of the Chinese Communist Party is expected to take place in November, where Chinese President Xi Jinping is expected to be re-elected.

A spokesperson for the White House National Security Council told Fox News that the United States ""will not seek and does not want a crisis.""

""We are prepared to manage what Beijing chooses to do. We will not engage in saber-rattling, and we're not looking to escalate,"" the NSC spokesperson told Fox News. ""At the same time, we're going to be steady and resolute. We will not be deterred from operating in the seas and skies of the Western Pacific as we have done for decades.""

The spokesperson added that the United States ""will continue to support Taiwan, consistent with our commitments under the Taiwan Relations Act, and defend a free and open Indo-Pacific.""

""We're communicating closely with our allies and partners. And we are maintaining open lines of communication Beijing,"" the spokesperson said. ""We will keep doing what we are doing -- supporting cross-Strait peace and stability.""

However, the former senior Trump administration official told Fox News that ""the likelihood of invasion has increased dramatically with China perceiving the United States is in a weakened position,"" pointing to the Biden administration’s ""surrender"" of Afghanistan to the Taliban in August 2021 and Russia’s invasion of Ukraine, which resulted ""in only half-measure sanctions being put on the Russian Federation.""

PENTAGON OFFICIAL SAYS 'ONLY A MATTER OF TIME' BEFORE CHINA CAUSES 'MAJOR' INCIDENT IN INDO-PACIFIC REGION

The official also said Xi has been emboldened by U.S. ""domestic problems,"" including crime in cities across the nation, ""the lack of control"" at the Southern border, and the ""failures"" of the Biden administration’s energy policy.

The official stressed that the invasion could happen before the inauguration of the next president in 2025, saying China fears the election of ""another leader that could return to a more robust, ‘peace through strength’ foreign policy and stronger domestic policies.""

With regard to criticisms of the current administration's foreign policy and its withdrawal from Afghanistan, a Biden administration official told Fox News that China ""would love nothing more than for the U.S. government to still be bogged down in a 20-year war, still committing billions of dollars, U.S. troops, and have our military focused on another country's civil war.

""By being able to withdraw our forces from Afghanistan, we have been able to reposition them and refocus our efforts to other areas of the world,"" the official said. The official added that the Biden administration ""freed up resources"" and said leaving Afghanistan put the United States ""in a much better position on the geopolitical stage when it comes to our strategic competition with China or with any other important issues around the world.""

However, during an interview with Fox News Wednesday, Former Deputy Assistant Secretary of Defense for East Asia Heino Klinck said the United States ""has failed to deter adversaries within the last 18 months.""

""If anything, the United States has been deterred from forcefully supporting its partners and allies worldwide,"" Klinck said, adding that he has viewed 2024 as a ""particularly dangerous year.""

""The reason is because it is not only the election in the United States, but it is also the presidential election in Taiwan,"" Klinck said, stressing that he believes the People’s Liberation Army ""will move against Taiwan when the Chinese Communist Party tells it to, regardless of timing.""

""I view 2024 as being dangerous because I believe the CCP, particularly President Xi Jinping, will see it as a potential window of opportunity because of the U.S. election, and the fact that he probably perceives that the United States is going to shy away from an international crisis during a presidential election,"" he told Fox News.

Klinck, who also formerly served as a U.S. military attaché at the U.S. embassy in Beijing, currently serves as a senior advisor to the National Bureau of Asian Research.

""I also believe he perceives that the presumptive next Taiwanese president is going to move Taiwan closer to independence,"" he said.

CHINA POSES 'BIGGEST LONG-TERM THREAT TO ECONOMIC AND NATIONAL SECURITY,' FBI DIRECTOR WRAY WARNS

Current Biden administration officials told Fox News that the situation is fluid and that they are monitoring closely as China gears up for ""potential escalation."" Officials said they are looking to see how the situation will play out over the coming months and how far China will go.

Officials say they are focusing on what the heightened threat could mean for Taiwan, for U.S.-Chinese relations, and for certain critical industries that could be impacted.

White House National Security Council coordinator for strategic communications John Kirby said Tuesday that even before Pelosi’s visit to Taiwan this week, Beijing ""positioned itself to take further steps, and we expect that they will continue to react over a longer-term horizon.""

At this point, the Chinese have declared several closure areas around Taiwan for military exercises, and Klinck told Fox News that some of those closure areas ""encroach upon Taiwanese territorial waters.""

Klinck told Fox News that this is the first time the military exercises are taking place east of Taiwan.

MILLEY DIRECTS A REVIEW OF US, CHINESE MILITARY CONTACTS, AMID WARNING BEIJING POSES NATIONAL SECURITY THREAT

""The Chinese are trying to say to Taiwan, you don’t have any territorial waters because you belong to us, and they are going to make the point now by conducting exercises there, and they have never done that before,"" Klinck said. ""They have previously declared closure areas and conducted exercises there. They have never done it though on the east side of Taiwan.""

Biden administration officials have been warning for months of increased Chinese aggression, with one top Pentagon official last month sounding the alarm that it is ""only a matter of time"" before a ""major incident or accident"" occurs in the Indo-Pacific.

Assistant Secretary for Defense for Indo-Pacific Security Affairs Ely Ratner said last month that the Pentagon has witnessed a ""sharp increase"" in aggressive behavior by the PLA in the Indo-Pacific, admitting that it has ""increased dramatically, with dozens of dangerous events in the first half of this year alone.""

The warnings from the Pentagon come just days after Chairman of the Joint Chiefs of Staff Gen. Mark Milley directed his staff to collect information on interactions between the U.S. and Chinese militaries in the last five years.

CHINA'S XI JINPING IS 'A SILENT PARTNER' IN PUTIN'S 'AGGRESSION' IN UKRAINE, CIA DIRECTOR BURNS WARNS

The directive also comes as top intelligence community officials are warning of the threat Beijing poses to the U.S.

FBI Director Christopher Wray earlier this month said China poses the ""biggest long-term threat"" to U.S. economic and national security.

The National Counterintelligence and Security Center also this month warned that state and local leaders are at ""risk"" of being ""manipulated"" to support ""hidden"" agendas by the Chinese Communist Party as China seeks to target officials outside of Washington to lobby for Beijing-friendly policies at the federal level.

CLICK HERE TO GET THE FOX NEWS APP

In April, CIA Director William Burns issued a similar warning to Wray’s — also noting that China has been ""a silent partner"" in Russian President Vladimir Putin’s aggression in Ukraine.

Burns, at the time, said China is ""in many ways, the most profound test the CIA has ever faced,"" calling China a ""formidable competitor lacking in neither ambition nor capability.""",https://www.foxnews.com/politics/china-could-invade-taiwan-within-next-18-months-before-next-us-presidential-election-sources,N/A
GOP House leaders say Biden’s policies enabled Russia’s invasion of Ukraine,"GOP House leaders on Tuesday took President Biden to task over Russia’s invasion of Ukraine, arguing that the president’s failed policies have emboldened Vladimir Putin to take more aggressive actions.

The statement from House GOP Leader Kevin McCarthy and others came a day after Russian troops rolled into rebel-held areas in eastern Ukraine after Putin said he was recognizing the areas’ independence. GOP leaders called the renewed invasion of Ukraine ""reprehensible.""

""Sadly, President Biden consistently chose appeasement and his tough talk on Russia was never followed by strong action,"" GOP leaders said.

""Lethal aid was slow-walked, anti-air and anti-ship capabilities were never directly provided, pre-invasion sanctions proportionate to the aggression Putin had already committed were never imposed, and sanctions on Nord Stream 2 were waived.""

The Nord Stream 2 undersea pipeline directly links Russian gas to Europe via Germany and is complete but not yet operating. It has become a major target as Western governments try to exert leverage on Russia to deter further military moves against its neighbors.

GOP leaders said the U.S. and its allies must make the Putin regime ""pay for this aggression."" They called on President Biden to take a more aggressive approach in curbing Putin’s ambitions.

TRUMP SAYS CHINA ‘ABSOLUTELY’ GOING AFTER TAIWAN AFTER RUSSIA-UKRAINE ‘DISASTER’

""[W]e must permanently end Nord Stream 2, implement secondary sanctions on Russian financial institutions, and impose crippling penalties on the industries which the Russian military relies on to make war,"" GOP leaders said. ""Moreover, as House Republicans have been saying for a year, President Biden must finally promote U.S. energy development and help the United States become Europe’s energy partner of choice.""

The letter was signed by House Minority Leader Kevin McCarthy, House Minority Whip Steve Scalise, Republican Conference Chairwoman Elise Stefanik, House Intelligence Committee Ranking Member Mike Turner, House Foreign Affairs Committee Ranking Member Michael McCaul of Texas and Ranking Member of the Armed Services Committee Mike Rogers of Alabama.

FLASHBACK: ROMNEY CALLING RUSSIA ‘OUR NUMBER ONE GEOPOLITICAL FOE’ PROMPTED MEDIA ONSLAUGHT IN 2012

Later Tuesday, President Biden ordered heavy U.S. sanctions against Russian banks and oligarchs. Speaking from the White House, Biden accused Putin of flagrantly violating international law and promised that more sanctions would be coming if Putin proceeds further.

""None of us will be fooled"" by Putin's claims about Ukraine, the U.S. president said.

Biden said he was also moving additional U.S. troops to the Baltic States on NATO's eastern flank bordering Russia. The prime minister of Estonia and presidents of Latvia and Lithuania on Friday had made a direct plea to Vice President Kamala Harris for the U.S. to step up its presence in the Baltics.

Biden said the U.S. would impose ""full blocking"" on two large Russian financial institutions and ""comprehensive sanctions"" on Russian debt.

""That means we've cut off Russia's government from Western finance,"" Biden said. ""It can no longer raise money from the West and cannot trade in its new debt on our markets or European markets either.""

CLICK HERE TO GET THE FOX NEWS APP

Biden effectively joined the 27 European Union members who unanimously agreed on Tuesday to levy their own initial set of sanctions targeting Russian officials over their actions in Ukraine.

The Associated Press contributed to this report.",https://www.foxnews.com/politics/gop-house-leaders-biden-enabled-russias-invasion-ukraine,N/A
