title,text,url,published_time
'Frozen Conflict': A look back at 2022's key moments in Ukraine's fight with Russia,"While much of the world celebrates Christmas and rings in a new year, Ukrainians will be marking the passing the grim milestone of having reached the 10-month mark in Russia's invasion of Ukraine.

""Russian missile strikes are hammering Ukrainian infrastructure, leaving civilians without heat, electricity and drinking water, amid freezing temperatures,"" Rebekah Koffler, a former DIA intelligence officer and the author of ""Putin’s Playbook: Russia’s Secret Plan to Defeat America,"" told Fox News Digital. ""Putin's goal is to dislodge Ukrainians psychologically and abandon the fight.""

Koffler's comments come as Russia's invasion of Ukraine is set to hit the 10-month mark and promises to spill over well into 2023, a sort of stalemate many analysts failed to see coming when Russian forces crossed the border and spilled into Ukraine.

Expectations of a swift victory were likely shared by Russian President Vladimir Putin when he launched what he coined a ""special military operation in Ukraine"" on Feb. 24, a plan designed to bring a quick win that would usher in a new phase of Russian dominance in the region.

BIDEN TO DELIVER PATRIOT MISSILES TO UKRAINE AS ZELENSKYY VISITS WASHINGTON

""Putin expected to subdue Ukraine within days, maximum weeks, force [Ukranian President Volodymyr] Zelenskyy to capitulate or flee and install a new government that is pro-Russian, or at minimum not pro-Western — a new regime that would abandon plans to join NATO,"" Koffler said.

However, such a quick victory for Putin has failed to materialize, setting the stage for a continuation of the war into 2023. As the world waits to see how the war unfolds in the new year, here is a look back at some of the key moments of the conflict in 2022.

Russia builds up forces on its border with Ukraine

As the world celebrated the calendar flipping to 2022, Russia was continuing its months-long build up of forces in Ukraine. By January, military analysts in Ukraine were estimating that Russia had amassed a force of close to 100,000 troops on the border, having ended the year by pushing for a ban on Ukraine joining NATO, a proposal that was rejected by both Ukraine and members of the alliance.

Russian troops began spilling into allied Belarus, also on the border of Ukraine, to conduct military exercises. The continued build up sparked international condemnation from the West, with the U.S. sending $200 million in security assistance to Ukraine and President Biden warning of consequences for Russia in the event of an invasion.

PENTAGON: RUSSIA BUILDUP ON UKRAINE BORDER IS LARGEST SINCE COLD WAR, CONFLICT WOULD BE 'HORRIFIC'

""Russia will be held accountable if it invades,"" Biden said in a January press conference.

However, Russia's military buildup continued, reaching nearly 200,000 troops at Ukraine's border as the eventual invasion neared.

""Russia accumulated, over the course of approximately two months, a build up of 190 000 troops, including military hardware, logistics, supplies,"" Koffler said.

Initial invasion of Ukraine

On Feb. 21, Putin announced Russian recognition of two eastern Ukrainian breakaway regions in Ukraine, the Donetsk People's Republic and the Luhansk People's Republic. The move brought the first round of NATO sanctions against Russia and growing concern that an invasion of Ukraine was imminent.

Undeterred by Western threats, Putin launched his invasion of Ukraine three days later and sent in many of his troops on a mission for the ""demilitarisation and denazification"" of Ukraine.

Within minutes of Putin's announced invasion, explosions could be heard in major Ukrainian cities such as Kyiv, Kharkiv and Odessa. Reports quickly circulated that Russian troops had landed in the crucial coastal city of Mariupol, while observers closely followed large units of Russian forces making a beeline for the capital.

RUSSIAN PRESIDENT VLADIMIR PUTIN ANNOUNCES ANNEXATION OF 4 UKRAINIAN TERRITORIES AFTER 'SHAM' REFERENDUMS

Heavy fighting broke out across the country and eventually spilled into Kyiv, while the Russian air force continued its bombardment of major cities and key infrastructure across the country. Many analysts expected the outmatched Ukrainian military to quickly fold under the pressure, but the country's resistance to the invasion proved more fierce than what had been predicted.

""Putin’s plan failed,"" Koffler said. ""Ukrainians displayed an unparalleled will to fight against a much more powerful opponent. Ukraine’s President Zelenskyy chose to stay and fight with his people instead of accepting the West’s offers to evacuate him. What was supposed to be a 5-7 day blitzkrieg turned into a 10-month-long bloodbath, with no end in sight.""

Billions worth of Western money and weapons continued to flow into Ukraine, giving their seemingly outmatched forces a chance to fend off the offensive. By April, Russian forces in the north began a retreat and reorganization of forces, while Ukraine maintained control of its capital.

ZELENSKYY SAYS MINES AFTER RUSSIAN RETREAT THREATEN KYIV

""A charismatic Ukrainian leader was able to secure billions of dollars in Western security assistance, including sophisticated weaponry, that allowed Ukraine, not only to defend many of its positions but also to re-capture some of the territories occupied by the Russians,"" Koffler said. ""Ukrainian forces also benefited from superior training, real time intelligence, and other types of support provided by the U.S. and NATO.""

Putin's new strategy

Having failed to quickly end the war, Russia reorganized its forces and shifted its focus to the southern and eastern portions of Ukraine. Ukrainian forces were put on the defensive across multiple fronts as the Russians secured key cities and infrastructure and amassed heavy forces with an eye towards maintaining an occupation of areas in Kherson and Donbas.

""Putin replaced multiple commanders and changed his strategy,"" Koffler said. ""He concentrated his forces on Eastern Ukraine, having annexed four regions - Donetsk, Luhansk, Zaporizhzhia and Kherson - clearing doctrinal path to the employment of nuclear weapons, in the event that Russian forces were unable to prevail conventionally.""

UKRAINIAN FORCES RETREATING FROM EASTERN CITY SIEVIERODONETSK TO AVOID BEING ENCIRCLED BY RUSSIANS

Heavy fighting continued in the east and south throughout the spring and deep into the summer, while Putin shifted gears toward targeting critical infrastructure in a bid to weaken the will of Ukraine's civilian population.

""Moscow also launched ‘Strategic Operation to Defeat Critical Infrastructure of the Adversary,’ a war fighting doctrine, developed on Putin’s orders a decade ago as part of the plan to restore control over post-Soviet states, which Russia views as part or its strategic security perimeter - Putin’s version of the Monroe Doctrine,"" Koffler said.

Russia turned another Western adversary, Iran, to help sustain the new strategy, with the Kremlin purchasing hundreds of ""kamikaze drones"" and other unmanned aerial vehicles (UAVs) from Tehran that have been used to target Ukraine's civilian infrastructure.

The cooperation in Ukraine has seemingly deepened ties between Iran and Russia, with Tehran going so far as to send military advisers to Crimea to train Russian forces on the use of the UAVs.

However, bolstered by continued U.S. and allied security assistance, Ukraine showed little sign that it was willing to give up on the regions, with Ukrainian President Volodymyr Zelenskyy vowing to retake the territories currently occupied by Russian forces, including the long-held Crimean Peninsula.

""Crimea is Ukrainian, and we will never give it up,"" Zelenskyy said during an August address.

Ukrainian forces launch massive counteroffensive

Zelenskyy showed he intended to make good on that promise by the end of August, launching a Ukrainian counteroffensive that suddenly put Russian forces on the defensive for the first time in months.

RUSSIAN TROOPS PULL BACK AS UKRAINIAN SOLDIERS RETAKE KEY AREAS IN KHARKIV

Ukrainian forces attacked long-held Russian positions across the south and eastern regions of Ukraine with fierce flighting that eventually led to Ukraine regaining control of large areas it had lost in the months before.

""Zelenskyy mounted a blistering counter-offensive, in which Ukrainian forces recaptured approximately 5% of the 20% of Ukraine’s territory occupied by the Russians,"" Koffler said.

The offensive also worked to reignite international support for Ukraine, ushering in a renewed round of security assistance to assist Ukrainian forces in maintaining the offensive.

""He continued to galvanize the West to help his country defeat the Russian occupiers,"" Koffler said of the Ukrainian leader.

The Ukrainians had also once again dealt a large blow to Putin's war plan, forcing the Russian leader to bring more new troops to the fight as heavy Russian casualties mounted.

""Putin drafted an additional 318,000 troops, having invoked a partial mobilization, the first since World War II,"" Koffler said.

The offensive also forced Putin to admit that the conflict could be a protracted one, which would require the government to increase its funding for the effort.

WITH RUSSIA'S RETREAT FROM KHERSON, RUSSIA AND UKRAINE HAVE AN OPPORTUNITY TO NEGOTIATE PEACE

""Putin publicly acknowledged that Russia is in it for the long haul, having raised Russia’s defense budget for 2023 to $84 billion, a 40% increase,"" Koffler said. ""Military age Russian men are fleeing by the thousands to escape mobilization.""

Meanwhile, crippling international sanctions proved to be an obstacle to Russia's aims, limiting Putin's ability to resupply his forces with gear and munitions while applying pressure on him politically.

""The West placed draconian sanctions on Russia, Russian businesses, oligarchs and even Putin’s family,"" Koffler said. ""The U.S. and European governments placed price caps on Russian oil, to hamper Putin’s ability to finance his war on Ukraine.""

The road ahead

As Zelenskyy made his historic trip to the White House to meet with Biden this week, the future of the war in Ukraine remains as uncertain as ever. While the Ukrainian leader appealed for greater assistance, the U.S. is seeking to balance its continued support with Ukraine while attempting to avoid risking further escalation with Putin.

""Putin feels cornered - he cannot accept defeat,"" Koffler said. ""It would mean not only loss of face for an arrogant West-bashing former spy operative, but most importantly, an anti-Russian neighbor, with which his country shares 1,400 miles border - which likely will host NATO forces, Russia’s top perceived adversary.""

UKRAINE'S ZELENSKYY VISITS FRONTLINE AS PUTIN CONCEDES SITUATION 'EXTREMELY DIFFICULT' IN ANNEXED REGIONS

Zelenskyy's trip came as Biden announced an additional $1.8 billion in security assistance in Ukraine, which will for the first time will include Patriot missile systems Kyiv has long coveted. It also comes as Congress appears poised to sign off on an additional $45 billion in aid for Ukraine, a development Koffler believes will make it hard for Russia to achieve its war aims.

""Putin cannot win either so long as NATO continues to ramp up its supplies of long range missiles to Ukraine,"" Koffler said. ""He is probably mulling two options: 1) a protracted war of attrition - which suites his definition of victory because so long as there’s an active conflict in Ukraine, it cannot become part of NATO - Putin's red line; 2) Russia’s escalate-to-de-escalate nuclear strategy to shock Ukraine into submission and to disorient the West, at least temporarily and abandon support for Kyiv.""

During Zelenskyy's address to a joint meeting of Congress Wednesday, the Ukrainian leader stressed the importance of supporting Ukraine now, arguing that Russia's aggression could eventually threaten NATO allies or even the U.S. homeland.

""The struggle will define in what world our children and grandchildren will live,"" Zelenskyy said. ""This battle cannot be frozen or postponed, it cannot be ignored hoping that [an] ocean or something else will provide protection.""

He also pointed to Russia's renewed partnership with Iran, warning the two ""terrorist"" countries cooperation threatens the rest of the world.

""When Russia cannot reach our cities by its artillery, it tries to destroy them with missile attacks and allies in the genocidal policy with Iran,"" Zelenskyy said. ""Iran has become a critical threat to our infrastructure. The terrorists have found each other.""

As the war continues into 2023, Koffler does not see an end to the stalemate in sight, instead characterizing the war as a ""frozen conflict.""

""There’s no military path to victory either by Ukraine or by Russia in this conflict."" Koffler said. ""Ukraine cannot win because it doesn’t have nuclear weapons and Russia does.""

PUTIN LANDS IN BELARUS TO PRESSURE ALLY TO JOIN THE OFFENSIVE IN UKRAINE WAR

However, Koffler noted that despite Russia's view that Ukraine is a critical buffer between itself and NATO, a path to victory for Russia will also remain elusive.

""Moscow cannot win this war, militarily so long as the U.S. and Europe continue to supply lethal military hardware to Ukraine,"" Koffler said. ""But if NATO deployed forces into the theater - the only way to defeat Russia, conventionally — Putin will authorize a tactical nuclear strike in Ukraine. Biden knows this, this is why he announced in the beginning of this was that the U.S. will not deploy troops to fight on Ukraine’s behalf.""

Koffler also expressed pessimism at the chances the sides could reach a diplomatic solution to end the conflict, arguing that the terms of such a solution would likely be unacceptable to both sides.

""This is rapidly turning into Afghanistan 2.0,"" Koffler said. ""My assessment is that 2-5 years from now, there will still be fighting on the ground in Ukraine. Even if some sort of a deal is brokered eventually — which I see no chance of right now — it will not bring ultimate peace because neither side trusts the other.

""The U.S. national security apparatus believes Putin would attack a NATO country if he is allowed to win in Ukraine— a nonsensical conclusion, given that the Russian military is failing to secure a clear military victory in Ukraine,"" she continued. ""And Putin will never trust Washington - he knows that its goal is to remove him from power and to orchestrate Russia’s collapse.""

CLICK HERE TO GET THE FOX NEWS APP

However, Zelenskyy stressed the opposite in his speech, arguing that helping Ukraine achieve victory over Russia is a critical element to the defense of democracy around the world.

""Your money is not charity,"" he said. ""It’s an investment in the global security and democracy that we handle in the most responsible way.""",https://www.foxnews.com/world/frozen-conflict-look-back-2022s-key-moments-ukraines-fight-russia,N/A
Israel conflict: How has Hamas grown a rocket arsenal?,"In this fourth war between Israel and Gaza’s Hamas rulers, the Islamic militant group has fired more than 4,000 rockets at Israel, some hitting deeper in Israeli territory and with greater accuracy than ever before.

The unprecedented barrages reaching as far north as the seaside metropolis of Tel Aviv, coupled with drone launches and even an attempted submarine attack, have put on vivid display a homegrown arsenal that has only expanded despite the chokehold of a 14-year Israeli-Egyptian blockade.

""The magnitude of (Hamas) bombing is much bigger and the precision is much better in this conflict,"" said Mkhaimar Abusada, a professor of political science at Al-Azhar University in Gaza City. ""It’s shocking what they’ve been able to do under siege.""

Israel has argued that the blockade — which has caused severe hardship for more than 2 million Palestinians in Gaza — is essential for preventing a Hamas arms build-up and cannot be lifted.

Here’s a look at how, under intense surveillance and tight restrictions, Hamas managed to amass its cache.

__

FROM CRUDE BOMBS TO LONG-RANGE ROCKETS

Since the founding of Hamas in 1987, the group's secretive military wing — which operates alongside a more visible political organization — evolved from a small militia into what Israel describes as a ""semi-organized military.""

In its early days, the group carried out deadly shootings and kidnappings of Israelis. It killed hundreds of Israelis in suicide bombings during the second Palestinian intifada, or uprising, which erupted in late 2000.

As violence spread, the group started producing rudimentary ""Qassam"" rockets. Powered partly by molten sugar, the projectiles reached just a few miles, flew wildly and caused little damage, often landing inside Gaza.

After Israel withdrew from Gaza in 2005, Hamas assembled a secret supply line from longtime patrons Iran and Syria, according to Israel's military. Longer-range rockets, powerful explosives, metal and machinery flooded Gaza’s southern border with Egypt. Experts say the rockets were shipped to Sudan, trucked across Egypt’s vast desert and smuggled through a warren of narrow tunnels beneath the Sinai Peninsula.

In 2007, when Hamas fighters pushed the Palestinian Authority out of Gaza and took over governing the coastal strip, Israel and Egypt imposed their tight blockade.

According to the Israeli military, the smuggling continued, gaining steam after Mohammed Morsi, an Islamist leader and Hamas ally, was elected president of Egypt in 2012 before being overthrown by the Egyptian army.

Gaza militants stocked up on foreign-made rockets with enhanced ranges, like Katyushas and the Iranian-supplied Fajr-5, which were used during the 2008 and 2012 wars.

A HOMEGROWN INDUSTRY

After Morsi's overthrow, Egypt cracked down on and shut hundreds of smuggling tunnels. In response, Gaza’s local weapons industry picked up.

""The Iranian narrative is that they kick-started all the missile production in Gaza and gave them the technical and knowledge base, but now the Palestinians are self-sufficient, said Fabian Hinz, an independent security analyst focusing on missiles in the Middle East. ""Today, most of the rockets we’re seeing are domestically built, often with creative techniques.""

In a September documentary aired by the Al-Jazeera satellite news network, rare footage showed Hamas militants reassembling Iranian rockets with ranges of up to 50 miles and warheads packed with 385 pounds of explosives. Hamas militants opened unexploded Israeli missiles from previous strikes to extract explosive materials. They even salvaged old water pipes to repurpose as missile bodies.

To produce rockets, Hamas chemists and engineers mix propellant from fertilizer, oxidizer and other ingredients in makeshift factories. Key contraband is still believed to be smuggled into Gaza in a handful of tunnels that remain in operation.

Hamas has publicly praised Iran for its assistance, which experts say now primarily takes the form of blueprints, engineering know-how, motor tests and other technical expertise. The State Department reports that Iran provides $100 million a year to Palestinian armed groups.

THE ARSENAL ON DISPLAY

The Israeli military estimates that before the current round of fighting, Hamas had an arsenal of 7,000 rockets of varying ranges that can cover nearly all of Israel, as well as 300 anti-tank and 100 anti-aircraft missiles. It also has acquired dozens of unmanned aerial vehicles and has an army of some 30,000 militants, including 400 naval commandos.

In this latest war, Hamas has unveiled new weapons like attack drones, unmanned submarine drones dispatched into the sea and an unguided rocket called ""Ayyash"" with a 155-mile range. Israel claims those new systems have been thwarted or failed to make direct strikes.

The Israeli military says its current operation has dealt a tough blow to Hamas' weapons research, storage and production facilities. But Israeli officials acknowledge they have been unable to halt the constant barrages of rocket fire.

CLICK HERE TO GET THE FOX NEWS APP

Unlike guided missiles, the rockets are imprecise and the vast majority have been intercepted by Israel’s Iron Dome defense system. But by continuing to frustrate Israel's superior firepower, Hamas may have made its main point.

""Hamas is not aiming for the military destruction of Israel. Ultimately, the rockets are meant to build leverage and rewrite the rules of the game,"" Hinz said. ""It’s psychological.""",https://www.foxnews.com/world/how-has-hamas-created-a-rocket-arsenal-israel,N/A
"In northern Myanmar, a forgotten conflict intensifies","next Image 1 of 2

prev Image 2 of 2

The war between Myanmar's army and ethnic Kachin rebels is intensifying in the country's north.

The United Nations says 10,000 civilians have been displaced since January.

The conflict has ground on for generations. But it has largely been forgotten and recently it has been overshadowed in Myanmar by violence against Rohingya Muslims in the west, nearly 700,000 of whom have been driven into exile since August.

This month, rebel officials say the army has stepped up attacks in gold and amber mining regions of Kachin state.",https://www.foxnews.com/world/in-northern-myanmar-a-forgotten-conflict-intensifies,N/A
