title,text,url,published_time
The Squad Is Way More Anti-Semitic Than Trump’s Dinner With Ye - The American Spectator,"Donald Trump’s dinner last month at Mar-a-Lago with the vile Kanye West, now legally known as “Ye,” and Holocaust denier Nick Fuentes has thrust the conversation surrounding anti-Semitism into the national spotlight. Republican lawmakers correctly criticized the get-together, which by most accounts concluded in a heated exchange between Trump and West over the rapper suggesting that the former president join the presidential ticket as his running mate. For their part, Democrat denouncements over the affair included White House press secretary Karine Jean-Pierre affirming in a Nov. 28 press conference that “this administration, this President totally rejects bigotry, racism, antisemitism.” That same day, Senate Majority Leader Chuck Schumer (D-N.Y.) spoke on the Senate floor and condemned Trump’s decision to “meet with this antisemite.” The disturbing language used by West reflects the hateful ideology espoused by anti-Semitic Nation of Islam leader Louis Farrakhan, who was featured in a suppressed 2005 photograph alongside a beaming then–Illinois Sen. Barack Obama, which surfaced following Obama’s presidency. Schumer’s curious omission of West from his statement marks cowardice in denouncing anti-Semitism if it conflicts with the progressives’ preferred white-nationalist narrative.

The evolving criticism over Trump’s unfortunate meeting highlights how liberals are successfully manipulating the dialogue involving anti-Semitism to distract from the Democrats’ embrace of progressive Jew-haters, with whom they frequently dine, praise, and elevate to influential government positions.

One day following Jean-Pierre’s comments, anti-Semitic “Squad” member Rep. Ilhan Omar (D-Minn.) tweeted her “delight to root for #TeamUSA” after attending the World Cup in Qatar, where she was part of a small delegation accompanying U.S. Secretary of State Antony Blinken. Omar currently serves as vice chair of the House Foreign Affairs Committee’s Subcommittee on Africa, Global Health, Global Human Rights, and International Organizations. The congresswoman, and a growing number of Democrats, display their hatred of Jews by attacking Israel. Omar recently cosponsored an anti-Israel House resolution, introduced by Democrat Rep. Rashida Tlaib (Mich.), that calls for the U.S. to use the term “Nakba,” defined as “catastrophe,” when discussing the creation of the state of Israel. It bears mentioning that New York Rep. Jamaal Bowman, another co-sponsor of the “Nakba” measure, received Schumer’s endorsement during the last election.

Blinken’s invitation to Omar was extended despite the congresswoman’s questionable associations with Qatari officials. In 2019, a witness confirmed to the Jerusalem Post that Omar was “recruited by a foreign government, received funding from a foreign government, and passed sensitive information through intermediaries to Iran.” Kuwait-born Canadian businessman Alan Bender made the allegations during a trial involving the Qatari emir’s brother. According to testimony, Omar was the “crown jewel” of U.S. politicians and used her position to recruit other like-minded lawmakers. Omar denied the accusations and predictably disparaged her detractors as “Islamophobes.” Employing a similar tactic, Omar is currently attempting to fend off House Republican leader Kevin McCarthy’s justified threat to fulfill his promise of removing her from the House Foreign Affairs Committee should he become the House majority leader.

Omar’s trip to Qatar underscores liberal comfort with promoting the political stature of anti-Semites. Serving as a portent of the party’s ideological intent, outgoing House Speaker Nancy Pelosi posed with anti-Israel members of Congress, Rep. Alexandria Ocasio-Cortez (D-N.Y.) and Omar, on a 2019 Rolling Stone cover titled “Women Shaping the Future.” Last year, Omar equated the actions of the U.S. and Israel to that of terrorist groups like the Taliban. Her colleague Tlaib once called for the destruction of the world’s sole Jewish homeland in a since-deleted 2020 tweet. In 2021, President Joe Biden gushed over Tlaib while visiting Michigan and expressed his admiration for the lawmaker’s “intellect.”

The trafficking of anti-Semitism by Democrats is having a deleterious effect on U.S. policy toward Israel and Jewish Americans. As “moderate” congressional Democrats such as Ted Deutch retire, other policymakers, including New Jersey Rep. Josh Gottheimer, are increasingly sidelined. The controversial lobbying group J Street, which featured Blinken as its headliner this week, basked in its endorsements’ electoral success. It witnessed victories by candidates like Pennsylvania Rep.-elect Summer Lee, whose campaign received a boost following an October fundraiser held by her future Squad comrades. At universities, assaults against Jewish students occur under the anti-Zionist umbrella, with leftists leaving Jewish youth unwarrantedly exposed to its deceitful smearing of Israel as an “apartheid” state. The AMCHA Initiative, an organization investigating and combating campus anti-Semitism, revealed in its report this year that attacks involving Jewish identity on campus jumped 100 to 200 percent in the academic year following Israel’s 2021 war with Hamas. The study notes that the presence of Israel-hate groups on campus more than doubled the likelihood that a campus would play host to anti-Semitic activity.

Democrats’ dubious outrage over Trump’s behavior is evidenced by years of boosting anti-Semites into government echelons. The party’s underwriting of anti-Semitic politicians is a far more potent threat to U.S. Jews than one mistaken meal at Mar-a-Lago.

Irit Tratt is a writer who resides in New York. Her work has appeared in the Jerusalem Post, the Algemeiner, JNS, and Israel Hayom.",https://spectator.org/category/politics/media-bias/,2022-12-07
The Political War President — Trump Live From Ohio - The American Spectator,"Watching Donald Trump’s Ohio rally Saturday reminded me of the best scene in Gone With the Wind, which comes early in the movie at the Twelve Oakes barbecue. It’s a brilliantly constructed sequence wherein Scarlett O’Hara’s (Vivien Leigh) egoistical pursuit of Ashley Wilkes (Leslie Howard) during the grand social occasion contrasts with the undercurrent of imminent Civil War. Except the Southern male aristocrats gathered in the Georgia mansion’s den don’t dread the war, they eagerly look forward to it. “Gentlemen can always fight better than rabble,” one of them crows. Scarlett’s father Gerald (Thomas Mitchell) then asks a more somber Ashley, the wartime troop captain, for his opinion. “Well, gentlemen,” says Ashley. “If Georgia fights, I go with her. But like my father, I hope the Yankees let us leave the Union in peace.” I can appreciate the sentiment. If Trump runs, and wins the Republican nomination, I go with him. But like many others, I hope he passes the “make America great again” baton to a younger warrior.

For I believe political and cultural war is now unavoidable. The other side has crossed the Rubicon. They’ve done more than insult us. They’ve threatened us. Joe Biden and his entire governmental apparatus — spearheaded by AG Merrick Garland’s Justice Department and SecDef Lloyd Austin’s Pentagon — have publicly condemned all patriotic, peaceful opposers to the Marxist transformation of our country as anti-democratic traitors.

And they have put their agents where their mouths are, raiding Trump’s home and intimidating MAGA supporters in true Stasi-like fashion. Now they must be made to pay for it, and so extremely that such a domestic menace will never resurface. This said, Trump’s Youngstown, Ohio speech was the finest, most defiant he has ever given, and the perfect response to Biden’s The Great Dictator screed in Philadelphia.

“I don’t think we’ve ever had a more radicalized or dangerous time in our country,” Trump said. “I watched Biden the other day with the red behind him — and CNN changed it to pink, because they wanted it to look better. But that was terrible, the terrible words that were said. But that’s where they’re coming from. But you know what? We’re strong and we’re smart. We’re smarter than them. We’re stronger than them. Our cruel and vindictive political class is not just coming after me. They’re coming after you through me. They’ve already taken away your vote. They’re taking away your voice. And now they want to take away your freedom. And it’s not going to happen.”

Trump delivered his oration with his typical humor that drives leftists insane. How can he be so flippant, they fume, when the walls are closing in? One reason could be the huge legal double victory Trump had Thursday over the same Garland DOJ that defiled his Mar-a-Lago home. Federal Judge Eileen Cannon not only ignored Justice’s demand she qualify her decision to appoint a Special Master on the FBI-seized documents or face appeal, she assigned the man the Trump team wanted for the job (Raymond Dearie).

Trump even had fun with the “deadly serious” January 6 Committee, calling it “the sham unselect committee.” “Which I thought ended a couple of weeks ago when Liz Cheney lost by a record number. Nobody has ever lost so big before.” That must have stuck in Cheney’s Trump-deranged, soon-to-be civilian craw.

However, Trump was deadly serious, unusually eloquent, and disturbingly accurate in his condemnation of the present statist tyranny: “They want to censor you from the internet, banish you from the public square, get you fired from your jobs, target you for destruction with 87,000 new IRS agents.… Use the FBI to spy on patriotic parents, and criminalize political dissent as if we were a Third World country. But the thugs and tyrants attacking our movement … have no idea of the sleeping giant they have awoken. The American people will never accept the corruption and the ruination of our beloved country.”

Ultimately, Trump hit a high note he had never reached before, in what may one day be known as the “We are a nation” speech, like Ronald Reagan’s 1964 endorsement of the doomed Barry Goldwater became the “A Time for Choosing” speech. Some excerpts from late in his remarks:

We are a nation that surrendered in Afghanistan, leaving behind dead soldiers, American citizens, and 85-billion dollars’ worth of the finest military equipment in the world. We are a nation that allowed Russia to devastate a country, Ukraine, killing hundreds of thousands of people. And it will only get worse. It would never have happened with me as your Commander-in-Chief.… We are a nation that has weaponized its law enforcement against the opposing political party like never ever before.… We are a nation that is allowing Iran to build a massive nuclear weapon, and China to use the trillions of dollars it has taken from us to build a military to rival our own.… And, perhaps more importantly, we are a nation that is no longer respected or listened to around the world.… A nation that is hostile to liberty, freedom, and faith.… We are a nation that has lost its confidence, willpower, and strength. We are a nation that has lost its way. But we are not going to let this continue. Two years ago, we were a great nation. And we will soon be a great nation again.

I’d still prefer Ron DeSantis to be the 2024 Republican presidential nominee. He’s just as tough as Trump yet fresher. But after watching the latter’s well-written and impressively delivered speech, I’m even more certain of one thing. If Trump runs, I go with him.",https://spectator.org/category/politics/nations-pulse/,2022-09-19
The Trumping of Benjamin Netanyahu - The American Spectator,"Political foes of Israel’s old/new Prime Minister Benjamin Netanyahu seem to be borrowing a page from the American left’s playbook. They’ve mounted a worldwide campaign to portray him as a threat to democracy. Much as the threat and then the reality of civil disobedience and uncivil violence was raised against Donald Trump even before he was inaugurated, Netanyahu’s enemies raise the specter of a constitutional breakdown that they themselves organize.

The Israeli left, as the left in so many places, has used such tactics against their political opponents for a long time. The rightist Menachem Begin was portrayed relentlessly by the ruling socialists in the first decades of Israel’s independence as a dangerous revolutionary, and support of him put one beyond the pale — an early version of cancel culture.

The reality of Begin was decidedly different. When he was finally called to join the cabinet in the life and death situation when Israel stood isolated and without any ally against Egypt’s announced plan to wipe it out, Begin advocated making his nastiest political enemy the leader. In Begin’s selfless vision, that man, for all his faults, was a proven a dauntless war-time leader. And when Begin became prime minister about ten years later, he respected the constitutional norms scrupulously, showing the left’s calumnies to be just that. And Begin’s term finally verified Israel’s democratic credentials, much as Jefferson’s ascension did in 1801, showing that the nation was larger than one political faction.

Netanyahu’s position is different than Begin’s. There has been real choice in Israel ever since Begin, with the Right and the Left surging and ebbing in turn, as in all the other democracies. What he faces is a constitutional aberration sorely in need of correction — the slow usurpation by Israel’s judiciary of the supreme power of the state, power limited only by their own all-too-imperfect consciences.

There are some parallels to the establishment of meaningful power in the hands of America’s judiciary. Until John Marshall became Chief Justice, the courts were insignificant in comparison to the other two branches, where real political power was being exerted. It took Marshall’s genius to make the judiciary a co-equal partner in the Marbury decision, an enduring landmark in the progress of free constitutional government.

But Marshall worked with a written Constitution. And although Israel has written Basic Laws, they are more of an afterthought, not the incredibly well-thought-out structure of America’s Constitution.

For much of Israel’s governmental structure maintains continuity with British law, the law that ruled the Holy Land for the three decades preceding Israeli independence. Britain’s constitution is unwritten, and decisively rejected the idea of judicial review.

That rejection took place in the political ferment in the decades leading up to England’s Civil War. The great jurist, Justice Edward Coke, dared to challenge King James I by asserting that the law was supreme over kings as well as commoners. This was an old strain, introduced less pointedly by Fortescue in the late Middle Ages, and based by Fortescue on biblical precedent — even kings are answerable to G-d’s laws and any sovereign powers they have depend on their faithfulness to the Sovereign of Universe.

Coke’s brilliant scholarship and articulateness threatened not only the king, who neutralized his judicial power, but also left him without allies in Parliament, who did not care for his claim of judicial supremacy any more than did the king. Coke eventually joined forces with the parliamentarians and helped to bring about the great Petition of Right, marking the beginning of Parliament’s successful struggle to become the supreme political and legal power.

So, there was no early assertion of judicial power against an all-powerful parliament in Israel. It followed the British model. But when the opposition took power finally in Israel, things were ripe for change, just as the first change in power in America set the stage for Marshall to establish the power of the judiciary.

For just as Marshall was the last of the old Federalist guard to have a hold on power in the U.S., so too were the judges in Israel people appointed by the left in all their years of rule, and so were the only ones still in positions of power, though that power was as yet undeveloped.

It took some years and the leadership of a powerful will and intellect in the person of Israel’s former chief justice, Aharon Barak. He expanded the power of the courts, making them an effective check on the Knesset’s power and on that of the governments that Israel’s parliament maintains.

The development of an independent judiciary is of paramount importance in maintaining political freedom. Without the power to assert the supreme force of the underlying compact that binds government and the governed, democracies become people’s republics, democratic in name only. Unrestrained power in the hands of the legislature or executive, over time, always generates abuse.

But who governs the governor? Lincoln raised the question in the wake of the disastrous Dred Scott decision, which helped to undermine the Constitution’s hold on the people and grease the skids to civil war. Lincoln’s powerful arguments in the Douglas debates made a strong case that the power of the judiciary as well is subject to the undying sovereignty of the people.

Lincoln’s insight was firmly based in American political thought. In Federalist 51, Madison made his argument for setting up co-equal powers that would hold each other in check by the balancing opposition of their natural and fallible ambitions. Gravity by nature pull structures down, but if we design a cantilevered structure, the downward pull of gravity on one part of the structure meets the same downward pull on the other side, and the structure stands firm. Government is not then dependent on the powerholders being perfect, which is just as well, for perfect people are in short supply. As Madison memorably put it:

Ambition must be made to counteract ambition. The interest of the man must be connected with the constitutional rights of the place. It may be a reflection on human nature, that such devices should be necessary to control the abuses of government. But what is government itself, but the greatest of all reflections on human nature? If men were angels, no government would be necessary.

That’s true even in the Holy Land.

What Barak did verifies Madison’s observation. We Americans know that even with rights specified in words, a skilled player can game it. Despite the 13th, 14th, and 15th Amendments and civil rights legislation after the Civil War, our justices and most of the rest of our political society tolerated the de facto extension of quasi-slavery for many decades. How much the more so are the opportunities when the constitution is in the British mode — or was made to be so.

For Israel has Basic Laws, a sort of a constitution, and they were held in that kind of esteem—until Barak decided that his court was the judge of which Basic Laws could stand. In America, it would be as if SCOTUS could rule on the Constitution and declare the parts it didn’t like invalid. This makes the court the sovereign power, subject to nothing other than its own sense of what is right, and accepting no constraints from anyone. At least in the headiest days of the Warren Court, the justices believed — or at least said they believed — that their penumbras and such were actually in the Constitution, and so had its authority.

But Barak’s judicial activism was breathtaking in its raw assertion of power, implying that he and his cohorts were indeed so angelic as to be able to properly wield such divine power. Barak’s tactics seemed more Machiavellian than heavenly. He moved with great skill to gut the power of the elected government by subjecting it to judicial oversight unaccountable to any law.

Jonathan Rosenblum of Mishpacha magazine writes:

Barak’s tactical acumen reached its peak in his transformation of the position of attorney general from one of acting as the government’s chief legal advisor and representative to one of acting as the de facto emissary of the Court to keep an eye on the legislative and executive branches — all without a stitch of statutory warrant. Barak ruled that the attorney general — a position in which he served from 1975 through 1978 — can nix any government action he determines to be unreasonable, and thus illegal. And that decision is not subject to judicial review.

And we think that Special Prosecutors have too much power!

Barak is no longer on the court, but he is fighting the political battle to gut Netanyahu before he can fulfill his campaign promise to reform the runaway power of this rogue government branch. The justices who have inherited his power have now ruled that Netanyahu cannot hold a portfolio in the government while the attorney general continues his endless pursuit of a bribery charge that he continues to hold over his head without ever bringing evidence capable of conviction. The court has also just ruled one of Netanyahu’s picks for his Cabinet may not be seated, something that could result in the dissolution of Netanyahu’s majority coalition.

This is just the briefest of summaries of the situation. It is enough to disabuse the reader of the line of American legacy media, which this audience suspects with good reason of being not accurate.

Netanyahu prizes The Federalist as one of the greatest works of political thought in human history. There’s little doubt that his effort to rebuild the cantilever that Barak collapsed and to rebalance the government among branches close to co-equal would command Madison’s approval as well.",https://spectator.org/category/politics/political-hay/,2023-01-22
