title,text,url,published_time
FBI Uses Phony Photo to Try and Frame Trump - The American Spectator,"A personal note: I know former President Donald Trump. I have been privileged to visit him over the years in his Trump Tower office and residence before he was president. Later, I visited him in the Oval Office while he was president, along with my American Spectator colleagues Bob Tyrrell and Wlady Pleszczynski. While there, the president took us back to the inner recesses of two smaller rooms that provide the president of the moment with more private office space.

Fact: The former president is what is called in the vernacular a “neatnik.” I’m one as well, and the precise, literal dictionary definition is “a person who is compulsively neat.”

And “neatnik” perfectly describes Trump.

Which brings us to that now-infamous photo published by the FBI of classified documents at Mar-a-Largo — the documents spread willy-nilly all over the floor.

Hello? Hello?

There is no way Trump would have real-estate brochures or family photos spread around on the floor of his various offices, let alone classified documents that had been declassified. Never, say again never, in all my visits in various places was anything remotely out of place.

Which is to say that this photograph looks like a deliberate attempt to frame Trump for something he would never do in a thousand years even if he had never been president. Trump himself has insisted, “They dropped them, not me — Very deceiving.”

So, if true, the obvious question? Who specifically in the FBI removed those documents from whatever container they were in and willfully — deliberately — spread them all over the floor in Trump’s Mar-a-Lago estate, taking a photograph to deliberately mislead the public? Something that in and of itself would be surely a violation of security procedures if not of federal law.

In fact, how were these documents handled by the FBI? Were the FBI agents wearing gloves as they handled them? If not, look to this information, supplied by the FBI itself on the official FBI website. The headline:

All About Fingerprints Fingerprints vary from person to person (even identical twins have different prints) and don’t change over time. As a result, they are an effective way of identifying fugitives and helping to prove both guilt and innocence.

Got it. So, it shouldn’t be hard for the bureau to identify the fingerprints on these documents and inform the American people just who in their Trump-raiding posse appears to have mishandled classified information and have tried to frame a former president with a phony, staged photograph.

This phony photograph really is just one more piece of evidence suggesting that the FBI has deliberately, willfully tossed aside the immense respect Americans once had for this once-great law-enforcement institution. Whether it was the anti-Trump shenanigans of the now-disgraced former agent Peter Strzok; or the corruption of former Director James Comey and Deputy Director Andrew McCabe; or the just-revealed resignation of Timothy Thibault, an assistant special-agent-in-charge, over allegations that he “helped shield Hunter Biden from criminal investigations into his laptop and business dealings”; or, now, what appears to be an abysmally clumsy attempt to use a faked photograph to frame Trump — the FBI is in serious trouble. And, assuming there is a Republican House majority after the midterm elections, the bureau should be investigated from top to bottom. (READ MORE: Judge Rejects DOJ Bid to Keep Trump Affidavit Sealed: Impeach Garland and Wray)

Bottom line?

Anybody who knows Donald Trump and has been privileged to spend time with him in various Trump domains knows that this photograph of classified documents spread helter-skelter on the floor looks like nothing more than a quite deliberate falsehood — a photographic lie designed to frame him with a manufactured, blatant untruth.

And the American people have a right to know exactly who did this.

Not to mention what their punishment will be.",https://spectator.org/category/politics/constitution-law/,2022-09-02
House Jan. 6 Report Exposes That Trump Only Cares About Himself — And Not His Supporters - The American Spectator,"Donald Trump is counting on the fact that most Americans aren’t reading the House Jan. 6 report — I am an exception — and don’t really care what’s in it.

The four criminal charges the committee recommended in 845 pages — obstruction of an official proceeding, conspiracy to defraud the United States, conspiracy to make a false statement, and assisting an insurrection — don’t capture the chaos that led to this moment.

Of course, every American charged with a crime should be presumed innocent in a court of law. And yet I’m not the only Trump critic who wonders if the feds should not prosecute the 45th president because it would put the former president front and center when fans and haters alike are ready for him to fade away.

Here’s what I learned from the report, which I should note was produced by an overwhelmingly Democratic committee joined by outgoing Reps. Liz Cheney, R-Wy., and Adam Kinzinger, R-Ill.

Trump knew he lost, but he repeated The Big Lie anyway.

The base believes Trump won in 2020 in part because the base thinks that Trump believes he won in 2020. The report documents the many times that Trump was informed that his claims of fraud were bogus, but he repeated them anyway.

For example, Trump signed “a knowingly false representation” to a federal court in a case involving Georgia, wrote U.S. District Court Judge David Carter.

“I have no doubt that an aggressive DA or US Atty someplace will go after both the president and his lawyers once all the dust settles on this,” wrote Trump lawyer John Eastman.

“The emails show that President Trump knew that specific numbers of voter fraud were wrong,” wrote Carter, “but continued to tout those numbers, both in court and in public.”

Trump made fun of his most stalwart defenders.

Former aide Hope Hicks told the committee that Trump was skeptical when his credibility-challenged attorneys claimed “massive influence of communist money through Venezuela, Cuba, and likely China” in the U.S. elections. Later, as he talked with Powell, who had linked Dominion voting machines to Venezuela, he muted the phone so that he could say of Powell’s remarks, “This does sound crazy, doesn’t it?”

Trump’s zaniest and crummiest lawyers knew that Trump lost.

Don’t feel too bad for Powell. Her legal team responded to a $1.3 billion defamation lawsuit filed by Dominion with the argument that reasonable people would not accept her statements “as fact but view them only as claims that await testing by the courts through the adversary process.”

Crazy-car attorney John Eastman, the report noted, “all but admitted that (his plan) didn’t work” and likely would fail 9–0 if before the Supreme Court.

Team Normal outnumbered the Clown Car.

“Team Normal” was the phrase former campaign manager Bill Stepien used to distinguish professional aides from the Trump “Clown Car” — a phrase created by former Attorney General Bill Barr. As Trump continued to push his Big Lie, Team Normal — Barr, Stepien — stepped back and the Clown Car took the lead.

A former Trump official told New York Magazine’s Olivia Nuzzi, “There were always weird people around him, but the more normal people disappeared, and all he’s surrounded by are the cuckoo birds.”

I covered the Trump White House. I know that most staffers were normal people.

As Trump was trying to push DOJ lawyers to act against their instincts and put a sycophant at the helm, department lawyers threatened to quit and leave the department a “graveyard.”

Acting Deputy Attorney General Richard Donoghue told Trump, “Mr. President, these aren’t bureaucratic leftovers from another administration. You picked them. This is your leadership team. And what happens if, within 48 hours, we have hundreds of resignations from your Justice Department because of your actions?”

In the end, Trump had to give up the fight to avert a mass walkout.

But first the likes of “body man” — read: nonlawyer — John McEntee wrote a one-pager that argued that the vice president “has substantial discretion to address issues with the electoral process.”

It was inevitable.

As someone who covered the Trump White House for all four years, I am struck by all the many one-time staffers who refused to parrot the Big Lie. For the most part, their names aren’t well-known outside the Beltway, but they started out with enthusiasm, rooted for the boss to win in 2020, and probably never thought the day would come when the Trump base would dismiss them as traitors and RINOs. And yet Trump’s insistence on pulling everyone behind his Big Lie brought them to this moment.

After Jan. 6, 2021, the love was gone. When I visited the White House, the press office was a ghost town. In the lower press office — a once bustling hub of young aides with promising futures before them — desks were empty. Likewise, the more prestigious upper press office had become a cavern.

Katrina Pierson captured the turn of events when she texted campaign bigfoot-lookalike Brad Parscale after he claimed to be shocked that a woman died during the Jan. 6 insurrection.

Pierson responded, “You do realize this was going to happen.”

Ignore the guy in the Viking hat.

Mark Corallo, a public relations consultant who worked in the Justice Department under Republican Attorney General John Ashcroft, told me that he didn’t read the report and considered the exercise “grossly partisan.”

“I have a great idea,” Corallo said of Trump, “ignore the dude.”

“He’s never going to be president again,” said Corallo, “and the more we talk about him, the more life we give him.”

Corallo argued, “The guy in the Viking Hat” — that would be Jacob Chansley, who also was carrying a six-foot spear and was sentenced to 41 months in prison — “was not going to overthrow the United States government.” The U.S. military never would let that occur, he said confidently.

I’m not as sanguine about what might have been. Then-Vice President Mike Pence spent hours in the Capitol loading dock as the crazies stormed the Capitol. He refused Secret Service entreaties to get into a car because he feared agents would ignore his orders — he wanted to stay on the premises so that he could certify the electors’ vote — so they could move him, his wife, Karen, and daughter, Charlotte, out of harm’s way.

Trump was safe in the West Wing, slamming Pence for lacking “courage” while Pence stayed in the same building where a hopped-up mob wanted to destroy him.

Pence stayed so that he could recognize state electors on Jan. 6. (It turns out that the vote was not completed until the wee hours of Jan. 7.)

I cannot help but wonder: what would have happened if the vice president’s motorcade had left the Capitol? Would a Pence exit have been seen as a green light for the faithful to storm what they saw as America’s Bastille?

So while I understand the instinct to cross one’s fingers and hope Trump simply fades away, I say: Never forget.

As one Trump Georgia campaign official said afterward, he felt “angry” because “no one really cared if — if people were potentially putting themselves in jeopardy.” We were just “useful idiots or rubes at that point.”

Let my people in.

As for Trump, he showed his usual disregard for those around him when he tried to persuade the Secret Service to allow supporters who might be armed onto the Capitol Mall after he urged the crowd to “fight like hell” as he pointed toward the Dome.

One-time Special Assistant to the President Cassidy Hutchinson testified that Trump told agents, “I don’t f**ing care that they have weapons. They’re not here to hurt me. Take the f**ing (magnetometers) away. Let my people in.”

In a disaster movie, Trump would be the character who claws between mothers and children for a seat on the lifeboat.

2017 All Over Again

When Trump first assumed office, I naively waited for the moment when the billionaire would realize the awesome responsibility of the presidency and calibrate his behavior accordingly. I hoped that America would see the president who delivered a strong first State of the Union address to atone for his “American carnage” inaugural address.

That hope was dashed in May 2017. After Trump fired FBI Director James Comey, his press team maintained that Trump fired Comey based on a recommendation by Deputy Attorney General Rod Rosenstein based on Comey’s public mishandling of an FBI probe into Hillary Clinton’s emails.

Within days, Trump told a different story when he told NBC News’ Lester Holt that he was going to fire Comey regardless of what the DOJ recommended.

The moment revealed that Trump was ready to destroy the meticulously groomed reputations of his appointees for a fleeting moment’s satisfaction. To spend time in Trump’s orbit is to feel used up and kicked to the curb.

Trump gratuitously jabbed other public servants for just doing their jobs. Trump and Giuliani wrongly accused Georgia election workers Ruby Freeman and Wandrea “Shaye” Moss by name of tampering with the vote count. The asymmetry of the situation was breathtaking — the most powerful man in the world used his position to target two African-American election workers who had to go into hiding because of the president’s gratuitous lies.

If there’s one victory Trump can claim, it is destroying public faith in the election system. A September Monmouth University poll found that nearly a third of Americans — including six out of 10 Republicans — believe Joe Biden won the election because of fraud.

Evidence? Giuliani famously said, “We’ve got lots of theories, we just don’t have the evidence.”

Barr called the phenomenon “Whac-A-Mole” — with Trump claiming fraud or abuse in one state one day, then averting attention to another venue the next, with no public resolution. Trump’s cascading charges didn’t need proof, they only needed to sow doubt.

In the years since 2000, when then-Vice President Al Gore won the popular vote but lost the Electoral College, states have developed multiple strategies to make voting more convenient. Think early voting, automatic registration, and ballot harvesting. The sad result may be that more people think Biden won due to foul play.

And Biden’s not the guy who told Georgia Secretary of State Brad Raffensperger, “I just want to find 11,780 votes.” That was Trump talking.

Official Election Defense Fund, Not

The Big Lie has paid dividends for Trump. For a while, the Republican National Committee sent out fundraising letters that were not fact-checked to raise dollars ostensibly to fund Trump’s legal challenges. The RNC had three of its largest 2020 fundraising days right after the election, for the “Official Election Defense Fund,” which the report notes wasn’t an official election defense fund.

The effort raised some $250 million after Trump lost. Trump must be laughing all the way to the bank.

Some 842 Americans have faced federal charges for illegally taking part in the Jan. 6 insurrection. Many will end up behind bars, yet the former president who urged them on is a free man, safely ensconced in Mar-a-Lago, and raising buckets of money to bankroll his grift. He also is running for president. It just doesn’t seem fair — because it isn’t.

Sidebar

Clown Car

Rudy Giuliani

Sidney Powell

Mark Meadows

John Eastman

Team Normal

Mike Pence

Bill Barr

Alyssa Farah Griffin

Kayleigh McEnany

Debra J. Saunders is a senior fellow at the Discovery Institute’s Chapman Center for Citizen Leadership. Contact her at dsaunders@discovery.org.

READ DIVERSE OPINIONS:

The Jan. 6 ‘Criminal Referrals’ Against Trump Are Political Bunk

There Is No Path for Donald Trump to Become the Republican Nominee

Trump’s Enemies Underestimate Him — Again

Trump the Constitution Shredder",https://spectator.org/category/politics/daily-folios-and-consecutive-sentences/,2022-12-29
Letitia James’ Campaign Strategy: Suing Trump - The American Spectator,"New York Attorney General Letitia James filed a civil suit against former President Donald Trump and three of his children on Wednesday. Thank goodness her solving New York’s crime problem allows Ms. James to devote resources to civil matters.

She seeks both a “minimum” of $250 million and sanctions that bar the defendants from acquiring real estate in New York, serving as an officer for any corporation there, and applying for loans in the Empire State. It seems harsh but, then again, so does the melodramatic Ms. James.

Political opponents in El Salvador, Honduras, Colombia, Panama, Nicaragua, and Mexico, countries also facing terrible crime and myriad economic problems at the time, legally pursued former presidents as James does now. This finds no precedent in American history. But among banana republics, the justice system being wielded as politics by other means comes as the price of entering the arena.

James fulfilled a campaign promise on Wednesday in filing suit against Trump.

“I’m running for attorney general because I will never be afraid to challenge this illegitimate president when our fundamental rights are at stake,” she explained in a video promoting her campaign ahead of the 2018 Democratic primary.

Four years later, James, either unable to obtain or unwilling to pursue a criminal indictment, has filed a civil suit against the former president.

“He should be charged with obstructing justice,” James said in the 2018 video. “I believe that the president of these United States can be indicted for criminal offenses, and we would join with law enforcement and other attorneys general across this nation in removing this president from office.

“In addition to that, the office of attorney general will continue to follow the money because we believe he’s engaged in a pattern and practice of money laundering. Laundering the money from foreign governments here in New York State, and particularly related to his real estate holdings.”

James charged in her press conference that Trump and his children “violated several state criminal laws.” Then why sue him in civil court rather than try him in a criminal court?

James uses her position to target political enemies by civil suit, press conference, and news release. She displayed this modus operandi in declaring, in almost the exact words she used for Trump, that former New York Gov. Andrew Cuomo, a man she had hoped to replace in Albany before poor polling dashed that dream, “violated multiple state and federal laws.” Then she cowered from prosecuting Cuomo for these supposed violations just as she now refuses to pursue a prosecution of Trump.

“The NRA is fraught with fraud and abuse,” James said, upon filing a lawsuit against the National Rifle Association, “which is why, today, we seek to dissolve the NRA, because no organization is above the law.”

James boasts of a “comprehensive three-year investigation,” obtaining “millions of pages of documents,” and hearing from “65 witnesses” during the Trump inquiry. When a public official commits those kinds of resources to an investigation that concludes with a civil suit — the kind of cases heard in Judge Hatchett, Judge Judy, and Judge Mathis — The Price Is Right’s sad horn blows in everybody’s ears.

James on Wednesday rejected the notion “that this is part of a witch hunt,” and over the summer she insisted of her investigations, “This has nothing to do with politics…. It has to do with the law.”

But polling from last week shows that the incumbent attorney general is trailing her Republican challenger by a point and, more troubling for her reelection campaign, receiving just 43 percent of the vote. The fact that New Yorkers soured on her after witnessing and feeling the consequences of another of her campaign promises — ending cash bail — does not surprise.

When James found herself in a tough Democratic primary in 2018, she started saying “Trump” the way other people use “the” and “is.” Four years later, trailing her Republican opponent, she again invokes Trump, Trump, Trump.

James concluded her prepared remarks on Wednesday by characterizing her suit as “making good” on a “promise.”

For so many familiar with her rhetoric in the 2018 election, the promise kept seems like her Third Worldish pledge to pursue a political enemy.",https://spectator.org/category/politics/deep-state/,2022-09-22
"McCarthy’s Win Was a Trump Victory, and the Media Can’t Stand It - The American Spectator","Newly elected Republican Speaker of the House Kevin McCarthy was crystal clear after his 15-ballot election win. National Review reported:

“I do want to especially thank President Trump,” McCarthy told reporters. “I don’t think anybody should doubt his influence. He was with me from the beginning … he was all in.” “He would call me, and he would call others. He really was — I was just talking to him tonight — helping get those final votes,” McCarthy said. “What he’s really saying, really, for the party and the country, that we have to come together. We have to focus on the economy. We’ve got to focus, make our borders secure. We gotta do so much work to do, and he was a great influence to make that all happen. So, thank you President Trump.”

McCarthy could not have been clearer. Former President Donald Trump went out of his way to campaign for McCarthy — and it worked. McCarthy won.

Trump triumphed.

So where are the countless media reports that McCarthy himself is attributing his win to Trump? After all, if a Trump-backed candidate lost in 2022, the media and Trump critics were quick to pounce and blame the loss on Trump.

The obvious reason for the liberal media silence on Trump’s triumph is, of course, that the liberal media is not about reporting news. First, last, and always, they are about fake news — and targeting Trump.

Take this utterly laughable headline from the Huffington Post:

Trump Weighs In On Speaker Battle And Winds Up Proving His Weakness In The House, Too

Oops.

CNN gloated early on in the voting process:

McCarthy’s bet on Trump has yet to pay off as he scrambles for speaker’s gavel

Oops again.

Then there was this classic over at NBC News:

Trump’s endorsement proves worthless to Kevin McCarthy in his speaker bid

Really? Really? There aren’t enough washcloths in the NBC newsroom to wipe so much egg from the face of NBC’s peacock.

The real point here isn’t McCarthy. The real point here is that the media cannot help themselves when it comes to underestimating Trump. They did it repeatedly in 2016, then all throughout his presidency — and they are at it still. They never learn.

My favorite headline from 2016 came from this New York Times story that ran on election day:

Hillary Clinton has an 85% chance to win.

Riiiiiight.

The real question in all of this is how can supposedly sophisticated political observers get Trump wrong — and get him wrong repeatedly?

The answer is obvious. They let their left-wing politics — not to mention their obsessive Trump Derangement Syndrome — cloud their judgment. They live in a bubble, a bubble where colleagues, friends, and others share their TDS. And, tellingly, that obsession with Trump extends to his supporters, the millions of Americans who are routinely pictured in the left-wing media as a bunch of rubes, racists, and ignoramuses.

Once upon a time, way back there when Trump-style supporters were serious supporters of Democrat President Franklin Roosevelt, FDR would call them the “forgotten m[e]n.” Now, these “forgotten man” Americans are despised by far-left elites in the media.

As 2023 begins and the 2024 presidential election year rises on the horizon, it would do the media a world of good to spend some time taking stock of their reflexive Never Trumpism and its seriously bad influence on their resulting seriously bad judgment.

Will that happen? Of course not. They are too far gone.

And so, as Trump triumphs in McCarthy’s victory — a victory McCarthy himself is attributing to the former president — the media falls silent.

Of course.

Fact: Trump triumphed in the speaker’s race.

And Speaker McCarthy is the first to say so.

Which drives the fake news crazy.

READ MORE:

The Weakest Speaker

What Coverage of the Rogers–Gaetz Exchange Missed

Hakeem the Nightmare",https://spectator.org/category/politics/free-market/,2023-01-10
