title,text,url,published_time
"On Trump, Kanye, Biscuit, Jews, and Dinners - The American Spectator","I begin with certain definitions:

1. The Jew-hater formerly known as Kanye West now prefers to be called “Ye.” Therefore, for the duration of this article, I shall call him “Kanye.”

2. The White Supremacist, Holocaust-mocking Jew-hater who was ancillary to the unfortunate dinner at Mar-a-Lago has compared Jews murdered in the death camps to baked cookies. Therefore, for the duration of this article, I shall call him by the name “Biscuit.”

3. Donald John Trump is a Philosemite. You don’t hear that term often because not so many people, other than Bible Christians who believe that Genesis 12:3 is the Word of G-d, love Jews. But that’s what a Philosemite is: he or she loves Jews, even despite certain Jews (just as I do). “And I shall bless them that bless thee, and he that curseth thee shall I curse; and in thee shall all the families of the earth be blessed.”

Now to business:

I do not know why Donald Trump loves Jews. Maybe because more than 90 percent of Orthodox Jews voted for him against both Hillary and Joe Biden. Maybe because his daughter is an Orthodox Jew. Maybe because Jared Kushner, his son-in-law whom he loves and trusts, is an Orthodox Jew. Maybe because Trump’s grandchildren are Orthodox Jews who observe the Shabbat according to its laws, eat strictly kosher, and attend yeshiva Jewish parochial school. Or — my personal theory — maybe because his father, Fred, who was one of the great Philosemites of the prior generation and who even donated property to a Jewish congregation for them to have a synagogue, taught young Donald that part of the Trump Family Legacy is to love Jews.

When others refused to hire Jews, Trump did. (1) He opened the restricted Mar-a-Lago private club to Blacks and Jews when he bought it. (2) He surrounded himself with honorable Jewish legal scholars and attorneys like David Friedman and Jason Greenblatt, and even a bum named Michael Cohen, whose kid’s bar mitzvah he attended. In Israel, Trump would be elected prime minister by a landslide. After nearly half a century of broken promises by other American presidents, (3) Trump formally declared and America recognized United Jerusalem as Israel’s capital. (4) He moved America’s Israel embassy from Tel Aviv to Jerusalem. (5) He recognized Israeli sovereignty over the Golan Heights. (6) He recognized the permanent legality of all Jewish communities and cities (ridiculously called “settlements”) in Judea and Samaria (falsely called the “West Bank”) as legal in all situations that Israel’s own courts regard them as legal. (7) He cut off hundreds of millions of dollars’ funding for the Abu Mazen (Mahmoud Abbas) illegal government in the Palestine Authority on grounds that they pay monthly stipends (“Pay to Slay”) to families of Arab terrorists who murder Jews or otherwise perpetrate acts of terror. (8) He closed down the Palestine Liberation Organization office in Washington, D.C., (9) closed down America’s long-standing “Palestine” consulate in Jerusalem, (10) pulled the United States out of the anti-Semitic U.N. Human Rights Council, (11) cut off $300 million in funding that America had been sending to the Jew-hating UNRWA, a Jew-hating United Nations agency that runs schools in places like Gaza where Arab Muslim children are taught to hate Jews and to murder Jews; (12) appointed a U.N. ambassador, Nikki Haley, who warned anti-Israel countries that “We’re taking down names”; (13) commuted the anti-Semitic Iowa prison sentence of Sholom Rubashkin, (14) almost unilaterally brought about the Abraham Accords that induced several leading Arab Muslim countries for the first time to enter into true peace agreements with Israel without Israel ceding an inch of Jewish territory in Judea and Samaria. (15) His Secretary of Education, Betsy DeVos, endorsed yeshiva education during visits to two yeshivas in a New York City trip while skipping visiting the city’s public schools. Moreover, (16) Trump issued an executive order on combating anti-Semitism to enhance enforcement of Title VI of the Civil Rights Act, to protect Jewish college students from the overt Jew-hatred now rampant on so many American campuses, and (17) he named Kenneth Marcus as Assistant Secretary for Civil Rights at the Department of Education to investigate anti-Semitic episodes at campuses like Rutgers in New Jersey. (18) Trump deported the last Nazi war criminal known to be hiding in America, (19) signed into law a bill making it easier for Holocaust victims to reclaim stolen property, (20) ended the disastrous Iran deal and implemented crushing sanctions against Iran, (21) signed the Taylor Force Act, (22) knocked off Qassem Soleimani, (23) rubbed out Abu Bakr al-Baghdadi, (24) shattered State Department policy by authorizing Americans born in Jerusalem to list Israel on their American passports as their country of birth, (25) imposed sanctions on the International Criminal Court for unfairly and illegally investigating Israel, and (26) said at his 2019 State of the Union address “We must never ignore the vile poison of anti-Semitism or those who spread its venomous creed. With one voice, we must confront this hatred anywhere and everywhere it occurs.”

That is the definition of a lifelong Philosemite. Copy and paste the above paragraph, and email it or post it or re-tweet it to anyone who does not already know that Trump and his father were and are lifelong Philosemites, friends and admirers of Jews. Not to mention Ivanka and his grandkids.

But the left-wing news media say otherwise? Since when can we trust ABC, CBS, NBC, PBS, CNN, MSNBC, the New York Times, and the Washington Post? The New York Times, run by self-hating Jews who lean over backward to prove they are “neutral” on Jewish matters, covered up the Holocaust (as they did the Holodomor) and opposed the creation of Israel. This is documented all over the place.

When Trump first sought the Republican nomination for president in 2016, the media fell over themselves trying to prove Trump anti-Jewish. They found an Absolute Nobody, an activist for homosexual rights in New Jersey who very briefly was spokesman for an insignificant group named for the very significant Anne Frank, to go on CNN and other TV stations and be quoted in the New York Times for equating Trump with anti-Semitism. They twisted every possible Trump quote and gesture to have hidden meanings that only they could divine. It was like their obscene equating of Laura Ingraham with Nazism by showing a photo of her waving to an audience at the 2016 Republican convention, capturing a split second of the wave to make it look like a “Sieg Heil” Hitler salute.

It is a game of “Gotcha!” You say you are not an anti-Semite, so we will hire people whose job description will be to follow you, investigate you, and magnify-glass you until they can find their proof. And then, ah blessed Charlottesville! Take a pin-pointed picture of despicable White Supremacists and neo-Nazi-wannabes amid a hugely larger crowd of demonstrators seeking to deter the tearing down of historic monuments dedicated to heroes who fought for Virginia a century earlier, then catch Trump saying there were good people on both sides — because there were — and … Gotcha! Just a bit of editing and clipping, and it can be distorted to seem he was saying the Nazis were the good people to whom he was referring.

Lies. Damned lies. And more damned lies.

OK. So, uh, what was that quiet private Mar-a-Lago dinner with Kanye and Biscuit about?

I begin with a verse from First Samuel 15:17 when the prophet Shmuel (Samuel) confronted King Sha’ul (Saul) for not having fulfilled G-d’s command to eradicate the Amalekites. Sha’ul explained that he spared certain sheep, cattle, and Amalekite King Agag to accommodate the demands of the common people, and Shmuel said to him: “Although you may be insignificant in your own eyes, you are the head of the tribes of Israel, and G-d anointed you to be king of Israel.” In other words, your exalted position does not afford you the luxury to show compassion and sensitivity to embodiments of evil. If you wanted that flexibility to dine with Agag over Amalekite filet mignon and lamb chops, you should have stuck to building hotels and skating rinks in Bethlehem and Ḥevron, and golf courses and casinos in Shiloh and Bethel. But you became King of Israel. That changed your rules of engagement, whether you like it or not.

I understand why Trump agreed to meet with Kanye. Trump is running for President in 2024, and he benefits by maintaining an open line of communication with that mental case because Kanye potentially might split off votes from some Black Trump voters. But, if he had to meet with Kanye, Trump should have done it by inviting Kanye to a mano a mano working lunch in his private office behind closed doors. Frankly, since Kanye is a certified nut — a meshuggeneh — the better part of wisdom would have been (and would be, going forward) to steer clear of Kanye, and let him further self-destruct over the next two years until he hangs himself with laces from a pair of Yeezy sneakers.

Just sayin’.

In any event, Trump should not be meeting with the likes of Biscuit. I believe Trump a million percent when he says he didn’t know Biscuit or what that oddball stands for or against. I believe it because one of the most worldly and well-informed colleagues in my inner orbit of rabbinic leaders recently wrote me, off the record, to ask me whether I ever had heard of Biscuit and, if so, could I fill him in on who the fool is. So I did.

If that rabbi, a leading expert on identifying and responding to American anti-Semitism, never had heard of Biscuit, it is totally believable Trump did not either. Moreover, I ask myself (as every human being, and also every “Gotcha!” journalist, should): If I invite John Doe, whom I already know, to dinner, and Doe unexpectedly shows up with a guy he identifies as his friend Richard Roe — and it all catches me by surprise — what in the world am I realistically expected to do? Throw out the guy? I don’t even know who he is. No, I have to grit my teeth, maybe utter some imprecations under my breath, and then smile and ask the waiter to set up another place setting.

I challenge any other person, under oath and on a lie detector, to say he or she would do otherwise. I have seen uninvited people show up at family Thanksgiving dinners, brought by moronic family members who never thought to ask first. No one throws out such people. Rather, you set up an extra place setting, and next year you do not invite the family moron either. That was Trump’s dilemma with Biscuit.

Where Trump runs into trouble here is in two ways:

1. He has so much self-confidence in his own judgment and smarts, and so much distrust of others’ advice, that he leaves himself bereft of insightful advisors whom he truly can trust. For example, he trusted Paul Ryan on budgeting to build the wall, and look what happened. He trusted Rex Tillerson on foreign policy and “Mad Dog” on defense, and look where that got him. And that screwy Omarosa. Nevertheless, he needs to understand that, as President who was and who seeks to be again, he needs two or three people to advise him, to vet interlopers. I am not available because I am recovering from a lung transplant. My dear friend, Steve, would be great, but he recently moved to Israel. Ted Cruz is busy in the Senate watching McConnell, DeSantis is busy coloring Florida red and kicking the mouse’s patoot(ie) out of whoever now is running Disney. Maybe Mike Huckabee. Or my TAS colleague Jeffrey Lord. Or Ben Stein, another TAS colleague. Or Wlady. I also would love to see Steve Bannon back. But Trump needs a second opinion, just as we all do when we go to a doctor for a second opinion after we get a diagnosis (and the doctor says: “You want a second opinion? OK. You are ugly, too”). Had I been there, I would have told Trump: “Kanye is seriously mentally disturbed; just ask Taylor Swift. You cannot make a deal with him or even trust what he will tweet about a meeting. Stay away from him, or at least limit your time to a 15-minute closed-door working lunch. Bring plenty of hand sanitizer, and have a food taster present before you bite.” Then, when Biscuit showed up, I would have been at the next room or table and would have escorted Biscuit to my table — to get him away from Trump — if I did not recognize him. No way would I let him near my president without proper vetting. This is not voting in Arizona. Like, howzabout some I.D.? And since I would happen to be a good advisor, I would recognize Biscuit by name if not by face and have him escorted out of the building pronto. As a friendly gesture, I would give him a kosher-certified cookie on the way out, certified by Israel’s new Minister of Internal Security, the Hon. Itamar Ben-Gvir, every neo-Nazi-wannabe’s cookie monster.

2. Trump believes, as a guiding principle of business success, that he must never publicly apologize or acknowledge a possible misstep. This guiding principle is what Shakespeare professors call a “tragic flaw.” I remember an episode of The Apprentice where Trump unloaded a “You’re Fired!” on a guy who decently volunteered to share blame with someone else. Trump busted him because he believes a successful executive never sticks out his neck to acknowledge partial fault. This belief is tragic. For example, all he had to do after the Kanye-Biscuit dinner brouhaha was to tweet as follows:

“I despise anti-Semitism, and I despise anti-Semites. I told Kanye that, when he attacks Jews, he is attacking my Ivanka and my grandchildren, so he is attacking me. Either he retreats publicly — and fast — or he is permanently out of my orbit. I am disgusted to learn who [Biscuit] is and what [Biscuit] has said about the Holocaust and about Jews like my grandchildren. I am disgusted that Kanye associates with [Biscuit]. I have given orders today to have [Biscuit’s] photo posted in all my buildings because he is to be thrown out immediately if he ever shows up at any hotel, casino, or golf course of mine. And I will immediately fire any manager of a Trump property who fails to throw [Biscuit] out on his rump.”

That’s all Trump needs:

1. To have two or three trusted advisors he can consult when sticky situations arise;

2. The ability to acknowledge a misstep rapidly, without enabling his “Gotcha!” haters to pile on for days and weeks;

3. The gumption to tweet a no-holds-barred 128-word tweet like the one above.

If only. Sad.",https://spectator.org/category/politics/hither-and-yon/,2022-12-01
Republicans Are Missing the Point of Trump — Again - The American Spectator,"“It is rational to attack the police; nay, it is glorious. But the modern critics of religious authority are like men who should attack the police without ever having heard of burglars.”

— G.K. Chesterton, Orthodoxy

Casting about for someone to hold accountable after Republicans performed below expectations in the midterm elections, many Republicans offered a simple solution: Blame Trump.

“Trump stopped the wave,” said Jim Durkin, Illinois state House GOP leader.

“With regards to the governor’s office, there’s no way in a red year a candidate should lose by double digits…. And that really speaks to how poor our candidates were and how much Trump interfered in our primary process,” Pennsylvania Republican consultant David La Torre said.

“I think Trump’s kind of a drag on our ticket…. I think Donald Trump gives us problems, politically,” former Republican House Speaker Paul Ryan opined.

The sentiment has been echoed across the country. But this blithe dismissal of Donald Trump — and, by proxy, millions of Trump supporters — is misguided. To borrow Chesterton’s metaphor, Republicans are attacking the Trump police without ever having heard of the liberal authoritarian burglars that he was largely elected to stop.

We’ve seen this movie before. Rewind back to 2016. Mainstream Republicans back then didn’t like Trump either. So why did he win both the Republican nomination and the presidency? It’s actually not that complicated: People were tired of woke bullies bossing them about, and Donald Trump stood up to those bullies. He said he’d stand up to China even though people called him a racist for it. Trump said he’d stem the flow of immigration from Mexico, and he was roundly criticized. But he didn’t back down from the liberal media that relentlessly attacked him. Trump kept speaking his mind. In contrast, Establishment Republicans largely forgot about the lower middle class affected by these policies. Trump spoke to the forgotten class — spoke for them.

And it wasn’t just the lower middle class. There were plenty of people who were tired of the varied left-wing bullies in their world. For example, I and my colleagues ran a study right before the general election in 2016 where we randomly assigned some people to a “woke/political correctness” prime. The prime wasn’t especially overwhelming: Participants in that condition simply read a brief statement explaining PC norms and filled out a four-item questionnaire about political correctness. Without the prime, our left-leaning sample went for Clinton. But simply having people briefly answer questions about political correctness caused a significant shift towards Trump, so much so that it almost wiped out Clinton’s lead among an otherwise left-leaning group of people. Why? Making people think about wokeness made them long for freedom from wokeness, from liberal bullies, and, well, Trump was their anti-authoritarian champion. He was the person who stood up to the bullies on their behalf. Trump at least wasn’t afraid of those bullies — like much of the Republican Party seemed afraid of them.

Polling data from 2015/2016 confirm this. People often didn’t like what Trump said, but they liked that he wasn’t afraid to say it. In fact, the best predictor of Trump support in one poll wasn’t all the things people often think of — age, race, anti-immigration attitudes — it was “feeling voiceless.” Trump was their voice.

These reasons are even more important today. And if Republicans want to win moving forward, they need to better understand this fact. They need to more fully “get” Trump voters. They need to understand the metaphorical Trump police and the authoritarian burglars.

While of course many Republicans besides Trump have since stood up to woke bullies successfully — and with less offensive language — I worry that quite a few Establishment Republicans are still missing the point. Consider these comments made by Morgan Boyd, a Republican official in western Pennsylvania: “It’s time for [Trump] to pass the torch to more mainstream, traditional Republican candidates.”

There will be many people who hear these comments and respond: “You mean those traditional candidates who trashed the Tea Party and sneered at the lower-middle-class voters Trump brought into the GOP? You mean those traditional Republican presidential candidates (like Mitt Romney, who lost Pennsylvania by over 5 percentage points in 2012) who had lost Pennsylvania elections for 24 straight years — until Trump won the state in 2016?”

As a result, instead of trashing Trump, Republicans should instead attempt to fully understand his appeal. Brit Hume said on Fox News that Republicans’ problem is now to find a way to “work around” Trump. I’ve no end of respect for Hume, but I could not disagree more. That is the Republican mindset that implicitly dismisses the legitimate concerns that Trump addressed. You want to work around all the people who Trump brought to the party? You want to work around all the lower-middle-class people you ignored — but Trump didn’t? You want to work around all the political independents who didn’t often vote for traditional Republicans — but did vote for Trump?

No, you simply can’t work around them. You have to show them that, although you are moving past Trump, you are capturing Trumpism. You have to embrace the populist movement that appealed to freedom-loving people everywhere. You have to realize that there are a lot of people like me, who didn’t vote for Trump or who didn’t like him, but who nonetheless liked what he did for the country. To many of us, traditional Republicans supported the uber-rich and ignored the fact that their own constituents have to fear what they say at work or else be fired for merely expressing a political opinion that their colleagues don’t like. Establishment Republicans didn’t seem to do much for them — but Trump sure as heck did. Maybe we were wrong about Establishment Republicans, but it often feels as though they don’t seem to like the person who did the most for those bullied people. Comments like those discussed in this article solidify this feeling — and will ultimately make it harder for Republicans to keep many of the people Trump brought to the party.

So, yes, of course the fact that Trump raised questions about the legitimacy of elections hurt the GOP in the midterms. Trump’s opinion on that issue was a loser from the start, and it is still a loser today. Indeed, the midterms suggested that more Americans agreed with me about election security than I realized. They are tired of the whole “stolen election” talk on both sides of the aisle. Note that famous liberal election delegitimizer Stacey Abrams was roundly crushed in the midterms as well. Americans essentially said, to both parties, “Enough with all the election-questioning stuff.” (Maybe election skeptic Hillary Clinton should take note, too, if she really wants to make another run at the presidency.)

But while analyzing the effect of Trump’s statements on election legitimacy is of course reasonable, if Republicans think they can just pretend that “OK, that didn’t happen” with Trump and “work around” him — they will have another thing coming.

There obviously is a path forward here. Gov. Ron DeSantis won big in Florida and captured quite a lot of the Trump vote by embracing many of the same Trump policies without as much of the accompanying Trumpy baggage. Indeed, this and other similar conservative wins help instantiate this piece’s key lesson for Republicans throughout the country: This time, as Republicans wrestle with the issues posed by another Trump run at the presidency, they should remember that — for all his flaws — the former president spoke for a lot of average people tired of the bullies throwing them under the bus. I am one of those people, and, unless Republicans plan to stand up to those same bullies with equal force, unless they convince us that their politicians care about the same things we do, they are going to lose a lot of votes in the other direction in 2024. This should be at the front of every Republican’s mind in places like Pennsylvania, Arizona, Michigan, and Wisconsin. For many of us, we are tired of COVID lockdowns and masks and mandates and cancel culture and anti-science green-energy cults and (above all) the erosion of free speech in this country. We want to wake up in a free society, not this increasingly authoritarian dystopia that we find ourselves in.

Trump blasted many of those metaphorical burglars with loud trumpets. I can only hope “traditional” Republicans are listening.

Lucian G. Conway is a professor of Psychology and a Fellow with the Institute for Faith and Freedom at Grove City College.",https://spectator.org/category/politics/loose-canons/,2022-11-21
